AT	1455	N	Sandburg	TER	2804	Chicago	Illinois	60610	8008	Cook		299	299	243	Condo, High Rise (7+ Stories)	1	1965	09399368	CLSD		239000	227500	227500	239000	Cash	N/A	95%	95%	12	12	17042070861429	No			3593.30	None	2015	543	Yes	60	Yes	No		29		800	Estimated				E (East), City, Lake/Water, Park	4	1	1	0	1	0	1	0	1	Attached	None	None	Spectacular city & lake views in this sun-drenched spacious 1 bedroom condo in Old Town/Gold Coast. Unit features hardwood floors, crown molding, separate dining area, & wall-to-wall picture windows. Beautiful kitchen with granite counter tops & stainless steel appliances. Steps from bars, restaurants, coffee shops, grocery stores, parks, beaches, & so much more. Building includes a 24-hour doorman, sundeck, dry cleaners, laundry room, fitness room, receiving room, bike room, 2 pools, & tennis courts. Assessment includes heat, cable, Internet, & an extra storage space. Heated garage parking available for $140/month. The incredible views from this unit are a must see!	Special assessment for $5,800 for facade work has been paid in full by the seller. The total monthly HOA fee is $603 includes the master association fee of $60/month. Currently 60% owner occupied. No rental cap. Pet friendly building. Parking is $140/month.		2 (Window/Wall Unit)	Hot Water/Steam		Hardwood Floors, Storage	No	Oven/Range, Microwave, Dishwasher, Refrigerator, Freezer, Disposal		Bike Room/Bike Trails, Door Person, Coin Laundry, Elevator, Exercise Room, Storage, On Site Manager/Engineer, Park/Playground, Party Room, Sundeck, Pool-Outdoors, Receiving Room, Tennis Court/s, Valet/Cleaner, Curbs/Gutters, Gated Entry, Sidewalks, Street Lights, Street Paved	Heat, Water, Gas, Common Insurance, Security, Doorman, TV/Cable, Exercise Facilities, Pool, Exterior Maintenance, Lawn Care, Scavenger, Snow Removal, Wi-Fi, Internet Access	Community Specialists	Tiffany Seppelfrick	(312) 787-0800	60	Yes							Hardwood	TV-Cable, CO Detectors, Ceiling Fan		Stone	Hardwood	None	Hardwood				19X12	20X14	10X8		9X8	Foyer	Soaking Tub	Separate	Roof Deck, Cable Access	12/05/2016	12/16/2016	12/16/2016	01/04/2017	
AT	1455	N	Sandburg	TER	202	Chicago	Illinois	60610	8008	Cook		299	299	243	Condo	29	UNK	09521854	PEND		239900	239900		239900					9	9	17042070861350				3582.11		2015	569	Yes	63	No	No		2		800	Plans	0		0		4	1	1	0	1	0	1		1	Attached	None	None	The very sought after "02" floor plan. Newer stainless/ granite, beautiful kitchen. The  kitchen is opened to the living room and dining area. Just lovely.  The bathroom has also been upgraded with coordinating  kitchen  colors.  Large east facing balcony.  When trees are in bloom, it's like walking into a park setting.  Great space!  The southeast exposure allows good light all day.  This Estate Sale will not last!    * wait list to park in building. Alternative available.  Don't miss it...			2 (Window/Wall Unit)	Hot Water/Steam			No				Heat, Water, Security, Doorman, TV/Cable, Scavenger	Community Specialist	Tiffany Seppelfrick	(312) 787-0800														None					15X12	20X14	11X7		10X7	No additional rooms				03/05/2017	03/13/2017	03/13/2017		
AT	1455	N	SANDBURG	TER	302B	Chicago	Illinois	60610	8008	Cook	SANDBURG VILLAGE	299	299	243	Condo	29	1962	09174808	CLSD		185000	185000	185000	185000	Cash	N/A	100%	100%	3	3	17042070861351				2169.98	Homeowner, Senior	2014	607	No		Unknown	No		3		0	Not Reported				N (North), S (South), E (East)	4	1	1	0	1	0	1		1	Detached	None	None	True One Bedroom condo in Sandburg! Corner unit with loads of natural sunlight with North, South and East views. Spacious rooms and abundant closet space. Pet friendly building. Walk to everything in Old Town, Gold Coast and the Lake.	FHA approved, $150 move-in/out fee, $250 refundable elevator deposit. Two pets allowed per unit, rentals okay. Washer/dryer not allowed in unit. Waitlist for parking.		1 (Window/Wall Unit)	Baseboard			No	Oven/Range, Dishwasher, Refrigerator		Bike Room/Bike Trails, Door Person, Elevator, Exercise Room, Storage, On Site Manager/Engineer, Pool-Outdoors, Receiving Room	Heat, Air Conditioning, Water, Common Insurance, Doorman, TV/Cable, Exercise Facilities, Exterior Maintenance, Scavenger	Community Specialists	Linda	(312) 787-9538		Yes							Carpet			Carpet	Carpet	None	Carpet				14X12	18X12	10X8		9X7	No additional rooms		Combined w/ LivRm	Balcony	03/24/2016	03/26/2016	03/26/2016	04/28/2016	
AT	1455	N	SANDBURG	TER	1604	Chicago	Illinois	60610	8008	Cook	SANDBURG VILLAGE	299	299	243	Condo	1	1963	09196882	CLSD		239900	225000	225000	239900	Conventional	N/A	94%	94%	27	27	17042070861417				2851.53	None	2014	566	Yes	57	Yes	No		16		798	Landlord/Tenant/Seller				N (North), E (East)	5	2	2	0	1	0	1		1	Attached	None	None	Amazing views of the Lake and the city from this very bright 2 Br 1 BA unit in the Chicago Gold Coast! Perfect 'in town' or investment property. Newly renovated open kitchen with SS appliances, granite counters and breakfast bar. Recently renovated Bath with tile floor, shower surround and new vanity. Tons of closet space with Walk-in closet. Full amenity, pet friendly building with 2 Swimming pools, Tennis court, Doorman, Exercise room and inside parking. The best location in the city where Gold Coast, Lincoln Park and Old Town meet together. The Lake, public transport, night life and shopping at your door!			1 (Window/Wall Unit)	Forced Air, Radiators			No			Bike Room/Bike Trails, Door Person, Coin Laundry, Elevator, Exercise Room, Storage, On Site Manager/Engineer, Park/Playground, Sundeck, Pool-Outdoors, Receiving Room, Service Elevator, Tennis Court/s, Valet/Cleaner	Heat, Water, Common Insurance, Doorman, TV/Cable, Exterior Maintenance, Lawn Care, Scavenger, Snow Removal	Community Specialists	Linda	(312) 787-0800	54	Yes		Carpet					Carpet	TV-Cable, Ceiling Fan		Ceramic Tile	Carpet	None	Carpet	10X6			15X12	14X14	10X4		COMBO	No additional rooms				04/15/2016	05/11/2016	05/11/2016	06/30/2016	
AT	1455	N	Sandburg	TER	1802	Chicago	Illinois	60610	8008	Cook		299	299	243	Condo	29	1962	09209054	CLSD		267500	258500	258500	267500	Conventional	N/A	97%	97%	21	21	17042070861365				2850	Homeowner	2014	595	Yes	65	Yes	No		18		850	Estimated				S (South), E (East)	5	1	1	0	1	0	1	0	1	Attached	None	None	Live in the heart of Old Town with stunning views from this spacious corner 1 bedroom plus den Sandburg Village condo. This gorgeous renovation features newly refinished chestnut stained hardwood floors and crown molding. Beautiful new kitchen with  custom cabinetry, deep corner soaker sink, stainless steel appliances including dual zone wine fridge, custom glass/stainless backsplash, under cabinet lighting and quartz counter tops. Dine casually at your six foot breakfast bar or separate dining area. Huge bedroom with large closet and updated bath. Work from home in your private office space with custom shelving and barn door. Sweeping south and east view of the city and lake from your private balcony and living room. Tons of storage. All this in a full amenity building with 24 hour door service, fitness center, pool, and sundeck.  Walk to the heart of Old Town, Lincoln Park or the lake. Professional on site management. Heat and cable included! FHA approved.	Valet parking available immediately. $240 yearly fitness club membership. 1 dog or 2 cats allowed. FHA APPROVED!		2 (Window/Wall Unit)	Hot Water/Steam		Hardwood Floors, Storage	No	Oven/Range, Microwave, Dishwasher, Refrigerator, Disposal, Wine Cooler/Refrigerator		Door Person, Coin Laundry, Elevator, Storage, Health Club, On Site Manager/Engineer, Sundeck, Pool-Outdoors, Receiving Room, Service Elevator, Valet/Cleaner, Street Lights, Street Paved	Heat, Water, Common Insurance, Doorman, TV/Cable, Exterior Maintenance, Lawn Care, Snow Removal	Community Specialists	Tiffany	(312) 787-0800	82	Yes							Hardwood	TV-Cable		Porcelain Tile	Hardwood	None	Hardwood				14X12	19X13	10X6		10X6	Balcony, Office		Separate	Balcony, End Unit	04/28/2016	05/18/2016	05/18/2016	07/27/2016	
AT	1455	N	sandburg	TER	1705	Chicago	Illinois	60610	8008	Cook		299	299	243	Condo	29	1962	09197789	CLSD		189000	170000	170000	189000	Conventional	N/A	90%	90%	33	33	17042070861445				1843	Homeowner	2014	365	No		No	No		17		652	Estimated				W (West), City	4	1	1	0	1	0	1				None	None	One Bed one Bath in Great Location, Open Views and Great Light From This updated unit .  24 Hr Doorperson and storage closet included .Exercise Room Sun deck and swimming pool available to new Homeowner .Class A Building Walking Distance to Wells Street Restaurants, Shops, The Gold Coast and Lake. Garage parking available .			2 (Window/Wall Unit)	Forced Air, Hot Water/Steam			No			Bike Room/Bike Trails, Door Person, Coin Laundry, Exercise Room, Storage, On Site Manager/Engineer, Sundeck, Pool-Outdoors, Service Elevator, Valet/Cleaner	Heat, Air Conditioning, Water, Gas, Common Insurance, Security, Doorman, TV/Cable, Exterior Maintenance, Lawn Care, Scavenger, Snow Removal, Wi-Fi	Carl Sandburg	Tiffany Seppelfrick	(312) 787-0800														None					12X11	14X18	9X8		COMBO	No additional rooms				04/17/2016	05/19/2016	05/19/2016	06/29/2016	
AT	1455	N	SANDBURG	TER	409B	Chicago	Illinois	60610	8008	Cook	SANDBURG	299	299	243	Condo, High Rise (7+ Stories)	30	1963	09300023	CLSD		224900	252000	252000	224900	FHA	N/A	112%	112%	69	41	17042070861541				3437.69	None	2015	577	Yes	57	Yes	No		4		900	Estimated				N (North), W (West)	5	2	2	0	1	0	1	0	1	Attached	None	None	Spacious well laid out 2 bedroom, 1 bath condo. Sun-filled corner unit with tons of windows! Great Gold Coast/Old Town location! Walk to all of the amenities that this area has to offer! Updated kitchen with granite counters, tile back splash and stainless steel appliances. Condo has been freshly painted throughout and new bathroom light fixture installed.  Living room features hardwood floors and sliding doors to balcony.  Large master bedroom with West views overlooking the park. Building amenities include; sundeck, fitness room, outdoor pool, door person, dry cleaners and laundry room.	FHA approved, $150 move-in/out fee, $250 refundable elevator deposit. Two pets allowed per unit, rentals okay. Washer/dryer not allowed in unit. Waitlist for parking.     Please direct all inquiries to co-lister Cindy Gaffney 773-412-4063 cgaffney@atproperties.com		2 (Window/Wall Unit)	Electric		Hardwood Floors	No	Oven/Range, Microwave, Dishwasher, Refrigerator, All Stainless Steel Kitchen Appliances		Bike Room/Bike Trails, Door Person, Coin Laundry, Elevator, Exercise Room, Storage, On Site Manager/Engineer, Park/Playground, Pool-Outdoors, Receiving Room, Security Door Locks, Valet/Cleaner	Heat, Water, Common Insurance, Doorman, TV/Cable, Clubhouse, Exercise Facilities, Pool, Exterior Maintenance, Lawn Care, Scavenger	Sandburg Condo Association II	Manager	(312) 787-0800	82	Yes		Carpet								Ceramic Tile	Hardwood	None	Carpet	9X9			15X12	16X13	8X7		COMBO	No additional rooms		Combined w/ LivRm	Balcony	07/28/2016	09/06/2016	09/06/2016	09/06/2016	
AT	1455	N	Sandburg	TER	1708	Chicago	Illinois	60610	8008	Cook	BRYANT HOUSE	299	299	243	Condo	29	1962	09293973	CLSD		216300	216300	216300	216300	Cash	F	100%	100%	27	27	17042070861526				2821.03		2014	590	Yes	66	Yes	No		17		0	Not Reported					4	1	1	0	1	0	1				None	None	Bryant House corner unit with outstanding Lake Views!  Photos of City and Lake are from Living room and balcony.  Bldg was converted to Condo in 1979; some updates in this unit. Rental Parking is available; bus stop right out front. Great unit and is sold as is. Buyer may be responsible for fees to HOA per IL Condo Law.    "Employees of Bank of America or its affiliates or subsidiaries are strictly prohibited from directly or indirectly purchasing any property owned by Bank of America.”  Seller will likely exercise a 7-15 day market exposure time before responding to offers.	All offers must be submitted by the buyer’s agent using the online offer management system. Access the system via the link below. A technology fee will apply to the buyer’s agent upon consummation of a sale..     Offer link to property:  www.spsreo.com/?c=9818  Things:  submit complete packet using CAR 3-4 page condo contract- seller's addendum is 13 pages - provided upon acceptance  EM- Cashier's check - purchaser must be the remitter  Proof of Funds- Current, US$, in Purchaser's name  If Purchaser is an Entity, all documentation must be submitted with initial offer  Taxes are 100%; no possession escrow  Email any questions, comments, requests for appt.   Use forms and follow offer instructions  Special assessment is $6,231.00; Pkg available for $140 per month    2 cats or 1 dog - pet policy- Offer initially accepted an now waiting for all paperwork - noted under agent notices.		2 (Window/Wall Unit)	Radiators, Other			No				Water, Common Insurance, Doorman, Exterior Maintenance, Lawn Care	Community Specialists	Tiffany, Linda, Avi	(312) 787-0800	56													None					14X12	13X18	10X7		10X8	No additional rooms				07/20/2016	08/15/2016	08/15/2016	08/30/2016	
AT	1455	N	Sandburg	TER	904	Chicago	Illinois	60610	8008	Cook		299	299	241	Condo	28	1962	09375156	CLSD		229900	225000	225000	229900	Cash	N/A	98%	98%	10	10	17042070861411				3259	None	2015	544	Yes	0	No	No		9		800	Landlord/Tenant/Seller				E (East)	4	1	1	0	1	0	1		1	Attached	None	None	Gold Coast and Old Town! Tree Lined Street with East Facing City Views and Peeks of the Lake. Wall to Wall Picture Windows, this home gets tons of Natural Light. Oversized One Bedroom/One Bath, 800 sq ft, a Perfect Layout. Wood Floors, Track Lighting, Crown Molding, Custom Kitchen with great Storage and an Island with Ample Seating. Four Oversized Closets. The Building offers 24-hour door staff, dry cleaners, receiving room, laundry room, sundecks, swimming pools, parking, hospitality room, day care, storage lockers, bicycle room & exercise room.	See Floor Plan Under "Additional Information."		2 (Window/Wall Unit)	Gas, Hot Water/Steam		Hardwood Floors	No	Oven/Range, Microwave, Dishwasher, Refrigerator		Bike Room/Bike Trails, Door Person, Elevator, Exercise Room, Storage, On Site Manager/Engineer, Receiving Room, Curbs/Gutters, Sidewalks, Street Lights, Street Paved	Heat, Water, Common Insurance, Doorman, TV/Cable, Scavenger, Internet Access	Community Specialists	TBD	(312) 787-0800														None					19X12	19X14	18X10		COMBO	No additional rooms		Combined w/ LivRm	Roof Deck, Cable Access	10/25/2016	11/03/2016	11/03/2016	01/09/2017	
AT	1455	N	SANDBURG	TER	2807B	Chicago	Illinois	60610	8008	Cook		299	299	243	Condo, Studio	1	1962	09344840	CLSD		149000	149000	149000	149000	Cash	N/A	100%	100%	4	4	17042070861510				1843	Homeowner	2015	391	Yes	0	Unknown	No		28		650	Estimated				W (West)	2	0	0	0	1	0	1		1	Attached	None	None	Perfect ‘in town’ or investment property! Huge Convertible Studio with breathtaking West views from the 28th penthouse level floor. Can be easily turned into Jr.1 BR. What you have: the best location in city with Gold Coast, Lincoln Park & Old Town outside of your door. Full amenity, pet friendly bldg with 2 Swimming pools, Tennis court, Doorman, Exercise room, parking (in the bldg), public transport and the lake just minutes away. Clean original condition, new carpet.	AS IS, priced accordingly. Tub needs reglazing		1 (Window/Wall Unit)	Hot Water/Steam		Storage	No			Bike Room/Bike Trails, Door Person, Coin Laundry, Elevator, Exercise Room, Storage, On Site Manager/Engineer, Sundeck, Pool-Outdoors, Receiving Room, Service Elevator, Valet/Cleaner	Heat, Water, Common Insurance, Security, Doorman, TV/Cable, Exterior Maintenance, Lawn Care, Scavenger, Snow Removal	Community Specialists	Tiffany	(312) 787-0800		Yes								TV-Cable		Vinyl	Carpet	None						22X16	9X7			No additional rooms			Deck, Roof Deck, Tennis Court(s), Pool In-Ground	09/15/2016	09/18/2016	09/18/2016	10/24/2016	
AT	1455	N	Sandburg	TER	1004	Chicago	Illinois	60610	8008	Cook	Sandburg Village	299	299	243	Condo	24	UNK	09334309	CLSD		244000	217500	217500	229000	Cash	N/A	95%	89%	168	104	17042070861412				2300.42	Homeowner	2014	525	No		Yes	No		10		800	Estimated				E (East)	4	1	1	0	1	0	1		1	Attached	None	None	SPACIOUS & BRIGHT RENOVATED EAST-FACING ONE BEDRM.  OPEN KITCHEN W/ NEW CABS, GRANITE COUNTER TOPS, CUSTOM BACK SPLASH, STAINLESS STEEL APPLIANCES.  REAL HARDWOOD FLOORS IN THE MAIN LIVING AREA.  HUGE MASTER BEDROOM W/ ELFA CUSTOM CLOSETS.  BRAND NEW WALL A/C UNIT IN MAIN LIVING AREA. CUSTOM WINDOW TREATMENTS IN ALL ROOMS.  STUNNING EAST VIEWS OF CITY AND LAKE.  WALK TO THE BARS AND RESTAURANTS ON WELLS AND DIVISION.  WALK TO NORTH AVENUE BEACH!  EL OR BUS OPTIONS WITHIN STEPS FROM BUILDING, GROCERY STORES, CLEANERS, HARDWARE STORE, UPS, STARBUCKS & MORE. 24-HR DOORMAN, FITNESS ROOM, 2 POOLS & TENNIS COURTS. ASSESSMENT INCLUDES HEAT & CABLE & INTERNET. PARKING IS $140 PER MONTH. FHA APPROVED BUILDING. TERRIFIC UNIT IN MOVE IN CONDITION.  SELLER PAYS SPECIAL.	SPECIAL ASSESSMENT IS $5,247.00 SELLER WILL PAY AT CLOSING.    44% rented NO RENTAL CAP.		2 (Window/Wall Unit)	Gas, Hot Water/Steam		Storage	Yes	Oven/Range, Dishwasher, Refrigerator, All Stainless Steel Kitchen Appliances		Door Person, Coin Laundry, Elevator, Exercise Room, Storage, Park/Playground, Sundeck, Receiving Room, Service Elevator, Tennis Court/s, Curbs/Gutters, Sidewalks, Street Lights, Street Paved	Heat, Water, Common Insurance, Doorman, TV/Cable, Exterior Maintenance, Scavenger, Snow Removal	COMMUNITY SPECIALISTS	TIFFANY SEPPELFRICK	(312) 787-0800		Yes							Hardwood			Hardwood	Hardwood	Full	Carpet				16X11	20X14	09X08		COMBO	No additional rooms		Combined w/ LivRm		09/06/2016	12/18/2016	12/18/2016	12/30/2016	
AT	1455	N	Sandburg	TER	1702	Chicago	Illinois	60610	8008	Cook		299	299	243	Condo	29	1964	09343155	CLSD		255000	239000	239000	250000	Conventional	N/A	96%	94%	173	85	17042070861364				3312	Homeowner	2014	590	Yes	65	Yes	No		17		0	Not Reported				N (North), S (South), E (East), City, Lake/Water	5	1	1	0	1	0	1		1	Attached	None	None	Come home to this freshly painted, perfect Old Town/Gold Coast urbn oasis!Sunfilled high SE corner 1 bed + bonus room currently used as storage. Balcony & spectacular lake/city views! Finishes include new lighting, new outlets, new air conditioner, hardwood floors thruout & marble in foyer, kitchen & bath. SS appliances,maple cabinets, backsplash, granite counters.  Breakfast bar opens to large living/dining room w/2 full walls of SE facing windows boasts panormic city views-Perfect for entertaining! Professionally cleaned - Nothing to do but move-in-model perfect! Doorman, gym & more. FHA Approved.	Special assessment will be paid by sellers. Currently 66% owner occupied, no rental cap, pet friendly building. Total HOA fee is $656, which includes $65.69/month for Sandburg Master Association fees.		3+ (Window/Wall Unit)	Hot Water/Steam		Elevator, Hardwood Floors, Wood Laminate Floors, 1st Floor Full Bath, Storage	No	Oven/Range, Microwave, Dishwasher, Refrigerator, Freezer, All Stainless Steel Kitchen Appliances		Bike Room/Bike Trails, Door Person, Coin Laundry, Elevator, Exercise Room, Storage, Sundeck, Pool-Outdoors, Receiving Room, Tennis Court/s, Valet/Cleaner	Heat, Water, Gas, Common Insurance, Doorman, TV/Cable, Exterior Maintenance, Lawn Care, Scavenger, Snow Removal	Community Specialists	Tiffany Seppelfrick	(312) 787-0800									Hardwood			Marble	Hardwood	None	Wood Laminate				15X12	20X14	11X07		10X07	Bonus		Separate	Balcony	09/15/2016	12/08/2016	12/08/2016	01/06/2017	
AT	1455	N	Sandburg	TER	2006B	Chicago	Illinois	60610	8008	Cook	Sandburg	299	299	243	Condo, High Rise (7+ Stories)	31	1962	09472194	CLSD		239000	235000	235000	239000	Conventional	N/A	98%	98%	11	11	17042070861475				3475.05	None	2015	612	Yes	0	Yes	No		20		850	Estimated	0		0	E (East), City, Lake/Water	4	1	1	0	1	0	1	0	1	Attached	None	None	Stunning designer rehab of entire condo. Included is:  Hdwd floors throughout,  kitchen, SS appliances, dishwasher, microwave,  cabinets, wine cooler, kitchen and hall floors, bathroom vanity, marble tile floor,  lighting,  tub surround is subway tile, all lighting throughout, fresh paint,  ac units,  window treatments. Doorman, heat included, sundeck, workout room, bike room.  Pool/tennis	Special assessment for $5,500 for facade work will be paid in full by the seller at closing The total monthly Assessment fee is $612.28 ncludes the master association fee of $60.64. Currently 60% owner occupied. No rental cap. Pet friendly building. Parking is $150/month.		2 (Window/Wall Unit)	Hot Water/Steam		Hardwood Floors, Storage	No	Oven/Range, Microwave, Dishwasher, Refrigerator		Bike Room/Bike Trails, Door Person, Coin Laundry, Elevator, Exercise Room, Storage, On Site Manager/Engineer, Party Room, Sundeck, Pool-Outdoors, Receiving Room, Service Elevator, Tennis Court/s, Sidewalks, Street Lights, Street Paved	Heat, Water, Common Insurance, Security, Doorman, TV/Cable, Exterior Maintenance, Lawn Care, Scavenger, Snow Removal, Internet Access	COMMUNITY SPECIALISTS	Tiffany or Avi	(312) 787-0800	60	Yes							Hardwood			Hardwood	Hardwood	Shared	Hardwood				16X11	20X14	10X8		9X8	No additional rooms		Separate	Deck, Storage Shed, Tennis Court(s), Pool In-Ground, Cable Access	01/06/2017	01/16/2017	01/16/2017	02/10/2017	
RN	1455	N	SANDBURG	TER	1208	Chicago	Illinois	60610	8008	Cook	BRYANT HOUSE	299	299	243	High Rise (7+ Stories)	29	1963	09501637	ACTV										48	48														12		800	Other	0		0	N (North), E (East), City, Lake/Water, Park	4	1	1	0	1	0	1	1	1	Attached	None	None	PREMIER NE CORNER 1 BED WITH BALCONY & PANORAMIC VIEWS. UPDATED UNIT WITH HARDWOOD FLOORS, FPL IN LIVING ROOM, OPEN KITCHEN, GRANITE COUNTERS IN KITCHEN & BATH AND GRANITE ON ALL THE WINDOW LEDGES. UNIT SHOWS BEAUTIFULLY. AMPLE CLOSETS & STORAGE UNIT. FULL AMENITY BLDG WITH 24HR DOORPERSON. SHORT WAIT FOR PKG. NO PETS, NO SMOKING. TENANT OCCUPIED/NOTICE REQUIRED.	MOVE-IN MON-FRI $150. SAT $250. NO SUNDAY MOVES.		2 (Window/Wall Unit)	Gas, Hot Water/Steam		Hardwood Floors	No	Oven/Range, Microwave, Dishwasher, Refrigerator		Bike Room/Bike Trails, Door Person, Coin Laundry, Elevator, Exercise Room, Storage, On Site Manager/Engineer, Sundeck, Pool-Outdoors, Receiving Room, Service Elevator, Tennis Court/s, Curbs/Gutters, Sidewalks, Street Lights		COMMUNITY SPECIALISTS	OVE OR TIFFANY	(312) 787-0800									Hardwood			Ceramic Tile	Hardwood	None	Hardwood				15X12	19X13	11X7		11X7	Balcony		Separate	Balcony, End Unit	02/12/2017				
AT	1455	N	Sandburg	TER	2507	Chicago	Illinois	60610	8008	Cook		299	299	224	Condo	29	UNK	09570510	PEND		174900	174900		174900					4	4	17042070861507				2883		2015	403	Yes	403	No	No		25		550	Estimated	0		0	W (West)	4	1	1	0	1	0	1		1	Attached	None	None	Lovely Jr One bed. Fully equipped kitchen, new carpet installed t/o, wood blinds on all windows. Shows just beautifully. Vacant.			1 (Window/Wall Unit)	Hot Water/Steam			No				Heat, Common Insurance, Doorman, TV/Cable, Scavenger	Chicagoland	Tiffany	(312) 787-0800														None					11X11	11X17	8X7		COMBO	No additional rooms				03/20/2017	03/23/2017	03/23/2017		
AT	1455	N	SANDBURG	TER	1206B	Chicago	Illinois	60610	8008	Cook		299	299	243	Condo		1962	06428437	CLSD		219900	208000	208000	219900	Conventional		95%	95%	17	17	17042070861468	No			1646.99	None	2005	452	No		No			12		0	Not Reported				E (East)	4	1	1	0	1		1		1	Attached	None		Terrific East views from this large one bedroom with  separate dining area. Unit comes complete w/ wood floors in living and dining room. Recently upgraded kitchen has newer maple cabinets,countertops,appliances and ceramic tile. Modern bath has Kohler toilet and newer vanity. All of this located in a building w/ 24hr doorman, on-site mgmt & fitness room!  Ideal location - Beautiful home in a great building!			2 (Window/Wall Unit)	Hot Water/Steam				Oven/Range, Dishwasher, Refrigerator		Bike Room/Bike Trails, Door Person, Coin Laundry, Elevator, Storage, Sundeck, Pool-Outdoors, Receiving Room, Service Elevator, Tennis Court/s	Heat, Water, Gas, Common Insurance, Doorman, Exterior Maintenance, Lawn Care, Scavenger, Snow Removal												Wood Laminate			Ceramic Tile	Wood Laminate	None	Carpet				16X11	20X14	10X08		08X08			L-shaped		03/05/2007	03/21/2007	03/21/2007	06/29/2007	
AT	1455	N	SANDBURG	TER	2705	Chicago	Illinois	60610	8008	Cook	SANDBURG TERRACE	299	299	243	Condo			06442082	CLSD		194900	191250	191250	194900	Conventional		98%	98%	5	5	17042070861511	No			NEW	None	2005	312	No		No			27		600					W (West)	4	1	1	0	1		1		1		None	None	ENJOY BEAUTIFUL SUNSETS FROM THIS HIGHLY UPGRADED GOLD COAST ONE BEDROOM CONVERSION. STAINLESS STEEL APPLIANCES INCLUDING DISHWASHER, PULL OUT CABINETS DRAWERS W/UNDERMOUNT LIGHTING, GRANITE ISLAND AND COUNTERTOPS COMPLETE THIS SPACE. FULL AMENITY BUILDING: 24HR DOORMAN, TWO POOLS, EXERCISE ROOM, VALET PARKING.			1 (Window/Wall Unit)	Gas, Hot Water/Steam, Radiators				Oven/Range, Dishwasher, Refrigerator		Bike Room/Bike Trails, Door Person, Coin Laundry, Elevator, Exercise Room, Storage, Party Room, Sundeck, Pool-Indoors, Pool-Outdoors, Receiving Room, Security Door Locks, Service Elevator, Tennis Court/s, Valet/Cleaner	Heat, Water, Gas, Common Insurance, Security, Doorman, TV/Cable, Exterior Maintenance, Lawn Care, Scavenger, Snow Removal												Carpet	TV-Cable		Ceramic Tile	Carpet	None					12X12	13X15	10X12		COMBO			Combined w/ LivRm		03/15/2007	03/19/2007	03/19/2007	05/18/2007	
