AT	1455	N	Sandburg	TER	1606	Chicago	Illinois	60610	8008	Cook	SANDBURG VILLAGE	299	299	324	Condo, High Rise (7+ Stories)	29	1963	08694174	CLSD		227000	218000	218000	225000	Conventional	N/A	97%	96%	219	219	17042070861471				2345	Homeowner	2013	557	No		No	No		16		0	Not Reported				E (East), City, Lake/Water	4	1	1	0	1	0	1		1	Attached	None	None	Beautifully appointed, spacious one bedroom in fabulous neighborhood.  East exposure with city & lake views.  De Giulio kitchen w/marble, stainless, Subzero, Decor, Meile.  Hardwood floors throughout. Wood, plantation blinds. doorman, sundeck, fitness room, storage & cleaners. 2 pools, tennis, & market in complex. Walk to park, lake, shopping, restaurants, bus, and subway.			2 (Window/Wall Unit)	Hot Water/Steam		Hardwood Floors	No	Oven/Range, Microwave, Dishwasher, Refrigerator, High End Refrigerator, All Stainless Steel Kitchen Appliances		Bike Room/Bike Trails, Door Person, Coin Laundry, Elevator, Exercise Room, Storage, On Site Manager/Engineer, Park/Playground, Party Room, Sundeck, Pool-Outdoors, Receiving Room, Service Elevator, Valet/Cleaner	Heat, Water, Common Insurance, Doorman, TV/Cable, Exterior Maintenance, Lawn Care, Scavenger, Snow Removal	Community Specialists	Katy Jarette	(312) 787-0800									Hardwood			Ceramic Tile	Hardwood	None	Hardwood				16X11	20X14	10X08		09X08	No additional rooms		Separate, L-shaped	Tennis Court(s), Pool In-Ground	08/06/2014	03/12/2015	03/12/2015	04/16/2015	
AT	1455	N	Sandburg	TER	502	Chicago	Illinois	60610	8008	Cook		299	299	243	Condo	29	UNK	08695518	CLSD		219900	198500	198500	205900	Cash	N/A	96%	90%	65	65	17042070861353				3054		2013	587	No		No	No		5		800	Builder				S (South), E (East)	4	1	1	0	1	0	1		1	Attached	None	None	Fabulous "02 floorplan.  Rarely available.  Large southeast corner  unit with a balcony.  See a sea of beautiful trees, from these very large  windows.  Beautiful opened up stainless/steel appliances,  kitchen.  This unit is priced to sell! Don't miss it.  24/48/hours to show. Tenant occupied until 8/20th.	Move in Fee $150 Monday – Friday, and $250 on Saturday (no Sunday)   $250 Security deposit (refundable)		2 (Window/Wall Unit)	Hot Water/Steam			No				Heat, Doorman, TV/Cable																	None					15X12	19X14	11X7		11X7	No additional rooms				08/07/2014	10/10/2014	10/10/2014	10/21/2014	
AT	1455	N	Sandburg	TER	2702	Chicago	Illinois	60610	8008	Cook		299	299	243	Condo	28	1963	08724131	CLSD		229000	215000	215000	229000	Conventional	N/A	94%	94%	10	10	17042070861374				3416.14		2013	656	No		No	No		27		0	Not Reported				S (South), E (East)	4	1	1	0	1	0	1		1	Attached	None	None	High floor SE corner - with great views and large private balcony.  Open kitchen with island. Big bedroom, lots of closet space - great bath w/glass tile and frame-less glass shower.  Building features pool, sun deck, exercise room, 24hr doorman - walk to lakefront and Old Town. Red Line El 2 blocks away.	Owner is Illinois licensed real estate agent.		2 (Window/Wall Unit)	Radiators			No	Oven/Range, Microwave, Dishwasher, Refrigerator			Heat, Water, Common Insurance, Security, Doorman, Snow Removal	Community Specialists	Katy Sarette	(312) 787-0800									Carpet			Ceramic Tile	Carpet	None					11X15	11X16	11X13		09X08	No additional rooms		Separate	Balcony, Pool In-Ground	09/10/2014	09/19/2014	09/19/2014	10/27/2014	
AT	1455	N	SANDBURG	TER	1904	Chicago	Illinois	60610	8008	Cook	SANDBURG VILLAGE	299	299	243	Condo, High Rise (7+ Stories)	29	1965	08732706	CLSD		199900	195000	195000	199900	Conventional	N/A	98%	98%	186	32	17042070861420				2842	None	2013	545	Yes	545	No	No		19		800	Other				E (East), Lake/Water	4	1	1	0	1	0	1		1	Attached	None	None	Wow!  What a deal.  This lovely apartment customized beautifully is priced to sell now.  Stainless/granite kitchen and more.  East views.  Don't miss it....  24/48 hrs prior notice.  Mo/month tenant.			2 (Window/Wall Unit)	Hot Water/Steam		Storage	No	Oven/Range, Microwave, Dishwasher, Refrigerator		Bike Room/Bike Trails, Door Person, Coin Laundry, Elevator, Exercise Room, Storage, On Site Manager/Engineer, Pool-Outdoors, Receiving Room, Security Door Locks, Service Elevator, Tennis Court/s	Heat, Water, Doorman, TV/Cable, Exterior Maintenance, Lawn Care, Scavenger, Snow Removal	Community Specialists	Katy Jarette	(312) 757-0800	80	Yes							Hardwood	TV-Cable		Other	Hardwood	Shared	Carpet				17X11	20X14	10X8		9X8	No additional rooms		L-shaped		09/19/2014	10/20/2014	10/20/2014	11/21/2014	
AT	1455	N	SANDBURG	TER	601	Chicago	Illinois	60610	8008	Cook		299	299	243	Condo, High Rise (7+ Stories)	29	1963	08747424	CLSD		225000	220000	220000	225000	Conventional	N/A	98%	98%	23	23	17042070861327				2843.85		2013	550	No		No	No		6		0	Not Reported					4	1	1	0	1	0	1		1	Attached	None	None	"Heart of the Gold Coast!" Stunning rehabbed corner unit. Spacious 1 bdrm., 1bth., with ample closet space.High end finishes,open floor plan, Hardwd floors throughout and balcony. A chefs, dream kitchen w granite counters and higher end appliances! Beautiful stone and granite bathrm. Bedrm with built in desk and shelves. A quality condo to call home. Beautiful tree top & city views.   A must see!	owner must apply for garage space. Dining Rm Chandelier is excluded.		3+ (Window/Wall Unit)	Hot Water/Steam		Hardwood Floors, Storage	No	Oven/Range, Microwave, Dishwasher, Refrigerator, Freezer, All Stainless Steel Kitchen Appliances		Bike Room/Bike Trails, Door Person, Coin Laundry, Elevator, Exercise Room, Storage, On Site Manager/Engineer, Park/Playground, Party Room, Sundeck, Pool-Outdoors, Receiving Room, Service Elevator, Tennis Court/s, Valet/Cleaner, Curbs/Gutters, Sidewalks, Street Lights, Street Paved	Heat, Water, Common Insurance, Doorman, TV/Cable, Exterior Maintenance, Lawn Care, Scavenger, Snow Removal	Community Specialists	Latonya Sims	(312) 787-0800		Yes							Hardwood			Hardwood	Hardwood	Full	Hardwood				15X12	14X19	11X7		COMBO	No additional rooms	Separate Shower		Balcony, Roof Deck, End Unit	10/07/2014	10/29/2014	10/29/2014	01/07/2015	
AT	1455	N	SANDBURG	TER	2605	Chicago	Illinois	60610	8008	Cook		299	299	243	Condo, Studio	1	1962	08765605	CLSD		179000	153000	153000	169900	Cash	N/A	90%	85%	68	68	17042070861454				1429.80	Homeowner	2013	367	Yes	39	No	No		26		550	Plans				W (West)	2	0	0	0	1	0	1		1	Attached	None	None	Perfect ‘in town’ or investment property! Huge Convertible Studio with breathtaking West views from the 26th floor. Can be easily turned into Jr.1 BR. What you have: the best location in city with Gold Coast, Lincoln Park & Old Town outside of your door. Full amenity, pet friendly bldg with 2 Swimming pools, Tennis court, Doorman, Exercise room, parking (in the bldg), public transport and the lake just minutes away.	Please allow 24 hours for showings. Unit is tenant occupied.		1 (Window/Wall Unit)	Hot Water/Steam, Radiators			No			Bike Room/Bike Trails, Door Person, Coin Laundry, Elevator, Exercise Room, Storage, On Site Manager/Engineer, Sundeck, Pool-Outdoors, Receiving Room, Service Elevator, Valet/Cleaner	Heat, Water, Common Insurance, Doorman, TV/Cable, Exterior Maintenance, Lawn Care, Scavenger, Snow Removal	Community Specialists	Katy M. Jarrette	(312) 787-0800	54	Yes								TV-Cable		Vinyl	Carpet	None						22X16	9X7			No additional rooms				10/30/2014	01/05/2015	01/05/2015	01/15/2015	
AT	1455	N	Sandburg	TER	2701	Chicago	Illinois	60610	8008	Cook	SANDBURG VILLAGE	299	299	241	Condo, High Rise (7+ Stories)	29	1963	08796024	CLSD		249900	245000	245000	249900	Conventional	N/A	98%	98%	5	5	17042070861347				2730.96	Homeowner	2013	551	Yes	65	No	No		27		850	Landlord/Tenant/Seller				S (South), W (West), City, Lake/Water	3	1	1	0	1	0	1	0	1	Attached	None	None	GOLD COAST GEM WON'T LAST LONG-Gut rehabbed corner unit with breathtaking views of the city. Upgrades include: bamboo floors, high-end s/s appliances, custom cabinetry, breakfast bar, glass tile bathroom with walk-in rain shower, 4 custom closets including walk-in closet in master and custom blinds. Sought after Sandburg Village features 2 pools, tennis courts, gym, doorman, onsite management & much more!	Healthy Building-over 2 million in reserves, 82% owner occupancy, can be rented. Almost penthouse level. High-end gut rehab. Open house Sunday from 4:00-6:00. Will not last long.		3+ (Window/Wall Unit)	Hot Water/Steam		Elevator, Hardwood Floors, Storage	No	Oven/Range, Microwave, Dishwasher, High End Refrigerator, Freezer, All Stainless Steel Kitchen Appliances		Bike Room/Bike Trails, Door Person, Coin Laundry, Elevator, Exercise Room, Storage, On Site Manager/Engineer, Park/Playground, Party Room, Sundeck, Pool-Outdoors, Receiving Room, Security Door Locks, Service Elevator, Tennis Court/s, Valet/Cleaner, Curbs/Gutters, Gated Entry, Sidewalks, Street Lights, Street Paved	Heat, Water, Common Insurance, Security, Doorman, TV/Cable, Exercise Facilities, Pool, Exterior Maintenance, Lawn Care, Scavenger, Snow Removal, Other	Community Specialists	LaTonya Sims	(312) 787-0800	82	Yes							Hardwood			Hardwood	Hardwood	None	Carpet				15X12	14X19	12X9			Foyer	Separate Shower	Combined w/ LivRm		12/03/2014	12/07/2014	12/07/2014	01/16/2015	
AT	1455	N	Sandburg	TER	1207	Chicago	Illinois	60610	8008	Cook		299	299	243	Condo	29	1962	08808440	CLSD		175000	169000	169000	175000	Conventional	N/A	97%	97%	60	5	17042070861495				1788.37		2013	348	No		No	No		12		650	Estimated				W (West), City	4	1	1	0	1	0	1		1	Attached	None	None	Newly renovated One Bedroom Condominium. This updated unit is move-in-ready. Kitchen features new SS Appliances, Stove, Refrigerator, Microwave hood. Wood kitchen cabinets with undercabinet lighting and granite countertops. Living room and bedroom areas feature Pergo wood flloring. Bathroom has designer vanity, new Americast tub and Kohler toilet. Sunny western exposure with picture windows include Bali shades	Unit is move-in ready. Easy to show. Outstanding Rental or Owner/User Property close to everything in the City		1 (Window/Wall Unit)	Hot Water/Steam			No			Bike Room/Bike Trails, Door Person, Coin Laundry, Elevator, Exercise Room, Storage, On Site Manager/Engineer, Sundeck, Pool-Outdoors, Receiving Room, Service Elevator	Heat, Water, Common Insurance, Doorman, TV/Cable, Scavenger, Snow Removal	Community Specialists	Katy Jarrette	(312) 787-0800		Yes							Wood Laminate			Porcelain Tile	Wood Laminate	None	Wood Laminate				11X11	18X11	9X8		COMBO	No additional rooms				01/02/2015	01/06/2015	01/06/2015	02/10/2015	
AT	1455	N	SANDBURG	TER	1203	Chicago	Illinois	60610	8008	Cook	SANDBURG VILLAGE	299	299	243	Condo, Studio	29	1963	08873429	CLSD		160000	157000	157000	160000	Conventional	N/A	98%	98%	7	7	17042070861387				1767	None	2013	349	No		No	No		12		0	Not Reported				W (West)	2	0	0	0	1	0	1	0	1	Attached	None	None	Jumbo, Bright & sunny convertible w/ great unobstructed view of city & its awesome sunsets. Newer blinds, carpet & a/c unit. Full amenity bldg w/ exercise rm, sundeck, 24 hr dm, bike rm, storage, onsite property mgr, seasonal membership to pool & Tennis crts! Heat & cable incl in assmt. Rental pkg onsite. Close to Red Line, restaurants, Lake & Park. You are in the heart of the Goldcoast/Old Town! Do not miss out!	Property Currently Tenant Occupied.  48 Hour Notice Required.		1 (Window/Wall Unit)	Gas, Hot Water/Steam		Storage	No	Oven/Range, Refrigerator		Bike Room/Bike Trails, Door Person, Coin Laundry, Elevator, Exercise Room, Storage, On Site Manager/Engineer, Party Room, Sundeck, Pool-Outdoors, Receiving Room, Security Door Locks, Service Elevator	Heat, Water, Gas, Common Insurance, Security, Doorman, TV/Cable, Exterior Maintenance, Lawn Care, Scavenger, Snow Removal	Carl Sandburg Condominium Association II	Latonya Sims	(312) 787-0800	82	Yes								Ceiling Fan		Hardwood	Carpet	None						17X11	09X08			No additional rooms		Combined w/ LivRm	Roof Deck, Tennis Court(s), Pool In-Ground	03/27/2015	04/02/2015	04/02/2015	05/04/2015	
AT	1455	N	SANDBURG	TER	802B	Chicago	Illinois	60610	8008	Cook	SANDBURG VILLAGE	299	299	244	Condo	30	1962	08928915	CLSD		149900	145500	145500	149900	Cash	N/A	97%	97%	7	7	17042070861356				3103	Senior	2013	610	No		No	No		8		700	Other					4	1	1	0	1	0	1				None	None	Great views, amazing balcony.  Needs a good amount of work.			1 (Window/Wall Unit)	Baseboard			No	Oven/Range, Refrigerator		Bike Room/Bike Trails, Door Person, Elevator, Exercise Room, Storage, On Site Manager/Engineer, Pool-Outdoors, Receiving Room, Curbs/Gutters	Heat, Water, Common Insurance, Doorman, Exterior Maintenance, Scavenger, Snow Removal	N/A	N/A	(000) 000-0000									Carpet			Carpet	Carpet	None	Carpet				14X12	12X18	10X8		9X7	No additional rooms		Combined w/ LivRm	Balcony	05/20/2015	05/26/2015	05/26/2015	06/17/2015	
AT	1455	N	Sandburg	TER	2304	Chicago	Illinois	60610	8008	Cook	SANDBURG VILLAGE	299	299	243	Other	244	1963	08955768	CLSD		230000	212500	212500	215000	Conventional	N/A	99%	92%	128	128	17042070861424				2427.41		2013	514	Yes	58	Unknown	No		23		822	Other					4	1	1	0	1	0	1				None	None	Spectacular panoramic city views.The best location in city w/ GC,Lincoln Park & Old Town nbhds outside of your door.Bright sunny condo featuring huge windows,crown molding, Wilsonart Brazilian Cherry flooring,granite countertops.Full amenity bldg 24-hour doorman,ft ctr,sundeck, bike room,2 outdoor pools,ten courts. Cable/heat included.Garage parking available. Near shops,rest,lake,park,public trans.	Property is vacant. Easy show. Please see attachment on the amenities additional fee for the bldg. Furniture negotiable.	0	1 (Window/Wall Unit)	Other			No	Oven/Range, Dishwasher, Refrigerator		Bike Room/Bike Trails, Door Person, Elevator, Exercise Room, Storage, On Site Manager/Engineer, Sundeck, Pool-Outdoors, Receiving Room, Tennis Court/s, Curbs/Gutters	Heat, Water, Common Insurance, Doorman, Exterior Maintenance, Scavenger				82								Hardwood				Hardwood	Shared	Hardwood				14X12	12X18	10X8		9X7	No additional rooms		Combined w/ LivRm	Roof Deck, Tennis Court(s)	06/16/2015	10/21/2015	10/21/2015	12/10/2015	
AT	1455	N	SANDBURG	TER	802B	Chicago	Illinois	60610	8008	Cook	SANDBURG VILLAGE	299	299	324	Condo, High Rise (7+ Stories)	28	1963	09017760	CLSD		265000	258500	258500	265000	Conventional	N/A	98%	98%	14	14	17042070861356				3166		2014	612	No		No	No		8		0	Not Reported				N (North), E (East), City, Park	5	2	2	0	1	0	1	0	1	Attached	None	None	Beautifully renovated 2Bed/1Bath + Den with large East and South facing balcony showcasing the city skyscrapers! Professionally designed kitchen with SS appliances This unit sells itself, and is a must see.  Pet friendly building with a 24 hour doorman.  Please contact George with showing requests.	For showings, please contact:    George Kamberos – 708.307.6812  gkamberos@perlmortgage.com    Tessa Kamberos – 708.945.1463  tkamberos@dreamtown.com		3+ (Window/Wall Unit)	Hot Water/Steam			No	Oven/Range, Microwave, Dishwasher, Refrigerator		Bike Room/Bike Trails, Door Person, Coin Laundry, Elevator, Exercise Room, Storage, Health Club, On Site Manager/Engineer, Sundeck, Pool-Outdoors, Receiving Room, Service Elevator, Valet/Cleaner	Heat, Water, Common Insurance, Doorman, TV/Cable, Exterior Maintenance, Lawn Care, Scavenger, Snow Removal	Sanburg Association II	Property Manager	(312) 787-0800		Yes		Hardwood					Hardwood	TV-Cable		Hardwood	Hardwood	None	Hardwood	10X9			14X12	14X16	10X11		COMBO	Balcony, Foyer		Combined w/ LivRm	Deck, Storms/Screens, End Unit	08/20/2015	09/02/2015	09/02/2015	10/19/2015	
AT	1455	N	SANDBURG		1107B	Chicago	Illinois	60610	8008	Cook		299	299	243	Condo, High Rise (7+ Stories)	29	1962	09042879	CLSD		149900	136500	136500	149900	Cash	N/A	91%	91%	25	25	17042070861494				1311.08		2014	346	No		No	No		11		0	Not Reported				W (West), City	4	1	1	0	1	0	1				None	None	LARGE JR ONE BEDROOM READY FOR REHAB. EXCELLENT OPPORTUNITYH IN A WELL MANAGED BUILDING IN GREAT LOCATION BETWEEN OLD TOWN AND GOLD COAST. CURRENTLY WALL IS DOWN, ADD THE WALL AND YOU CAN HAVE A NICE ONE BEDROOM APARTMENT. PRICED TO SELL. BUILDING OFFERS 24 HR DOORMAN, POOL, EXERCISE, REC RM, AN ON SITE MANAGER.			1 (Window/Wall Unit)	Hot Water/Steam			No	Oven/Range, Refrigerator		Bike Room/Bike Trails, Door Person, Coin Laundry, Elevator, Exercise Room, Storage, On Site Manager/Engineer, Sundeck, Pool-Outdoors, Receiving Room, Service Elevator	Heat, Water, Common Insurance, Doorman, TV/Cable, Exercise Facilities, Scavenger, Snow Removal	COMMUNITY SPECIALISTS	KATY JARRETTE - LYNN ON SITE	(312) 787-0800									Hardwood				Hardwood	None	Hardwood				11X11	18X11	9X8		COMBO	No additional rooms		Combined w/ LivRm		09/18/2015	10/12/2015	10/12/2015	10/28/2015	
AT	1455	N	SANDBURG	TER	1609	Chicago	Illinois	60610	8008	Cook	SANDBURG VILLAGE	299	299	243	Condo	29	1963	09040196	CLSD		210000	199000	199000	207000	Conventional	N/A	96%	95%	34	34	17042070861552				2614.68	Homeowner	2014	597	No		Yes	No		19		825	Estimated				N (North), E (East)	4	1	1	0	1	0	1		0	Attached	None	None	VERY SPACIOUS 1 BED/1 BATH CORNER UNIT IN THE GOLD COAST WITH AMAZING LAKE AND PARK VIEWS! MOVE-IN READY WITH TONS OF CLOSET SPACE AND LARGE BALCONY. NO RENTAL CAP. PERFECT "WALK SCORE"; JUST BLOCKS TO THE BEACH AND NIGHTLIFE. NEWLY RENOVATED GYM ON FIRST FLOOR. DOG FRIENDLY!			3+ (Window/Wall Unit)	Hot Water/Steam			No	Oven/Range, Refrigerator		Door Person, Coin Laundry, Elevator, Exercise Room, Storage, Pool-Outdoors, Receiving Room, Tennis Court/s, Valet/Cleaner, Curbs/Gutters, Sidewalks	Heat, Water, Common Insurance, Doorman, TV/Cable, Exterior Maintenance, Lawn Care, Scavenger, Snow Removal	CARL SANDBURG VILLAGE CONDOMINUM ASSOCIATION II	KATY JARRETTE	(312) 787-0800	59													Shared					15X12	14X19	11X7		10X7	No additional rooms	Soaking Tub	Combined w/ LivRm	Balcony, Storms/Screens	09/16/2015	10/19/2015	10/19/2015	11/12/2015	
AT	1455	N	sandburg	TER	1607	Chicago	Illinois	60610	8008	Cook		299	299	243	Condo	29	1962	09110771	CLSD		184000	155000	155000	165600	Conventional	S	94%	84%	24	24	17042070861498				1947	Homeowner	2014	354	No		No	No		16		600	Estimated				W (West), City	4	1	1	0	1	0	1				None	None	Junior 1 Bed Room in Great Location, Open Views and Great Light From This Recent Rehab.  24 Hr Doorperson, Exercise Room and Well Cared for Building Walking Distance to Wells Street Restaurants, Shops, The Gold Coast and The Lake!  Tons of Growth Happening in the Immediate Area, Best Deal Around!  Tenant Occupied,	CC: Pursuant to Short Sale. Short Sale, please inform buyers, unit is in great condition but must be purchased as-is and be willing to wait 90 days for short sale approval. Please give 48 Hrs prior to showing when at all possible.		1 (Window/Wall Unit)	Forced Air, Hot Water/Steam			No			Bike Room/Bike Trails, Door Person, Coin Laundry, Exercise Room, Storage, On Site Manager/Engineer, Pool-Outdoors	Heat, Water, Gas, Common Insurance, Security, Doorman, TV/Cable, Exterior Maintenance, Lawn Care, Scavenger, Snow Removal	COMMUNITY SPECIALISTS	KATY JARRETTE - LYNN ON SITE	(312) 787-0800														None					12X11	14X18	9X8		COMBO	No additional rooms				01/06/2016	01/29/2016	01/29/2016	03/31/2016	
AT	1455	N	SANDBURG	TER	2008	Chicago	Illinois	60610	8008	Cook	SANDBURG	299	299	243	Condo, High Rise (7+ Stories)	29	1965	09225410	CLSD		255000	245000	245000	255000	Conventional	N/A	96%	96%	24	24	17042070861529				2876	Homeowner	2014	625	No		No	No		20		850	Estimated				N (North), E (East)	4	1	1	0	1	0	1		1	Attached	None	None	Spacious and rarely available "08" tier (NE Corner) one bedroom, one bathroom condo with balcony. Amazing views of the Lake, Park and City! Views of building's north pool and tennis courts as well. They don't build 1-BR corner units like this anymore - a must see! Newly rehabbed Kitchen w/ granite breakfast bar, new Stainless Steel Appliances and beautiful Tile Back Splash. Gorgeous New Bath with Travertine Tile. Separate dining area, huge closets and much more. 24 hr door person, Gym, on-site dry cleaner, 2 outdoor pools, Tennis Courts, Rooftop Deck, extra basement storage, bike rooms and inexpensive rental Garage Parking. Dog and pet friendly building. 20th floor hallway just renovated and looks great! Special Assessment will be paid by Seller (Tuckpointing and Balcony Repairs). Balcony repairs are nearly complete.			2 (Window/Wall Unit)	Gas, Hot Water/Steam			No	Oven/Range, Microwave, Dishwasher, Refrigerator		Bike Room/Bike Trails, Door Person, Coin Laundry, Elevator, Exercise Room, Storage, On Site Manager/Engineer, Sundeck, Pool-Indoors, Pool-Outdoors, Receiving Room, Service Elevator, Curbs/Gutters, Sidewalks, Street Lights, Street Paved	Heat, Water, Gas, Common Insurance, Doorman, TV/Cable, Exterior Maintenance, Lawn Care, Scavenger, Snow Removal	n/a	n/a	(999) 999-9999									Carpet	TV-Cable		Ceramic Tile	Carpet	None	Carpet				15X12	19X13	11X07		11X07	No additional rooms		Separate	Balcony, Storms/Screens, End Unit	05/13/2016	06/05/2016	06/05/2016	07/07/2016	
AT	1455	N	SANDBURG	TER	2706B	Chicago	Illinois	60610	8008	Cook	SANDBURG VILLAGE	299	299	243	Condo, High Rise (7+ Stories)	29	1963	09219864	CLSD		225000	220000	220000	225000	Conventional	N/A	98%	98%	2	2	17042070861482				3048	None	2014	605	No		Yes	No		27		0	Not Reported				E (East)	4	1	1	0	1	0	1	0	1	Attached	None	None	SPECTACULAR PANAORAMIC EAST VIEWS OF LAKE & CITY SKYLINE. THIS SPACIOUS BRIGHT 1BR/1BA CONDO IS BEAUTIFULLY UPDATED. MARBLE ENTRANCE, PROFESSIONALLY DESIGNED OPEN GALLEY KITCHEN WITH GRANITE, SS APPLIANCES INCLUDED. WINE FRIDGE, CROWN MOLDINGS, WOOD FLOORS AND AMPLE CLOSETS. IT'S OWN RELAXING SAUNA AND MODERN BATHROOM. FULL AMENITY BUILDING, FITNESS CENTER, 24 HR. DOOR STAFF, SUNDECK, BIKE ROOM, 2 OUTDOOR POOLS & TENNIS COURTS. A MUST SEE !!	CURRENT SPECIAL ASSESSMENT WILL BE PAID BY OWNER. THIS SPECIAL ASSESSMENT IS TO FUND THE RESERVE FUND. THE WORK APPROVED IS TO FACADE & BALCONY REPAIRS. CURRENT RESERVES ARE $1.9 MILLION.		2 (Window/Wall Unit)	Hot Water/Steam		Sauna/Steam Room, Wood Laminate Floors	No			Bike Room/Bike Trails, Door Person, Coin Laundry, Elevator, Exercise Room, Storage, On Site Manager/Engineer, Park/Playground, Party Room, Sundeck, Pool-Outdoors, Receiving Room, Service Elevator, Tennis Court/s, Valet/Cleaner, Curbs/Gutters, Sidewalks, Street Paved	Heat, Water, Common Insurance, Doorman, TV/Cable, Exterior Maintenance, Lawn Care, Scavenger, Snow Removal	Community Specialists	TIFFANY SEPPELFRICK	(312) 787-0800	59								Wood Laminate			Wood Laminate	Wood Laminate	None	Carpet				11X17	14X20	08X10		COMBO	No additional rooms			Roof Deck, Tennis Court(s), Pool In-Ground, Storms/Screens, Cable Access	05/09/2016	05/10/2016	05/10/2016	06/09/2016	
AT	1455	N	Sandburg	TER	2401B	Chicago	Illinois	60610	8008	Cook	SANDBURG VILLAGE	299	299	324	Condo	29	UNK	09258049	CLSD		239000	239000	239000	239000	Conventional	N/A	100%	100%	5	5	17042070861344				3223		2014	643	No		No	No		24		800	Other				S (South), W (West)	4	1	1	0	1	0	1		1	Attached	None	None	GREAT CORNER ONE-BEDROOM UNIT WITH BALCONY.  FANTASTIC CITY VIEW! OPEN KITCHEN WITH GRANITE COUNTER-TOPS; ALL NEW SS APPLIANCES.  HARDWOOD FLOORING THROUGHOUT.  GUTTED AND REHABBED BATHROOM.  CLOSE TO PUBLIC TRANSPORTATION, PARK, LAKE, AND ENTERTAINMENT.  PET FRIENDLY BUILDING. HEAT AND BASIC CABLE INCLUDED. PARKING $145 EASY TO SHOW.	EASY TO SHOW.		3+ (Window/Wall Unit)	Hot Water/Steam			No	Oven/Range, Microwave, Dishwasher, Refrigerator			Heat, Water, Common Insurance, Doorman, TV/Cable, Exterior Maintenance, Lawn Care, Scavenger, Snow Removal	Carl Sandburg Village Condo	Tiffany Seppelfrick	(312) 787-0800		Yes							Hardwood			Hardwood	Hardwood	Full	Hardwood				18X13	18X14	10X7		10X7	No additional rooms		Combined w/ LivRm		06/15/2016	06/19/2016	06/19/2016	08/18/2016	
AT	1455	N	SANDBURG	TER	305B	Chicago	Illinois	60610	8008	Cook	SANDBURG	299	299	243	Condo, High Rise (7+ Stories)	29	1963	09388397	CLSD		175000	175000	175000	175000	Conventional	N/A	100%	100%	70	2	17042070861432				1769	None	2014	338	No		Yes	No		3	JR. 1 BED	550	Other				W (West)	4	1	1	0	1	0	1		1	Attached	Full, Walkout	Exterior Access	JR 1-BEDROOM FACING WEST. MAPLE HARDWOOD FLOORS, OPEN KITCHEN WITH GRANITE COUNTER-TOPS, 42" MAPLE CABINETRY, STAINLESS STEEL APPLIANCES, MICROWAVE AND DISHWASHER.  HEAT, BASIC CABLE INCLUDED IN ASSESSMENTS. EXERCISE ROOM, TENNIS COURTS, SWIMMING POOL SMALL YEARLY FEE.  FEE INDOOR PARKING, DOG FRIENDLY BUILDING. NEXT TO PUBLIC TRANSPORTATION, GROCERY STORE, RESTAURANTS, LAKE, PARK. EXCELLENT LOCATION.   EZ 2 SHOW!	Easy to show.  Call or text agent 312-560-3716.  Special assessments $3,210 paid by owner.		2 (Window/Wall Unit)	Hot Water/Steam		Hardwood Floors	No	Oven/Range, Microwave, Dishwasher, Refrigerator		Bike Room/Bike Trails, Door Person, Coin Laundry, Elevator, Exercise Room, Storage, On Site Manager/Engineer, Party Room, Pool-Outdoors, Receiving Room, Security Door Locks, Service Elevator, Tennis Court/s, Sidewalks, Street Lights, Other	Heat, Water, Common Insurance, Doorman, TV/Cable, Exercise Facilities, Pool, Exterior Maintenance, Lawn Care, Scavenger, Snow Removal	CARL SANDBURG CONDO ASSOCIATION II	Tiffany Seppelfrick	(312) 787-0800		Yes							Hardwood	TV-Cable		Hardwood	Hardwood	None	Hardwood				11X10	16X11	10X8		COMBO	Foyer		Combined w/ LivRm		11/14/2016	11/15/2016	11/15/2016	01/19/2017	
