AT	1455	N	SANDBURG	TER	706	Chicago	Illinois	60610	8008	Cook	SANDBURG VILLAGE	299	299	243	Condo, High Rise (7+ Stories)		1962	06446629	CLSD		224900	217000	217000	224900	Conventional		96%	96%	53	53	17042070861463	No			1582.57	None	2005	440	Yes		No			7		800					E (East)	4	1	1	0	1		1	0	1	Attached	None	None	ABSOLUTELY CHARMING ONE BEDROOM UNIT W/SPECTACULAR EAST VIEWS. UPDATED KITCHEN AND BATH ACCOMPANY THIS LARGE UNIT. ALL CLOSETS HAVE BEENC OMPLETELY ORGANIZED TO MAXIMIZE SPACE! 24HR DOORMAN, ON-SITE MANAGER, PLUS FITNESS ROOM. A GORGEOUS HOME IN A GREAT BUILDING! EASY TO SHOW.			2 (Window/Wall Unit)	Hot Water/Steam		Storage		Oven/Range, Refrigerator		Bike Room/Bike Trails, Door Person, Coin Laundry, Elevator, Exercise Room, Storage, Health Club, On Site Manager/Engineer, Sundeck, Pool-Outdoors, Tennis Court/s, Valet/Cleaner, Whirlpool	Heat, Water, Common Insurance, Security, Doorman, TV/Cable, Exercise Facilities, Pool, Exterior Maintenance, Scavenger, Snow Removal				70								Carpet			Ceramic Tile	Carpet	None	Carpet				16X11	20X14	10X08		09X08			Combined w/ LivRm, L-shaped	Storms/Screens, Door Monitored By TV	03/20/2007	05/11/2007	05/11/2007	06/15/2007	
AT	1455	N	Sandburg	TER	508	Chicago	Illinois	60610	8008	Cook		299	299	243	Condo			06436956	CLSD		244900	225000	225000	244900	Conventional		92%	92%	37	37	17042070861515				1900		2005	494	Yes		No			5		800						4	1	1	0	1		1			Attached	None		Wonderful Northeast corner one bedroom with balcony. Drenched in sunlight. State of the art kitchen, granite, stainless/steel appliances,marble bath and views of beautiful trees. Very park like. Just lovely. Don't miss it! Pet friendly.		1	2 (Window/Wall Unit)	Gas, Hot Water/Steam				Oven/Range, Microwave, Dishwasher, Refrigerator			Heat, Common Insurance, Doorman, TV/Cable, Exterior Maintenance, Scavenger																	None					15X12	14X19	11X7		11X7					03/12/2007	04/17/2007	04/17/2007	05/11/2007	
AT	1455	N	SANDBURG	TER	605B	Chicago	Illinois	60610	8008	Cook		299	299	243	Studio			06433207	CLSD		169900	160000	160000	169900	Cash		94%	94%	1	1	17042070861435				1740.89		2005	276	Yes		No			6		0	Not Reported					2	0	0	0	1		1			Attached	None		"Sold Before Print"		1	2 (Window/Wall Unit)	Hot Water/Steam							Heat, Water, Common Insurance, Doorman, TV/Cable, Exterior Maintenance, Scavenger																	None						22X8	9X8							03/08/2007	03/08/2007	03/08/2007	03/30/2007	
AT	1455	N	SANDBURG	TER	1903	Chicago	Illinois	60610	8008	Cook	SANDBURG VILLAGE	299	299	243	Condo, Studio		1963	06472800	CLSD		173500	163500	163500	173500	Conventional		94%	94%	11	11	17042070861393				967		2005	298	No		No			19	HIGH RISE	0	Not Reported				W (West), City	2	0	0	0	1		1		1		None		Bright! Spacious! Studio apartment. Breathtaking West view of City and sunsets. Freshly painted with new carpet. Full amenity building with 24 hr. doorman, sun deck, fitness room, cleaners, bike room, storage room. Complex has 2 pools, tennis courts, landscaped gardens, market. Close to park, lake, shopping, restaurants, bus, and subway. Short wait list for parking, but available nearby.			1 (Window/Wall Unit)	Hot Water/Steam				Oven/Range, Refrigerator		Bike Room/Bike Trails, Door Person, Coin Laundry, Elevator, Exercise Room, Storage, On Site Manager/Engineer, Park/Playground, Party Room, Sundeck, Pool-Outdoors, Receiving Room, Service Elevator, Tennis Court/s, Valet/Cleaner	Heat, Water, Common Insurance, Security System, Doorman, TV/Cable, Exterior Maintenance, Lawn Care, Scavenger, Snow Removal													TV-Cable, Security System		Vinyl	Carpet	None						22X17	9X8		COMBO			Combined w/ LivRm	Storms/Screens, Door Monitored By TV	04/10/2007	04/20/2007	04/20/2007	05/30/2007	
AT	1455	N	Sandburg		1503	Chicago	Illinois	60610	8008	Cook	BRYANT HOUSE	299	299	243	Condo, Studio		1963	06498440	CLSD		189900	182500	182500	189900	Conventional		96%	96%	8	8	17042070861389	No			937.22	None	2005	291	No		No			15		600					W (West)	3	0	0	0	1		1				None		Bright & sunny Studio (Jr.1br) with beautiful sunset views. Updated kitchen w/all newer appliances (including dishwasher) & bath. Large open kitchen. Newer A/C unit. Full amenity building with 24hr. Doorman,sundeck,exercise room,bike rm,courtyard,tennis courts and 2 outdoor pools. Perfect home or in-town apartment. Great transportation or walk to everything. Move right in. Just adorable!Short waiting list for parking			1 (Window/Wall Unit)	Other				Refrigerator		Door Person, Coin Laundry, Elevator, Storage, On Site Manager/Engineer, Pool-Outdoors, Receiving Room, Tennis Court/s	Other													TV-Cable, Intercom, Ceiling Fan			Carpet	None						22X18	9X8		COMBO			Combined w/ LivRm		05/01/2007	05/08/2007	05/08/2007	06/29/2007	
AT	1455	N	SANDBURG	TER	404	Chicago	Illinois	60610	8008	Cook	SANDBURG VILLAGE	299	299	243	Condo, High Rise (7+ Stories)		1962	06505321	CLSD		212500	209000	209000	212500	Conventional		98%	98%	18	18	17042070861406	No			1517	None	2005	424	Yes		No			4		800					E (East)	4	1	1	0	1		1		1	Attached	None		EAST FACING WITH TREE TOP VIEWS, THIS SPACIOUS SANDBURG CONDO IS FILLED WITH LIGHT. UPDATED OPEN KITCHEN, SEPARATE DINING AREA & REDONE BATHROOM. LG BEDROOM W/BUILT-INS & ORGANIZED CLOSET SPACE. WONDERFUL GOLD COAST LOCATION-NEAR LP, LAKEFRONT & TRANSPORTATION. HEAT INCLUDED IN ASSESS. PETS UNDER 25LBS OK.			2 (Window/Wall Unit)	Hot Water/Steam				Oven/Range, Microwave, Refrigerator			Heat, Water, Common Insurance, Doorman, TV/Cable, Scavenger, Snow Removal												Ceramic Tile			Ceramic Tile	Carpet	None,Shared	Carpet				17X11	19X14	10X06		09X08			L-shaped		05/07/2007	05/24/2007	05/24/2007	07/10/2007	
AT	1455	N	SANDBURG		2608	Chicago	Illinois	60610	8008	Cook	SANDBURG TERRACE	299	299	243	Condo, High Rise (7+ Stories)			06581130	CLSD		249900	244000	244000	249900	Conventional		98%	98%	22	22	17042070861535				2993.79	Senior, Homeowner	2005	552	Yes		No			26		800					N (North), E (East)	4	1	1	0	1		1		1	Attached	None		THE BEST TIER IN THE BUILDING! UNPARALLED VIEWS OF THE LAKE, BEACH, TREETOPS & CITYSCAPE FROM THIS OVERSIZED NE CORNER UNIT. THIS HIGH FLOOR 1 BR FEATS PRIVATE 12X7 BALCONY FACING EAST, SEP DINING AREA, NEUTRAL CARPET, WHITE KIT W/PASS-THRU TO DINING RM. UPDATED BATH W/MAPLE VANITY LEADS TO LARGE MASTER W/WALK-IN CLOSET. AMAZING VIEWS FROM EVERY WINDOW.MOVE IN COND. FULL AMENITY BLDG & RENTAL PKG.			2 (Window/Wall Unit)	Gas, Hot Water/Steam		Storage					Heat, Water, Gas, Common Insurance, Doorman, TV/Cable, Exterior Maintenance, Lawn Care, Scavenger, Snow Removal												Carpet			Vinyl	Carpet	None	Carpet				14X13	18X14	10X7		10X9	Balcony, Walk In Closet		Separate	Balcony, Private Entrance, End Unit	07/10/2007	07/31/2007	07/31/2007	09/21/2007	
AT	1455	N	SANDBURG	TER	1507	Chicago	Illinois	60610	8008	Cook	SANDBURG VILLAGE	299	299	243	Condo		1965	06572537	CLSD		174900	153500	153500	167000	Conventional		92%	88%	82	82	17042070861497	No			1830.07		2005	291	No		Yes			15		0	Not Reported					3	1	1	0	1		1		1		None		Darling junior one bedroom is in move-in condition.  Partial glass wall separates LR/Bedroom.  Neutral decor/carpeting. 2004 Special Assessment will be paid by seller at closing.  Parking is on waitlist.			1 (Window/Wall Unit)	Radiant							Heat, Water, Doorman, Exterior Maintenance, Snow Removal															Vinyl	Carpet	None	Carpet				11X12	11X18	09X08							07/02/2007	09/21/2007	09/21/2007	10/15/2007	
AT	1455	N	SANDBURG	ST	1704	Chicago	Illinois	60610	8008	Cook		299	299	243	Condo		1965	06652827	CLSD		249000	247000	247000	249000	Conventional		99%	99%	111	15	17042070861418				2880	None	2005	458	No		No			17		800					E (East), City, Lake/Water	4	2	2	0	1		1				None		TOTALLY REMODELED 2 BRM CONDO WITH BEAUTIFUL LAKE VIEW. REMODELING INCLUDE BUT NOT LIMITED A NEW CUSTOM MADE KITCHEN CABINETS WITH GRANITE COUNTERTOPS, STAINLESS APPLIANCES, TOP QUALITY BATHROOM, DESIGNED LIGHTING AND PLUMBING  FIXTURES, HARDWOOD FLOOR THRUOUT. FULL AMENITY BUILDING FEATURES: 2 OLYMPIC SIZE POOLS AND TENNIS CLUB. GARAGE PARKING AVAILABLE. BEST LOCATION IN CITY: CLOSE TO LINCOLN PARK, RUSH STREET,LAKE		1	2 (Window/Wall Unit)	Gas, Hot Water/Steam				Oven/Range, Microwave, Dishwasher, Refrigerator			Heat, Water, Doorman, TV/Cable, Exterior Maintenance, Lawn Care, Scavenger, Snow Removal				70													None		11X11			17X11	18X14	8X8							08/27/2007	09/10/2007	09/10/2007	10/25/2007	
AT	1455	N	SANDBURG	TER	2804	Chicago	Illinois	60610	8008	Cook	SANDBURG VILLAGE	299	299	243	Condo, High Rise (7+ Stories)		1965	06690245	CLSD		237500	225000	225000	235000	Conventional		96%	95%	381	141	17042070861429	No			3066.36	None	2006	485	Yes		No			28		800					E (East), Lake/Water	4	1	1	0	1		1		1	Attached	Full	Other	IMPECCABLY CLEAN & IN MOVE-IN CONDITION! GREAT SKYLINE AND LAKE VIEWS FROM THIS 1-BEDROOM CONDO THAT HAS BEEN TASTEFULLY UPGRADED WITH OPEN KITCHEN & BREAKFAST BAR, SHAKER STYLE MAPLE WOOD CABINETS, GRANITE COUNTER-TOPS AND FLOORING.  HARDWOOD FLOORS. THE NEW BATHROOM HAS TILE SURROUND, GRANITE FLOORING, ALL NEW DOORS, HARDWARE, AND NEW CIRCUIT BREAKER. AMPLE CLOSET SPACE.  HEAT/BASIC CABLE INCLUDED.	TAXES DOES NOT REFLECT HOMEOWNER'S EXEMPTION!  EASY TO SHOW		2 (Window/Wall Unit)	Hot Water/Steam		Storage		Oven/Range, Microwave, Dishwasher, Refrigerator		Bike Room/Bike Trails, Door Person, Coin Laundry, Elevator, Exercise Room, Storage, On Site Manager/Engineer, Pool-Outdoors, Receiving Room, Security Door Locks, Service Elevator, Tennis Court/s	Heat, Common Insurance, Doorman, TV/Cable, Exterior Maintenance, Lawn Care, Scavenger, Snow Removal				80								Hardwood	TV-Cable, Ceiling Fan		Other	Hardwood	Shared	Carpet				17X11	20X14	10X8		9X8			L-shaped		10/01/2007	02/18/2008	02/18/2008	03/21/2008	
AT	1455	N	SANDBURG	TER	2909	Chicago	Illinois	60610	8008	Cook		299	299	243	Condo, High Rise (7+ Stories)			06368029	CLSD		259000	247000	247000	259000	Conventional		95%	95%	23	23	17042070861565	No			1980.49	Homeowner	2005	542	Yes		Yes			29		0	Not Reported				N (North), E (East), W (West)	4	1	1	0	1		1		1	Attached	None		PENTHOUSE FLOOR SOUGHT-AFTER N/W CORNER UNIT W/BALCONY.GORGEOUS NORTH & EAST VIEWS OF LAKE & PARK AND SUPER SUNSET VIEWS. OPEN WHITE KITCHEN,GOOD SPACE AND GREAT CLOSETS.IDEAL LOCATION IN GOLD COAST. NEAR OLD TOWN AND LINCOLN PARK. CONVENIENT TO ALL TRANSPORTATION. COMPLEX HAS 2 OLYMPIC SIZE POOLS,AND TENNIS COURTS. BLDG OFFERS EXCERCISE ROOM.			2 (Window/Wall Unit)	Gas, Hot Water/Steam				Oven/Range, Refrigerator		Bike Room/Bike Trails, Coin Laundry, Elevator, Storage, On Site Manager/Engineer, Receiving Room, Service Elevator, Other	Heat, Water, Gas, Common Insurance, Doorman, TV/Cable, Exterior Maintenance, Lawn Care, Scavenger, Snow Removal				80								Carpet	TV-Cable, Ceiling Fan			Carpet	None	Carpet				15X12	19X14	11X07		11X07				Balcony, End Unit	01/02/2007	01/24/2007	01/24/2007	02/23/2007	
AT	1455	N	SANDBURG	TER	1208	Chicago	Illinois	60610	8008	Cook		299	299	243	Condo, High Rise (7+ Stories)	25	1963	07872583	CLSD		175000	140000	140000	160000	Conventional	S	88%	80%	79	79	17042070861522				3557	None	2009	554	No		No	No		12		0	Not Reported				N (North), E (East), City, Lake/Water	5	1	1	0	1	0	1	1	1	Attached	None	None	FHA approved! Corner unit with tons of light and amazing view! Living room features 2 full walls of windows facing east and north -great view of the lake! Plus, a nice sized balcony to enjoy the view. Granite counters in kitchen and bath, newer appliances, updated bathroom, walk-in closet in the spacious bedroom. Hardwood floors, storage space, dining room, view, great amenities. Rental parking avail. Tenant occupied	CC: Pursuant to Short Sale. Accepted contract and has been submitted to the bank for approval.  Any other offers will serve as a backup “offer”. Prk heated garage- $130 a mnth. Reserves $1,300,000.00. 25% rented, and no reantal cap.		3+ (Window/Wall Unit)	Gas, Electric, Forced Air		Elevator, Hardwood Floors, Storage	No	Oven/Range, Microwave, Dishwasher, Refrigerator		Bike Room/Bike Trails, Door Person, Coin Laundry, Elevator, Exercise Room, Storage, Health Club, On Site Manager/Engineer, Party Room, Sundeck, Pool-Outdoors, Security Door Locks, Service Elevator	Heat, Air Conditioning, Water, Gas, Common Insurance, Security, Security System, Doorman, Exercise Facilities, Pool, Lawn Care, Scavenger, Snow Removal												Hardwood	Security System, Intercom, Fire Sprinklers	Hardwood	Ceramic Tile	Hardwood	None	Hardwood				15X13	17X13	10X6	10X10	10X9	No additional rooms			Balcony, Deck, Patio	08/03/2011	10/20/2011	10/20/2011	01/17/2012	
AT	1455	N	Sandburg	TER	702	Chicago	Illinois	60610	8008	Cook	SANDBURG	299	299	250	Condo	29	1963	07915339	CLSD		175000	169000	169000	175000	Conventional	N/A	97%	97%	34	34	17042070861355				2356.90	Homeowner, Senior	2009	549	Yes	0	No	No		7		827	Other				S (South), E (East)	4	1	1	0	1	0	1		1	Attached	None	None	SOUTHEAST 1 BEDROOM WITH BALCONY WITH BEAUTIFUL CITY VIEWS. THE UNIT HAS BEEN UPGRADED & SHOWS BEAUTIFULLY. SEPARATE DINING AREA WITH OFFICE NOOK. TWO WALK-IN CLOSETS. WINDOWS HAVE THE ADD ON GLASS MAKING THE UNIT VERY QUIET. FULL AMENITY BLDG. IDEALLY SITUATED TO STORES, RESTAURANTS, OLD TOWN, LINCOLN PARK & THE LAKE. NO WAIT FOR PKG.			2 (Window/Wall Unit)	Gas, Hot Water/Steam			No	Oven/Range, Microwave, Dishwasher, Refrigerator		Bike Room/Bike Trails, Door Person, Coin Laundry, Elevator, Exercise Room, Storage, On Site Manager/Engineer, Sundeck, Pool-Outdoors, Service Elevator, Tennis Court/s, Curbs/Gutters, Sidewalks, Street Lights, Street Paved	Heat, Water, Gas, Common Insurance, Doorman, TV/Cable, Exterior Maintenance, Lawn Care, Scavenger, Snow Removal	COMMUNITY SPECIALISTS	KATY JERRETTE	(312) 787-0800									Carpet			Ceramic Tile	Carpet	None	Carpet				15X12	19X14	11X7		11X7	No additional rooms		Separate		10/01/2011	11/03/2011	11/03/2011	12/17/2011	
AT	1455	N	Sandburg	TER	1706B	Chicago	Illinois	60610	8008	Cook		148	299	243	Condo	30	1962	07943904	CLSD		110000	111699	111699	110000	Cash	F	102%	102%	4	4	17042070861472				2263.76	None	2009	567	No		Unknown	No		17		850	Appraiser					5	1	1	0	1	0	1	0			None	None	REO - BANK OWNED.PROPERTY SOLD “AS IS” WITHOUT REPAIR, WARRANTY OR SELLER DISCLOSURE. Buyer/Buyer’s Agent is responsible for utility activation related to inspections Listing Broker & Seller assume no responsibility & make no guarantees/warranties or representations as to the availability or accuracy of the property information, photographs or other information depicted/described herein.. CASH & CONVENTIONAL OFFERS	Vacant,no app req.Go to www.GoHoming.com for more info & to SUBMIT OFFER,Use search function,find house,click PLACE OFFER,submit appropriate details.For assistance call18888763372.Buyer is responsible for utility activation for inspections.		2 (Window/Wall Unit)	Baseboard			Yes				Water, Common Insurance, Security, Doorman, TV/Cable, Exercise Facilities, Pool, Exterior Maintenance, Scavenger, Snow Removal																	None					17X11	20X14	10X8		9X8	Exercise Room		L-shaped	Balcony, Pool In-Ground	11/14/2011	11/17/2011	11/17/2011	01/17/2012	
AT	1455	N	SANDBURG	TER	2303	Chicago	Illinois	60610	8008	Cook	SANDBURG VILLAGE	299	299	243	Condo, Studio	29	1963	08057876	CLSD		139900	138000	138000	139900	Conventional	N/A	99%	99%	29	27	17042070861397				1909.09	None	2010	303	No		No	No		23		533	Plans				W (West)	2	0	0	0	1	0	1		1	Attached	None	None	LARGE JR 1BD WITH UPDATED KITCHEN (GRANITE, NEW APPLIANCES), BATH HAS NEW TILE AROUND TUB, BRIGHT & SUNNY W/GREAT VIEW OF CITY & SUNSET. .   HEAT, BASIC CABLE & 24 HOUR DOORMAN INCLUDED IN ASSESSMENTS. WALK TO RED LINE, SHOPS, RESTAURANTS, LAKE, PARK. FANTASTIC LOCATION IN THE HEART OF THE GOLD COAST/OLD TOWN! FULL AMENITY BLDG W/EXERCISE ROOM, SUNDECK, TENNIS COURTS, BIKE RM & 2 OUTDOOR POOLS.WAIT-LIST FOR GARAGE.	TENANT OCCUPIED - NEED NOTICE. MOVE-IN FES $300 M-F; $400 SAT.		1 (Window/Wall Unit)	Gas, Hot Water/Steam			No	Oven/Range, Refrigerator		Bike Room/Bike Trails, Door Person, Coin Laundry, Elevator, Exercise Room, Storage, On Site Manager/Engineer, Party Room, Sundeck, Pool-Outdoors, Receiving Room, Security Door Locks, Service Elevator	Heat, Water, Gas, Common Insurance, Security, Doorman, TV/Cable, Exterior Maintenance, Lawn Care, Scavenger, Snow Removal	Community Specialists	Katy, Mgr or Linda A Mgr	(312) 787-0800		Yes												None						17X11	09X08			No additional rooms		Combined w/ LivRm		05/03/2012	05/29/2012	05/29/2012	07/12/2012	
AT	1455	N	Sandburg	TER	407B	Chicago	Illinois	60610	8008	Cook		299	299	243	Condo	30	1962	08025445	CLSD		139900	122000	122000	139900	Cash	N/A	87%	87%	263	7	17042070861487				1711.99	Homeowner	2010	305	No		No	No		4		0	Not Reported				W (West)	3	1	1	0	1	0	1		1	Attached	None	None	GREAT TREE TOP PARK VIEW FROM THIS REDONE 1BED 1BA UNIT. FEATURING HUGE WINDOWS, RENOVATED, KIT & BA. LIGHT & BRIGHT! PERFECTLY LOCATED 2BLKS FROM LAKE IN THE HEART OF THE GOLD COAST. THIS FULL AMENITY BLDG FEATS 2OLYMPIC SIZE POOLS,TENNIS CLUB, DOOR PERSON&HEATED GAR W/VALET, JR 1 BEDROOM. 110/MONTH,A STEEL.ASST INCL:HEAT, CABLE, WATER, COMMON INSURANCE, DOORMAN, EXT MAINTENANCE, LAWN CARE, SCAVENGER. FHA APPROVED			1 (Window/Wall Unit)	Gas, Hot Water/Steam			No	Oven/Range, Microwave, Dishwasher, Refrigerator, All Stainless Steel Kitchen Appliances		Bike Room/Bike Trails, Door Person, Coin Laundry, Elevator, Exercise Room, Storage, On Site Manager/Engineer, Pool-Outdoors, Tennis Court/s	Heat, Water, Security, Doorman, TV/Cable, Exercise Facilities, Exterior Maintenance, Scavenger, Snow Removal	COMMUNITY SPECIALISTS	N/A	(312) 337-8691		Yes										Ceramic Tile	Carpet	None	Carpet				12X11	19X11	10X10			No additional rooms			Pool In-Ground, Storms/Screens, Cable Access	03/23/2012	03/29/2012	03/29/2012	04/24/2012	
AT	1455	N	sandburg	TER	2809	Chicago	Illinois	60610	8008	Cook		299	299	243	Condo		1965	06707530	CLSD		236900	219000	219000	225000	Conventional		97%	92%	231	136	17042070861564				2102.68	None	2006	525	No		No			28		800					N (North), E (East), Lake/Water	4	1	1	0	1		1				None	None	Northwest corner 1 bedroom with balcony 1 floor below the penthouse!! Unbelievable views North, East, Lake and Park.  Full amenity building includes 2 olympic size pools and tennis club!! Parking only $130 per month.  Unparalled location: 2 blocks from Old Town entertainment area, red line subway stop, Rush st, the Lake and the park.  Could use a little TLC.  Owner is a licensed re broker.		1	2 (Window/Wall Unit)	Gas, Hot Water/Steam				Oven/Range, Dishwasher, Refrigerator			Heat, Water, Common Insurance, Doorman, TV/Cable, Exterior Maintenance, Lawn Care, Scavenger, Snow Removal				75													None					15X22	19X14	11X07		11X07					10/18/2007	03/01/2008	03/01/2008	04/02/2008	
AT	1455	N	Sandburg	TER	603	Chicago	Illinois	60610	8008	Cook	SANDBURG VILLAGE	299	299	243	Condo	29	UNK	08061851	CLSD		126500	135000	135000	126500	Conventional	N/A	107%	107%	6	6	17042070861381				1735.91	None	2010	309	No		No	No		6		0	Not Reported				W (West), Park	4	1	1	0	1	0	1		2	Attached	None	None	Bright sunny condo. Sunset & park views. Rehabbed. New carpet! Open Kitchen breakfast bar, granite countertops, Ow, pantry. Big windows. Move in ready.  Fresh paint. Built-in shelves. Ceiling fans. Great closet space, storage unit. FHA approved! Assessment includes heat, cable TV, 24 hour doorman, sundeck, 2 pools, tennis courts, fitness room, garage. Pets OK. Steps to beach, bus, red line, nightlife. Broker owner.	Fax offers to (888)649-6609 or email sales@bergproperties.com.		1 (Window/Wall Unit)	Gas, Hot Water/Steam, Indv Controls		Elevator, Storage	No	Oven/Range, Dishwasher, Refrigerator		Bike Room/Bike Trails, Door Person, Coin Laundry, Elevator, Exercise Room, Storage, On Site Manager/Engineer, Park/Playground, Party Room, Sundeck, Pool-Outdoors, Receiving Room, Security Door Locks, Service Elevator, Tennis Court/s, Valet/Cleaner	Heat, Water, Tax, Common Insurance, Security, Doorman, TV/Cable, Exterior Maintenance, Lawn Care, Scavenger, Snow Removal	Carl Sandburg Village Condo Association II	Katy Gerid	(312) 787-0800	73	Yes							Carpet	TV-Cable, Security System		Ceramic Tile	Carpet	None	Carpet				12X11	17X10	9X8		COMBO	No additional rooms		Combined w/ LivRm		05/08/2012	05/13/2012	05/13/2012	06/22/2012	
AT	1455	N	SANDBURG	TER	607	Chicago	Illinois	60610	8008	Cook		299	299	243	High Rise (7+ Stories), Studio			06716876	CLSD		160000	158000	158000	160000	Conventional		99%	99%	119	12	17042070861489	No			1740		2006	277	No		No			6		550						3	0	0	0	1		1				None		MUST SEE Gold Coast Studio! Priced to sell! Beautiful Westward view overlooking park. Recently updated-new paint, new carpet, new kitchen and foyer tile. Spaciously designed layout. Full amenity building-doorman, dry cleaners, fitness room, etc. Close to Old Town shopping and dining.			1 (Window/Wall Unit)	Gas, Hot Water/Steam		Elevator		Oven/Range, Refrigerator			Heat, Water, Common Insurance, Security System, Doorman, TV/Cable, Exercise Facilities, Pool, Exterior Maintenance, Lawn Care, Scavenger, Snow Removal															Ceramic Tile	Carpet	None						22X17	09X08		COMBO					10/29/2007	11/09/2007	11/09/2007	12/10/2007	
AT	1455	N	Sandburg	DR	1909B	Chicago	Illinois	60610	8008	Cook		299	299	243	Condo	29	1960	08115050	CLSD		119900	140000	140000	119900	Cash	F	117%	117%	14	14	17042070861555				2844.20		2010	470	No		No	No		19		800	Other					3	1	1	0	1	0	1				None	None	Corner unit with lake view. Building features pool, sundeck, exercise room, tennis court, bike room, 24-hr doorman & garage security.	All offers must be submitted by buyers Agent via offersubmission.com, ID# 684225.  Buyer pays $300 fee at closing.  Response by next business day.  Paperless process until offer accepted		1 (Window/Wall Unit)	Gas			No				Heat, Water, Gas, Common Insurance, Security, Doorman, TV/Cable, Exterior Maintenance, Lawn Care, Scavenger, Snow Removal	Bryant House	Manager	(312) 787-9512													Carpet	None					16X14	20X10	8X10			No additional rooms				07/14/2012	07/27/2012	07/27/2012	09/13/2012	
AT	1455	N	SANDBURG		2603	Chicago	Illinois	60610	8008	Cook		299	299	243	Condo, High Rise (7+ Stories)			06682452	CLSD		159900	158000	158000	159900	Conventional		99%	99%	42	8	17042070861400				NEW		2005	325	No		No			26		0	Not Reported				W (West)	3	1	1	0	1		1		1		None		PRICED TO SELL GOLDCOAST SPACIOUS CONVERTIBLE 1 BEDROOM CONDO ON HIGH FLOOR! FULL WESTERN VIEW, TONS OF LIGHT IN DAY AWESOME VIEW AT NIGHT! IN UNIT DISHWASHER. FULL AMENITY BUILDING: DOORMAN, SUNDECK, OUTDOOR POOL, TENNIS COURTS, EXERCISE ROOM, ELEVATOR, RESTAURANTS, CLEANERS & GROCERY. VALET PARKING.. A MUST SEE!!!			1 (Window/Wall Unit)	Gas		Elevator, Storage		Oven/Range, Refrigerator		Door Person, Coin Laundry, Elevator, Exercise Room, Sundeck, Pool-Outdoors, Receiving Room, Service Elevator, Tennis Court/s	Heat, Water, Common Insurance, Doorman, TV/Cable, Exterior Maintenance, Lawn Care, Scavenger, Snow Removal																	None					12X10	17X11	09X08							09/24/2007	10/01/2007	10/01/2007	11/27/2007	
AT	1455	N	Sandburg	TER	307	Chicago	Illinois	60610	8008	Cook	SANDBURG VILLAGE	299	299	243	Condo		1962	06709715	CLSD		199000	179000	179000	190000	Other	N/A	94%	90%	123	123	17042070861486				850.26		2006	280	Yes		No			03	HIGH RISE	560					W (West)	3	1	1	0	1		1		1	Attached	None		Incredible, large junior one bedroom complete designer rehab! Breakfast bar and counters, new appliances, new floors throughout, ceramic bath....more! Rooftop deck, work-out room and more. Luxury building in the heart of the Gold Coast/Old Town area. North Avenue beach, Lincoln Park, the Red Line, bus, restaurants, shopping and Wells Street fun within walking distance!  Garage pkg avail on site.	Listing agent must accompany		1 (Window/Wall Unit)	Gas, Hot Water/Steam		Storage		Oven/Range, Microwave, Refrigerator		Bike Room/Bike Trails, Door Person, Coin Laundry, Exercise Room, Storage, On Site Manager/Engineer, Party Room, Sundeck, Pool-Outdoors, Receiving Room, Security Door Locks, Service Elevator, Tennis Court/s, Valet/Cleaner, Curbs/Gutters, Sidewalks, Street Lights	Heat, Water, Common Insurance, Security System, Doorman, TV/Cable, Exterior Maintenance, Lawn Care, Scavenger, Snow Removal													TV-Cable, Security System		Other	Other	None	Other				11X11	17X11	09X08		COMBO			Combined w/ LivRm		10/22/2007	02/21/2008	02/21/2008	04/08/2008	
AT	1455	N	Sandburg	TER	2906	Chicago	Illinois	60610	8008	Cook	SANDBURG VILLAGE	299	299	243	Condo, High Rise (7+ Stories)		1963	06713373	CLSD		254000	225000	225000	249000	Conventional		90%	89%	245	245	17042070861484				3151.08	None	2006	513	No		No			29		0	Not Reported				E (East), City, Lake/Water	4	1	1	0	1		1		1		None		"Penthouse Unit". Amazing Lake & City Vews from this Bright, Spacious, one-bdrm apt. East exposure. Beautiful hardwood floors throughout. Custom paint colors. Crown molding, Great closet space. Full amenity building w/ 24 hr. doorman, Sun Deck, Fitness Room, Valet/Cleaners. Pools, Tennis Courts in complex. Fabulous location! Close to Park, Lake, Shopping, Restaurants, Bus and Subway. Pets allowed - wgt limit.-dep.	Taxes do not include the Homeowner's Exemption  Seller will pay special assessment.		2 (Window/Wall Unit)	Hot Water/Steam		Hardwood Floors		Oven/Range, Microwave, Refrigerator		Bike Room/Bike Trails, Door Person, Coin Laundry, Elevator, Exercise Room, Storage, On Site Manager/Engineer, Park/Playground, Party Room, Sundeck, Pool-Outdoors, Receiving Room, Service Elevator, Tennis Court/s, Valet/Cleaner	Heat, Water, Common Insurance, Doorman, TV/Cable, Exterior Maintenance, Lawn Care, Scavenger, Snow Removal				80								Hardwood	TV-Cable		Ceramic Tile	Hardwood	None	Hardwood				16X11	20X14	10X8		9X8			Separate	Door Monitored By TV	10/25/2007	06/25/2008	06/25/2008	07/18/2008	
