TYP	Street #	CP	Str Name	Sfx	Unit #	City	State	Zip	Area	County	Subdivision	GS Dist	HS Dist	Tot # Units	Type DE/AT	# Stories	Yr Blt	MLS #	Stat	Contingency	Orig List Pr	LP/SP	Sold Pr	List Price	FIN	Short Sale/Foreclosed/Court Approved	SP:LP	SP:OLP	MT	LMT	PIN	Mult PINs	Addl Tax Info	% Common	Taxes	Tax Exemps	Tax Year	As/Asc Dues	MAF	Master Association Fee($)	Spec Assess	Special Service Area	Special Service Area Fee	Unit Fl No	Model	ASF	SF Source	Total SF	Main SF	Aprx Total Fin SF	Exposure	# Rms	Beds	All Beds	Bsmt. Beds	# Full Baths	# Half Baths	Baths	# Interior Fireplaces	#GSp	Garage Type	Bsmt	Basement Description	Remarks	Agent Remarks	# Parking Spaces	Air	Heat/Fuel	AAG	Interior Property Features	Is Parking Included in Price?	Appliances	Amen	Com Ar Amen	Asses Incl	Management Company	Management Contact Name	Management Phone	% Own Occ	Can Owner Rent	Parking Fee/Lease $	2nd Bdr Flr	3rd Bdr Flr	4th Bdr Flr	Deeded Garage Cost	Deeded Parking Cost	Din Flr	Equipment	Fam Rm Flr	Kit Flr	Liv Rm Flr	Mast Bd Bth	Mast Bd Flr	2nd Bdr Sz	3rd Bdr Sz	4th Bdr Sz	Mast Br Sz	Liv Rm Sz	Kit Sz	Fam Rm Sz	Din Sz	Additional Rooms	Bth Amen	Din Rm	Exterior Property Features	List Date	Contract Date	Off Mkt Dt	Closed Date	Acreage
AT	1560	N	sandburg	TER	3905	Chicago	Illinois	60610	8008	Cook		299	299	520	Condo		1970	07140045	CLSD		214900	187000	187000	204900	Conventional	N/A	91%	87%	44	44	17042070871196				2101	None	2007	349	No		No			39		630					N (North), S (South), W (West), City	3	1	1	0	1		1				None		One of a kind Jr 1 brm with 39th floor city view.  French doors   leading to bedroom.  Real hardwood floors.  Granite/stainless  kitchen with dishwasher.  Marble bathroom with whirlpool bath.  Unit is 630 sq ft whereas the other Sandburg bldgs Jr's   are 500 sq ft.  Central air   washer/dryer allowed in units.  Immed heated indoor pking $130.  2 Olympic size pools and outdoor tennis club.  MUST SEE VIEWS		1	Central Air	Electric				Oven/Range, Microwave, Dishwasher, Refrigerator			Heat, Air Conditioning, Water, Common Insurance, Security, Doorman, TV/Cable, Exterior Maintenance, Lawn Care, Scavenger, Snow Removal				75											Hardwood	Hardwood	None	Carpet				11X8	14X10	10X7							02/19/2009	04/03/2009	04/03/2009	06/29/2009	
AT	1560	N	SANDBURG	TER	2915	Chicago	Illinois	60610	8008	Cook		299	299	520	Condo, High Rise (7+ Stories)		1970	07149538	CLSD		419900	387000	387000	409900	Conventional	N/A	94%	92%	47	47	17042070871505	No			3627		2007	817	No		No			29		0	Not Reported				N (North), E (East), W (West), City, Lake/Water, Park	5	2	2	0	2		2		1	Attached	None	None	BEST VALUE IN THE GOLD COAST!  BREATHTAKING, UNOBSTRUCTED SKYLINE VIEWS EAST TO LAKE, PARK & CITY. MOVE RIGHT IN! ELEGANT PERFECTION & CLASSICALLY STYLED NW CORNER SPLIT 2 BR / 2 BATH w/ BALCONY AT THE JAMES HOUSE. COMPLETELY RENOVATED KITCHEN w/ GRANITE COUNTERS & PASSTHRU TO LIVING RM.  MARBLE FOYER, KITCHEN & HALLWAYS.  HEAT, A/C & CABLE INCLD IN ASMT. PARKING $145/MO. FULL AMEN BLDG. BRING YOUR OFFERS!	James House is the newest structure in the Sandburg community with lower assmt, better views & best building.  The greatest appreciation as well!		Central Air	Forced Air				Oven/Range, Microwave, Dishwasher, Refrigerator		Bike Room/Bike Trails, Door Person, Coin Laundry, Elevator, Exercise Room, Storage, On Site Manager/Engineer, Pool-Outdoors, Receiving Room, Tennis Court/s	Heat, Air Conditioning, Water, Common Insurance, Doorman, TV/Cable, Exterior Maintenance, Lawn Care, Scavenger, Snow Removal							Carpet					Carpet			Marble	Carpet	Full	Carpet	16X11			15X12	19X16	10X08		10X08			Combined w/ LivRm	Balcony, Storms/Screens, End Unit	03/02/2009	04/17/2009	04/17/2009	05/20/2009	
AT	1560	N	SANDBURG	TER	1204	Chicago	Illinois	60610	8008	Cook		299	299	520	Condo, High Rise (7+ Stories)		1970	07429900	CLSD		259900	220000	220000	239900	Conventional	N/A	92%	85%	43	43	17042070871130				2935.06	Homeowner	2008	525	No		No			12		830					E (East), Lake/Water, Park	3	1	1	0	1		1		1	Attached	None		Amazing east views of lake & city! Large true one bed at coveted James House. Beautifully updated kitchen w/ granite breakfast bar open to huge living/dining space. Bath w/ large walk-in shower & gorgeous tile. Spacious east-facing balcony w/ stunning views. Gold Coast location steps the beach, transport, restaurants & shops. Building: rooftop deck, laundry rm, work out rm, 24 hr doorman, pool & on-site leased prking	Amazing E views in this true, up-graded 1 br in newest bldg in Sandburg Village. SELLER TO PAY FOR BRAND NEW WINDOWS! PROJECT DECIDED ON AND WILL START SOON. CAN INSTALL W/D IN-UNIT		Central Air	Forced Air		Laundry Hook-Up in Unit, Storage	No	Oven/Range, Microwave, Dishwasher		Bike Room/Bike Trails, Door Person, Coin Laundry, Elevator, Exercise Room, Storage, On Site Manager/Engineer, Party Room, Sundeck, Receiving Room, Security Door Locks, Service Elevator, Tennis Court/s, Valet/Cleaner	Heat, Air Conditioning, Water, Gas, Common Insurance, Security, Doorman, TV/Cable, Exercise Facilities, Pool, Exterior Maintenance, Lawn Care, Scavenger, Snow Removal															Ceramic Tile	Carpet	None	Carpet				15X11	19X18	11X09					Combined w/ LivRm	Balcony, Storms/Screens	02/01/2010	03/15/2010	03/15/2010	04/27/2010	
AT	1560	N	Sandburg	TER	2905	Chicago	Illinois	60610	8008	Cook		299	299	520	Condo, Studio		1970	07315396	CLSD		170900	149000	149000	149900	FHA	N/A	99%	87%	68	68	17042070871186	No			1106.87	Homeowner	2007	331	Yes		No			29		650					W (West), City	2	0	0	0	1		1		1		None		ESTATE SALE! MUST SELL! Perfect 'in-town' place or investment property in Gold Coast. Huge (650 SF) Convert. studio with panoramic West views from 29th floor. Walk-in closet, new carpet, fresh paint. Gold Coast, Lincoln Pk & Old Town @ your door! In addition to better-than-Short Sale price, SELLER WILL PAY SPECIAL ASSESSMENTS  for WINDOW PRJCT(12K) AT CLOSING. It is really an amazing deal!	Seller will pay special assessments (window installation project) worth of 12K at the closing!! Bring all offers! Available right away.		Central Air	Forced Air				Oven-Double, Oven/Range, Refrigerator		Bike Room/Bike Trails, Door Person, Coin Laundry, Elevator, Exercise Room, Storage, On Site Manager/Engineer, Sundeck, Pool-Outdoors, Receiving Room, Service Elevator, Tennis Court/s	Heat, Air Conditioning, Water, Common Insurance, Security, Doorman, TV/Cable, Exterior Maintenance, Lawn Care, Scavenger, Snow Removal				80	Yes								TV-Cable, Security System		Ceramic Tile	Carpet	None						21X14	07X10							09/02/2009	11/08/2009	11/08/2009	12/17/2009	
AT	1560	N	SANDBURG	TER	2211	Chicago	Illinois	60610	8008	Cook	Sandburg Village	299	299	520	Condo		1964	07318570	CLSD		235000	215000	215000	235000	Conventional	N/A	91%	91%	96	44	17042070871419	No			2787.45	Homeowner	2008	502	No		No			22		830					W (West)	3	1	1	0	1		1	0	1		None		Absolutely beautiful west-facing home on high floor in James House with largest floorplan. Kit w/maple cabinetry, s/s appliances, & large full pass-thru to LR. Huge LR w/oversized private balcony w/unobstructed views. Newer bth w/maple vanity, corian counters, & tiles. Large mbr includes amazing closet space. This home shows like a model and is ready to move in to. Gar pkn $140/mth no wait. Great unit!	Can add w/d in unit! Parking in garage for $140/mth valet no wait list and can accomodate multiple cars.  TENANT OCCUPIED 48 HOURS NOTICE REQUIRED. NO FRIDAY EVENING OR SATURDAY MORNING SHOWINGS.  LEASE HAS 75 DAY CANCELLATION CLAUSE.		Central Air	Forced Air, Hot Water/Steam				Oven/Range, Microwave, Dishwasher, Refrigerator		Bike Room/Bike Trails, Door Person, Coin Laundry, Elevator, Exercise Room, Storage, Pool-Outdoors, Receiving Room	Heat, Air Conditioning, Water, Common Insurance, Doorman, TV/Cable, Exterior Maintenance, Scavenger					Yes										Hardwood	Carpet	None	Carpet				15X11	19X17	11X09						Balcony	09/08/2009	10/21/2009	10/21/2009	12/07/2009	
AT	1560	N	Sandburg	TER	3403	Chicago	Illinois	60610	8008	Cook		299	299	520	High Rise (7+ Stories)		1971	07431939	CLSD		250000	222000	222000	250000	Conventional	N/A	89%	89%	123	123	17042070871111				3171.75	None	2008	525	No		Unknown			34		830					W (West)	3	1	1	0	1		1		1	Attached	None	None	Large one bedroom with balcony at most desirable Sandburg Village building. Endless West views of city and gorgeous sunsets. Unit has newer kitchen and bath and lots of closet and storage space. Building amenities include doorman, receiving room, exercise room, outdoor pool and tennis courts. Leased parking is $140 per month. Fantastic location, close to bus and El or a short walk to everything.			Central Air	Forced Air, Hot Water/Steam			No	Oven/Range, Dishwasher, Refrigerator		Door Person, Elevator, Exercise Room, Storage, Health Club, On Site Manager/Engineer, Party Room, Sundeck, Pool-Outdoors, Receiving Room, Service Elevator, Tennis Court/s	Heat, Water, Common Insurance, Doorman, Exterior Maintenance, Scavenger, Snow Removal															Ceramic Tile	Hardwood	None	Carpet				16X11	20X18	11X08			Balcony		Combined w/ LivRm		02/02/2010	06/04/2010	06/04/2010	07/30/2010	
AT	1560	N	SANDBURG	TER	4001	Chicago	Illinois	60610	8008	Cook		299	299	520	Condo		1970	07322927	CLSD		475000	390000	390000	450000	Conventional	N/A	87%	82%	116	116	17042070871037				5152.82		2007	855	No		No			40		0	Not Reported				S (South), E (East), W (West), City, Lake/Water	5	2	2	0	2		2		1		None		RARELY AVAILABLE UPGRADED 2B/2B CORNER UNIT AT JAMES PLACE ENJOY BREATHTAKING VIEWS OF LAKE & CITY SKYLINE FROM THIS DESIRABLE HIGH FLOOR UNIT. RECENTLY RENOVATED UNIT FEATURES NEW OPEN KIT W/ SS KITCHAID APPLS,42" CINNAMON CABS,1 1/4 GRANITE CTRTOPS,MARBLE BTHS,GORGEOUS HDWD FLRS, UPDATED ELECTRIC,IN-UNIT W/D,GENEROUS ROOM SIZES,FAB STORAGE & PRIV BALCONY.OPPTY TO BUY ADJ 1 BED UNIT (4003) TO CREATE 2100+SQFT 3B/3B.			Central Air	Electric		Hardwood Floors, Laundry Hook-Up in Unit		Oven-Double, Oven/Range, Microwave, Dishwasher, Dishwasher-Portable, Refrigerator, Washer, Dryer, Disposal		Bike Room/Bike Trails, Door Person, Coin Laundry, Elevator, On Site Manager/Engineer, Sundeck, Pool-Outdoors, Receiving Room, Service Elevator	Heat, Air Conditioning, Water, Common Insurance, Security, Security System, TV/Cable, Exercise Facilities, Scavenger, Snow Removal							Carpet					Hardwood			Other	Hardwood	Full	Carpet	13X12			17X12	18X16	10X08		12X9			Separate	Balcony, End Unit	09/11/2009	01/04/2010	01/04/2010	02/26/2010	
AT	1560	N	SANDBURG	TER	2404	Chicago	Illinois	60610	8008	Cook	SANDBURG VILLAGE	299	299	520	Condo, High Rise (7+ Stories)		1970	07377266	CLSD		284900	270000	270000	284900	FHA	N/A	95%	95%	99	99	17042070871141	No			2531	Homeowner	2008	545	Yes		Unknown			24		850					E (East), Lake/Water, Park	3	1	1	0	1		1		2	Attached	None		UNOBSTRUCTED EAST LAKE, PARK, BEACH VWS. COMPLETELY RENOVATED. OAK HRDWD FLRS & NEW LIGHTING THROUGHOUT. NEW KITCHEN W/ GRANITE, KRAFTMAID CABINETS, STAINLESS STEEL APPLIANCES. NEW BATH ALSO GRANITE & KRAFTMAID CABINETS. 19' BALCONY EXTENDS FULL WIDTH OF LIVING ROOM. EXCELLENT CLOSET SPACE INCLUDES WALK-IN. FHA/VA APPROVED. PET FRIENDLY. NO WAIT HEATED GARAGE & GUEST PKG. WASHER/DRYER PERMITTED IN UNIT. 850SF.	WEBSITE FOR BUILDING: jameskilmercondo.org		Central Air	Gas		Hardwood Floors, Storage	Yes	Oven/Range, Microwave, Dishwasher, Refrigerator		Bike Room/Bike Trails, Door Person, Coin Laundry, Elevator, Exercise Room, Storage, On Site Manager/Engineer, Party Room, Sundeck, Pool-Outdoors, Receiving Room, Security Door Locks, Service Elevator, Tennis Court/s, Valet/Cleaner, Curbs/Gutters, Gated Entry, Sidewalks, Street Lights, Street Paved, Other	Heat, Air Conditioning, Water, Common Insurance, Security, Doorman, TV/Cable, Exercise Facilities, Exterior Maintenance, Lawn Care, Scavenger, Snow Removal, Other	DRAPER & KRAMER		(312) 654-1560										TV-Cable, Intercom, CO Detectors		Hardwood	Hardwood	None,Full	Hardwood				16X11	19X18	11X9		COMBO			Combined w/ LivRm	Balcony, Storms/Screens	11/10/2009	02/16/2010	02/16/2010	03/30/2010	
AT	1560	N	Sandburg	TER	2305	Chicago	Illinois	60610	8008	Cook		299	299	520	Condo, Studio		1970	07422462	CLSD		177000	175000	175000	177000	Conventional	N/A	99%	99%	95	95	17042070871185				1948		2008	343	No		Yes			23		650					W (West)	3	0	0	0	1		1		1		None		Huge convertible studio with panoramic sunset views from the 23rd floor! Unit features new hardwood floors & custom Elfa walk-in closet. Gorgeous open kitchen w/ granite countertops, maple cabinets & breakfast bar. Bathroom updated w. marble vanity & glass shower door! Amenities include 2 pools, tennis courts & fitness room! Amazing location in the heart of the Gold Coast/Lincoln Park!	Fax offers to 312-256-2025.		Central Air	Electric		Hardwood Floors	No	Oven/Range, Microwave, Dishwasher, Refrigerator		Bike Room/Bike Trails, Door Person, Coin Laundry, Elevator, Exercise Room, Storage, Health Club, On Site Manager/Engineer, Party Room, Pool-Outdoors, Receiving Room, Security Door Locks, Service Elevator, Tennis Court/s, Valet/Cleaner	Heat, Air Conditioning, Water, Common Insurance, Security, Doorman, Exercise Facilities, Pool, Exterior Maintenance, Lawn Care, Scavenger, Snow Removal					Yes										Hardwood	Hardwood	None						21X14	7X10		COMBO					01/22/2010	04/26/2010	04/26/2010	07/06/2010	
AT	1560	N	SANDBURG	TER	303	Chicago	Illinois	60610	8008	Cook	SANDBURG VILLAGE	299	299	520	Condo, High Rise (7+ Stories)		1971	07421709	CLSD		229000	210000	210000	219000	Conventional	N/A	96%	92%	93	93	17042070871081				2493	Homeowner	2008	453	No		No			3		0	Not Reported				W (West), City	3	1	1	0	1		1		1	Attached	None		SPACIOUS ONE-BEDROOM UNIT W/NEWER KITCHEN & BATH, SS APPLIANCES, GRANITE COUNTERTOPS. OTHER UNIT FEATURES INCLUDE LOTS OF STORAGE, PRIVATE BALCONY, GLEAMING HARDWOOD FLOORS, UPDATED TRAC LIGHTING IN LIVING/DINING. BUILDING AMENITIES INCLUDE OUTDOOR POOL & TENNIS, RECENTLY REDECORATED ROOFTOP PARTY ROOM, STORAGE & BIKE ROOMS, IDEAL LOCATION NEAR LAKE, SHOPPING AND BUS/TRAIN.	SELLER WILL PAY UP-COMING SPECIAL ASSESSMENT. GREAT UNIT FOR FIRST-TIME HOME BUYER! BUILDING IS FHA APPROVED.		Central Air	Forced Air		Elevator, Hardwood Floors, Storage	No	Oven-Double, Microwave, Dishwasher, Refrigerator, Disposal		Bike Room/Bike Trails, Door Person, Coin Laundry, Elevator, Exercise Room, Storage, Party Room, Pool-Outdoors, Receiving Room, Service Elevator, Tennis Court/s	Heat, Air Conditioning, Water, Common Insurance, Doorman, TV/Cable, Exterior Maintenance, Scavenger, Snow Removal												Hardwood			Hardwood	Hardwood	None	Carpet				11X16	18X20	09X11		COMBO			Combined w/ LivRm	Balcony, Deck, Storms/Screens	01/21/2010	04/23/2010	04/23/2010	06/02/2010	
AT	1560	N	SANDBURG	TER	4109	Chicago	Illinois	60610	8008	Cook	James House	299	299	520	High Rise (7+ Stories), Studio		UNK	07448122	CLSD		179000	171000	171000	179000	FHA	N/A	96%	96%	17	17	17042070871368	No			2122	None	2008	377	No		Yes			41	JR. ONE BR	0	Not Reported				W (West), City	2	0	0	0	1		1	0	1	Attached	None	None	Junior 1BR with breathtaking sunset views, updated open kitchen with SubZero refrigerator and breakfast bar, Pergo floors and 2 generous closets.  Remarkable amount of space and terrific light make this the perfect city home. Seller is open to negotiation regarding the special assmt. Building has 24 hr doorman, workout room, tennis courts, pool & pets up to 40 lbs allowed. Valet parking is available. Gracious staff.	Special assessment to replace windows. When that is done, this unit will be just about perfect. Terrific deal for a high floor hovering close to the penthouse.		Central Air	Gas, Forced Air, Indv Controls			Yes	Oven/Range, Microwave, Dishwasher, Refrigerator		Bike Room/Bike Trails, Door Person, Coin Laundry, Elevator, Exercise Room, Storage, On Site Manager/Engineer, Party Room, Sundeck, Pool-Outdoors, Receiving Room, Security Door Locks, Service Elevator, Tennis Court/s, Curbs/Gutters, Sidewalks, Street Lights, Street Paved	Heat, Air Conditioning, Water, Common Insurance, Doorman, TV/Cable, Exterior Maintenance, Lawn Care, Scavenger, Snow Removal	James/Kilmer			75	Yes								TV-Cable		Other	Other	Full						20X13	11X11			Gallery			Storms/Screens	02/20/2010	03/08/2010	03/08/2010	04/16/2010	
AT	1560	N	Sandburg	TER	4003	Chicago	Illinois	60610	8008	Cook		299	299	520	Condo, High Rise (7+ Stories)		1971	07459929	CLSD		225000	214000	214000	225000	Conventional	N/A	95%	95%	575	19	17042070871117				3247	None	2008	528	No		No			40		0	Not Reported				W (West), City	3	1	1	0	1		1		2		None	None	WONDERFUL 1B/1B UPDATED UNIT ON PREFERRED HIGH FLOOR W/AMAZING SOUTH,WEST & NORTH VIEWS.UPDATES INCL NEWER KITCHEN WITH 42" MAPLE CABS, FRIGEDAIRE APPLS,BTH W/ NEW MAPLE VANITY & TILE,NEW BERBER CARPET & PAINT.GENEROUS ROOM SIZES W/PLENTY OF ROOM FOR LIVING & DINING.GREAT IN-UNIT STORAGE & LARGE PRIV BALCONY.BUILDING HAS FAB OUTDOOR POOL, IS STEPS TO THE LAKE,OLD TOWN & GOLD COAST SHOPS,RESTAURANTS & TRANSPORTATION.			Central Air	Forced Air		Elevator, Storage	No	Oven/Range, Dishwasher, Refrigerator		Door Person, Coin Laundry, Elevator, Exercise Room, Storage, On Site Manager/Engineer, Sundeck, Pool-Outdoors, Receiving Room	Heat, Air Conditioning, Water, Security, Doorman, TV/Cable, Exterior Maintenance, Lawn Care, Scavenger, Snow Removal															Ceramic Tile	Carpet	None	Carpet				16X11	20X18	11X08					Combined w/ LivRm	Balcony, Deck, Door Monitored By TV	03/04/2010	03/22/2010	03/22/2010	05/10/2010	
AT	1560	N	SANDBURG	TER	606	Chicago	Illinois	60610	8008	Cook	SANDBURG VILLAGE	299	299	520	Condo, High Rise (7+ Stories)		1970	07517120	CLSD		219000	170000	170000	179000	Cash	N/A	95%	78%	389	389	17042070871204	No			840.17	Homeowner, Senior	2009	544	No		Yes	No		6		850	Landlord/Tenant/Seller				E (East)	4	1	1	0	1	0	1		1	Attached	None	None	James House a Full-Amenity bldg w/ Doorman, Exerc & Party Rm, Olympic-sized Pool w/ Sundeck, Tennis Courts & more.  FHA-Approved Bldg!!! 850 sq. feet w/ Lge Balcony 17' x 5'. New Hdwd Flrs & Newer Kitch & Remodeled Bath. 24' of closets! 1 Dog allowed up to 40 LBS. Seller pd for New Windows. Rules + Reg's allow Washer/Dryer in Unit w/ special req's. Vacant/MoveIn Ready! No Wait Gar Pkg.	FHA approved bldg!! Seller has already paid for window replacement project which is currently underway.   New HDWD flrs, Kit Counters, closet doors and repaint.		Central Air	Gas		Elevator, Hardwood Floors, Storage	NO	Oven/Range, Refrigerator		Bike Room/Bike Trails, Door Person, Coin Laundry, Elevator, Exercise Room, Storage, On Site Manager/Engineer, Party Room, Sundeck, Pool-Outdoors, Receiving Room, Service Elevator, Valet/Cleaner, Curbs/Gutters, Sidewalks, Street Lights, Street Paved	Heat, Air Conditioning, Water, Common Insurance, Doorman, TV/Cable, Exterior Maintenance, Scavenger					Yes							Carpet	TV-Cable		Vinyl	Carpet	None	Carpet				14X11	19X17	11X8		COMBO	Balcony, Foyer		Combined w/ LivRm	Balcony, Door Monitored By TV	05/01/2010	05/24/2011	05/24/2011	05/31/2011	
AT	1560	N	Sandburg	TER	410J	Chicago	Illinois	60610	8008	Cook	SANDBURG VILLAGE	299	299	520	Condo		1969	07534661	CLSD		194900	180000	180000	194900	Conventional	N/A	92%	92%	138	12	17042070871362	No			2914		2008	483	No		Unknown			4		831					E (East)	4	1	1	0	1		1		1	Attached	None	None	SPACIOUS ONE BEDROOM UNIT AT THE SOUGHT AFTER JAMES HOUSE. PERFECT STARTER UNIT IN EXTREMELY WELL MANAGED BLDG WITH ON-SITE POOL, TENNIS COURTS, SHOPPING AND EXERCISE FACILITY. GREAT LOCATION,  STEPS TO LAKE, SHOPPING AND TRANSPORTATION. ACT FAST!	Seller responsible for assessment to replace windows.		Central Air	Gas, Forced Air			Yes	Oven/Range, Dishwasher, Refrigerator		Bike Room/Bike Trails, Door Person, Coin Laundry, Commissary, Elevator, Exercise Room, Storage, On Site Manager/Engineer, Party Room, Sundeck, Pool-Outdoors, Receiving Room, Service Elevator, Tennis Court/s	Heat, Air Conditioning, Water, Common Insurance, Security, Doorman, TV/Cable, Exercise Facilities, Lawn Care, Scavenger, Snow Removal															Ceramic Tile	Carpet	None	Carpet				16X11	19X18	11X9		COMBO			Combined w/ LivRm	Balcony	05/21/2010	06/01/2010	06/01/2010	07/17/2010	
AT	1560	N	Sandburg	TER	3301	Chicago	Illinois	60610	8008	Cook		299	299	520	Condo		1970	07586876	CLSD		598000	575000	575000	598000	Conventional	N/A	96%	96%	121	37	17042070871110	No			8230.82		2008	1450	No		Yes			33		2030						6	3	3	0	3		3		2	Attached	None	None	Watch an amazing sunset in this designer 2,200 sqft SW corner 3 bedroom (converted to 2 bedroom) unit. Open floor plan  includes a family room, crown molding throughout, custom built-ins, a gourmet kitchen with eat-in area. Also features laundry room, 2 balconies, great skyline views and 2 parking spots. An amazing condo in a fabulous area!			Central Air	Gas, Forced Air			Yes	Oven-Double, Microwave, Dishwasher, Refrigerator, Washer, Dryer			Heat, Air Conditioning, Water, Common Insurance, Doorman, TV/Cable, Exterior Maintenance, Scavenger, Snow Removal							Carpet	Carpet				Carpet			Marble	Carpet	Y	Carpet	14X16	12X12		18X12	18X15	19X15		13X15	Balcony		Separate		07/20/2010	08/25/2010	08/25/2010	10/04/2010	
AT	1560	N	SANDBURG	TER	503	Chicago	Illinois	60610	8008	Cook	JAMES HOUSE	299	299	520	Condo	50	1972	08151391	CLSD		134900	150000	150000	179900	Cash	S	83%	111%	559	303	17042070871083				2407		2011	501	No		No	No		5		830	Landlord/Tenant/Seller					3	1	1	0	1	0	1		1	Attached	None	None	BRIGHT AND SPACIOUS 5TH FLOOR UNIT IN THE HEART OF OLD TOWN/GOLD COAST AREA IN THE DESIRABLE SANDBURG COMPLEX. WALKING DISTANCE TO NORTH AVE BEACH, RED LINE, LINCOLN PARK AND WELLS AVE CORRIDOR. CONDO FEATURES 1 BEDROOM, 1 BATH, CARPETING, UPDATED BATHROOM, LARGE ROOM SIZES AND A LARGE BALCONY. THIS BUILDING OFFERS A TON OF AMENITIES! PARKING AVAILABLE FOR RENTAL. TRUE 1BD, NOT JUNIOR.	CC: Pursuant to Short Sale. Subject to cancellation of previous agreement. cash only Show any time. key is with the receiving room. Rec. room open m-f from 9am-6pm, Sat 10am-2pm No Sunday showings		Central Air	Electric			No			Bike Room/Bike Trails, Coin Laundry, Elevator, Exercise Room, On Site Manager/Engineer, Party Room, Sundeck, Pool-Outdoors, Receiving Room, Security Door Locks, Service Elevator	Heat, Water, Common Insurance, TV/Cable, Pool, Exterior Maintenance, Lawn Care, Scavenger, Snow Removal	XXXX	XXXX	(555) 555-5555		Yes										Ceramic Tile	Carpet	None	Carpet				16X11	20X18	11X8			No additional rooms				09/03/2012	07/02/2013	07/02/2013	09/06/2013	
AT	1560	N	SANDBURG	TER	1612	Chicago	Illinois	60610	8008	Cook	JAMES HOUSE	299	299	520	Condo		1970	07661243	CLSD		394000	385000	385000	389000	Cash	N/A	99%	98%	42	42	17042070871453	No			3985.38		2008	890	No		No			16		1250	Estimated				N (North), E (East)	5	2	2	0	2		2	0	2	Attached	None		RARELY ON THE MAKRET. SPLIT TWO BEDROOM/TWO BATH NORTHEAST UNIT W/LARGE BALCONY & BREATHTAKING LAKE, PARK & SKYLINE VIEWS. UPDATED BATH, GRANDFATHERED IN-UNIT WASHER & DRYER. ASSESSMENTS INCLUDE HEAT, AIR & CABLE. 1 PET-40 LBS. SELLER PAID $38K SPECIAL FOR NEW WINDOWS.	Seller plans to take this unit off the market if not under contract by Mid December. Seller PD $38,000 special for  new windows and balacony renovation - Over $2M in reserves.  garabage disposal is grandfathered		Central Air	Gas, Hot Water/Steam		Laundry Hook-Up in Unit, Storage	Yes	Oven/Range, Microwave, Dishwasher, Refrigerator, Washer, Dryer		Bike Room/Bike Trails, Door Person, Coin Laundry, Elevator, Exercise Room, Storage, On Site Manager/Engineer, Party Room, Sundeck, Pool-Outdoors, Receiving Room, Service Elevator, Tennis Court/s, Other	Heat, Air Conditioning, Water, Common Insurance, Security, Exterior Maintenance, Scavenger, Snow Removal																	Full		15X12			16X11	19X16	10X08		09X08			Combined w/ LivRm	Balcony	10/21/2010	12/01/2010	12/01/2010	12/14/2010	
AT	1560	N	SANDBURG	TER	2401	Chicago	Illinois	60610	8008	Cook		299	299	520	Condo, High Rise (7+ Stories)	1	1970	08231783	CLSD		289000	289000	289000	289000	Cash	N/A	100%	100%	6	6	17042070871021				4438.13	Homeowner	2011	888	No		No	No		24		1250	Estimated				S (South), W (West), City	5	2	2	0	2	0	2		1	Attached	None	None	Completely gut rehabbed 1200 sf corner unit w/amazing West & Southern views of City. Priv balcony & side by side W/D add to this ideal condo. Sep dining space & huge kitchen w/cstm espresso cabs, granite, s/s appliances & 2 fully renovated bths. New carpet, new electric, new doors, closets, bath vanities & granite make this the ultimate holiday purchase. See pricing history & see why this is the ultimate opportunity!	MUST TEXT Michael Kearney 3124201881 , TIME, DATE & AGENT ID. ALL SHOWINGS BETWEEN 9AM-630PM MON-FRI & SATURDAY 9AM - 12:30PM. NO SUNDAY SHOWINGS		Central Air	Gas, Forced Air			No	Oven/Range, Microwave, Dishwasher, Refrigerator, Washer, Dryer		Bike Room/Bike Trails, Door Person, Exercise Room, Storage, Party Room, Pool-Outdoors, Receiving Room, Tennis Court/s	Heat, Air Conditioning, Water, Common Insurance, Doorman, TV/Cable, Exercise Facilities, Pool, Exterior Maintenance, Scavenger, Snow Removal	TBD	TBD	(111) 111-1111	80								Ceramic Tile			Ceramic Tile	Carpet	Full	Carpet	13X12			17X12	18X16	10X08		12X09	Balcony				12/07/2012	12/12/2012	12/12/2012	12/31/2012	
