AT	1560	N	Sandburg	TER	1202	Chicago	Illinois	60610	8008	Cook	James House	299	299	520	Condo, High Rise (7+ Stories)		1971	06535341	CLSD		384900	380000	380000	384900	Conventional		99%	99%	59	6	17042070871050				3782	Homeowner	2005	735	Yes		No			12		0	Not Reported				E (East)	5	2	2	0	2		2		2	Attached	None	None	Rarely available spacious Southeast Corner 2 bedroom 2 bath with split bedroom plan at  James House. See Pretty Park, Lake & City views from your balcony. Features include Crown molding, Neutral Decor, Updated Kitchen & Master bath with Bosch Washer & Dryer. Heat, Air & Cable included in Assmnt. Parking $130/Mo. 1 Pet 40lbs allowed.			Central Air	Gas, Forced Air				Oven/Range, Microwave, Dishwasher, Refrigerator, Washer, Dryer		Bike Room/Bike Trails, Door Person, Coin Laundry, Elevator, Exercise Room, Storage, On Site Manager/Engineer, Sundeck, Pool-Outdoors, Receiving Room, Security Door Locks, Tennis Court/s	Heat, Air Conditioning, Water, Common Insurance, Security, Doorman, Exterior Maintenance, Lawn Care, Scavenger, Snow Removal							Carpet					Carpet			Ceramic Tile	Carpet	Y	Carpet	16X11			15X12	19X16	10X8		10X8			Combined w/ LivRm	Balcony	06/01/2007	06/06/2007	06/06/2007	07/16/2007	
AT	1560	N	Sandburg	TER	1811	Chicago	Illinois	60610	8008	Cook	SANDBURG VILLAGE	299	299	520	Condo, High Rise (7+ Stories)		1970	07764418	CLSD		189000	150000	150000	179900	Cash	N/A	83%	79%	132	132	17042070871415				2281.71	Homeowner	2009	545	No		Yes	No		18		840	Estimated				W (West), City	3	1	1	0	1	0	1		1	Attached	None	None	INVEST IN DESIRABLE JAMES HOUSE!  LARGE ONE BEDROOM W/BALCONY & VERY LARGE BEDROOM. T HIS CONDO NEEDS A NEW OWNER AND NEW IDEAS.  Rehab THE ENTIRE PLACE AND MAKE IT SHINE!  BALCONY FACES WEST.  Parking available for $150.00 per month. Pool, Health-club & Tennis courts are available for a fee.   NEW WINDOWS!! Investors or handyman special!			Central Air	Gas, Zoned, Hot Water/Steam, Forced Air			NO	Oven/Range, Dishwasher, Refrigerator		Door Person, Coin Laundry, Elevator, Exercise Room, Health Club, Storage, On Site Manager/Engineer, Sundeck, Pool-Outdoors, Receiving Room, Service Elevator, Tennis Court/s	Water, Common Insurance, Doorman, TV/Cable, Exterior Maintenance, Lawn Care, Scavenger, Snow Removal					Yes								TV-Cable		Ceramic Tile	Carpet	None	Carpet				16X11	19X18	11X09			No additional rooms		Combined w/ LivRm	Balcony, Roof Deck	03/27/2011	08/05/2011	08/05/2011	08/22/2011	
AT	1560	N	Sandburg	TER	2603	Chicago	Illinois	60610	8008	Cook		299	299	520	High Rise (7+ Stories)			06565358	CLSD		249000	236750	236750	247500	Conventional		96%	95%	195	77	17042070871103	No			3,133		2005	403	Yes		No			26		0	Not Reported					3	1	1	0	1		1		1	Attached	None		Large 1 bedroom with balcony in desirable James House. Great views. Brazillian Cherry hardwood floors and crown molding in Living room. Upgraded kitchen with pass through to Living room and new bath. Tons of closets. Freshly painted. Parking available for $130/month. Dogs okay up to 40 lbs.			Central Air	Electric		Hardwood Floors					Heat, Air Conditioning, Water, Doorman, Exercise Facilities, Exterior Maintenance, Scavenger, Snow Removal																Hardwood	None					15X11	19X18	10X08						Balcony	06/26/2007	09/10/2007	09/10/2007	09/28/2007	
AT	1560	N	SANDBURG	TER	2710	Chicago	Illinois	60610	8008	Cook	Sandburg Village	299	299	520	Condo, High Rise (7+ Stories)		1970	07785349	CLSD		274000	229000	229000	239000	Cash	N/A	96%	84%	55	55	17042070871384				2770	Homeowner	2009	618	No		No	No		27	HIGH RISE	831	Estimated				E (East), Lake/Water	4	1	1	0	1	0	1	0	1	Attached	None	None	Fall in love w/rarely available Gold Coast high flr 1 Bdrm with breathtaking east unobstructed vws day & night of lake, park & city. New custom paint, new carpet & WD flrs just refinished. Kovacs Lamp in DR, stone tile in foyer and kit floors and Elfa organized closets. All marble bth w/whirlpool, newer mirrors, sink and toilet. Open kit, large balc. Seller paid for new windows. Pool, 24 hour drman and exercise rm.			Central Air	Forced Air		Hardwood Floors	NO	Oven/Range, Microwave, Dishwasher, Refrigerator		Bike Room/Bike Trails, Door Person, Coin Laundry, Elevator, Exercise Room, Storage, On Site Manager/Engineer, Party Room, Sundeck, Pool-Outdoors, Receiving Room, Service Elevator, Valet/Cleaner	Heat, Air Conditioning, Water, Common Insurance, Doorman	Draper & Kramer	Diana Cardenas		80									TV-Cable		Porcelain Tile	Hardwood	None	Carpet				16X11	18X19	11X8		COMBO	No additional rooms		Combined w/ LivRm	Balcony	04/20/2011	06/13/2011	06/13/2011	06/23/2011	
AT	1560	N	Sandburg	TER	3915	Chicago	Illinois	60610	8008	Cook	JAMES HOUSE	299	299	520	Condo, High Rise (7+ Stories)			06629067	CLSD		459000	433000	433000	459000	Conventional		94%	94%	14	14	17042070871515				3912		2005	781	Yes		No			39		0	Not Reported				N (North), W (West)	5	2	2	0	2		2		2	Attached	None		Spectacular Southwest corner 2 Bedroom, 2Bath split bedroom with balcony on the 39th floor at James House. Stunning unobstructed Park, Lake, LSD & Skyline Views. Brand New Natural red Oak Kultur Floating floor & Mohawk carpet. Other features include: Quaker wood cabinets, Jeson Jet Tub, Organized closets & More. Heat, Air & Cable included in assmnt. Parking $130/Mo. 1 Pet 40lbs, Allowed.			Central Air	Gas, Forced Air		Elevator, Hardwood Floors				Door Person, Coin Laundry, Elevator, Exercise Room, Storage, On Site Manager/Engineer, Party Room, Sundeck, Pool-Outdoors, Receiving Room, Security Door Locks, Tennis Court/s	Heat, Air Conditioning, Water, Common Insurance, Security, Doorman, TV/Cable, Exterior Maintenance, Lawn Care, Scavenger, Snow Removal																	Y		16X11			15X12	19X16	10X8		COMBO			Combined w/ LivRm	Balcony, Storms/Screens, End Unit	08/03/2007	08/16/2007	08/16/2007	09/27/2007	
AT	1560	N	SANDBURG	TER	1708	Chicago	Illinois	60610	8008	Cook	SANDBURG VILLAGE	299	299	520	Condo, High Rise (7+ Stories)		1969	06847656	CLSD		289000	254500	254500	279000	Conventional	N/A	91%	88%	192	69	17042070871294	No			3256.59	None	2006	524	No		No			17	1 BDR.	743.6					E (East), Lake/Water, Park	3	1	1	0	1		1		1	Attached	None		UNOBSTRUCTED VIEWS OF LAKE MICHIGAN, NORTH AVE.BEACH AND LINCOLN PARK! CLEAN ONE BDR.UNIT W/BALCONY.CERAMIC ENTRY FLOWS INTO THE KITCHEN.CABINETS AND COUNTER TOPS ARE UPDATED.BATH HAS NEWER VANITY AND COMMODE.WALK-IN CLOSET IN THE FOYER. MIRRORED BDR.CLOSET DOORS. NEUTRAL IVORY CARPETING.WHITE WALLS AND NO WALLPAPER. SANDBURG VILLAGE LIVING AT ITS BEST.CONVENIENCES GALORE AT YOUR DOORSTEP.BEST VIEWS AROUND!	UNIT IS VACANT. RECEIVING ROOM HAS THE KEY. CALL LISTING OFFICE TO REGISTER YOUR SHOWING. PLEASE NOTE RECEIVING ROOM HOURS: MON TO FRI 7AM-7PM,SAT 9AM-1PM,CLOSED SUNDAY.		Central Air, Zoned	Gas, Forced Air, Hot Water/Steam, Zoned		Elevator, Storage		Oven/Range, Refrigerator		Bike Room/Bike Trails, Door Person, Coin Laundry, Elevator, Exercise Room, Storage, On Site Manager/Engineer, Sundeck, Pool-Outdoors, Receiving Room, Tennis Court/s, Curbs/Gutters, Sidewalks, Street Lights, Street Paved	Heat, Air Conditioning, Water, Gas, Common Insurance, Doorman, TV/Cable, Exercise Facilities, Pool, Exterior Maintenance, Scavenger, Snow Removal				84									TV-Cable		Ceramic Tile	Carpet	None	Carpet				14X11	19X17	11X8					Combined w/ LivRm	Balcony	04/02/2008	06/09/2008	06/09/2008	07/02/2008	
AT	1560	N	Sandburg	TER	2904	Chicago	Illinois	60610	8008	Cook		299	299	520	High Rise (7+ Stories)		1970	06657244	CLSD		324900	310000	310000	324900	Conventional		95%	95%	11	11	17042070871146				3524.42	None	2006	520	No		No			29		831					E (East)	3	1	1	0	1		1		1		Full		Phenominenal East View of Lake and chicago Skyline Watch the morning sunrise over the lake from your private balcony. Newly updated Kitchen with Toast Cabinets, Corian Countertops and all new Appliances. Updaged bath with new vanitey, fixtures, and granite. All new flush doors. Elfa closet system in BR. Amazing location bike or walk to lake, shopping, parks. Steps from public transportation. 24hr doorman. Valet Gar			Central Air	Gas, Electric				Oven/Range, Microwave, Dishwasher, Refrigerator		Bike Room/Bike Trails, Door Person, Coin Laundry, Elevator, Exercise Room, Storage, Health Club, On Site Manager/Engineer, Party Room, Receiving Room, Security Door Locks, Service Elevator	Heat, Air Conditioning, Water, Common Insurance, Security, Doorman, TV/Cable, Exterior Maintenance, Lawn Care, Scavenger, Snow Removal													TV-Cable		Hardwood	Carpet	None	Carpet				16X11	20X18	11X8		COMBO					08/30/2007	09/09/2007	09/09/2007	10/18/2007	
AT	1560	N	SANDBURG	TER	2107	Chicago	Illinois	60610	8008	Cook		299	299	520	Condo, Studio		1964	06658124	CLSD		189000	168000	168000	179000	Conventional		94%	89%	67	67	17042070871258	No			1962	None	2005	289	No		No			21		0	Not Reported				W (West)	2	0	0	0	1		1		1		None	None	GREAT HIGH FLOOR VIEW FROM THIS LARGE SANDBURG VILLAGE STUDIO. THE SPACE CAN EASILY BE CONVERTED INTO A JR. 1 BED UNIT. HUGE WALK IN CLOSET AND VERY NEUTRAL DECOR HIGHLIGHT THE POTENTIAL THAT THIS UNIT HAS FOR A 1ST TIME BUYER,INVESTOR OR REHABBER, LOCATION, HIGH FLOOR AND GREAT VIEWS GIVE THIS UNIT A GREAT APPEAL.			Central Air	Forced Air, Hot Water/Steam				Oven/Range, Refrigerator		Bike Room/Bike Trails, Door Person, Coin Laundry, Elevator, Exercise Room, On Site Manager/Engineer, Pool-Outdoors, Security Door Locks, Tennis Court/s, Valet/Cleaner	Heat, Air Conditioning, Water, Common Insurance, Doorman, TV/Cable, Exterior Maintenance, Lawn Care, Scavenger															Marble	Carpet	None						30X14	13X09		COMBO					08/31/2007	11/05/2007	11/05/2007	12/17/2007	
AT	1560	N	Sandburg		608	Chicago	Illinois	60610	8008	Cook		299	299	493	Condo, High Rise (7+ Stories)		1969	07765016	CLSD		174900	150000	150000	164900	Conventional	N/A	91%	86%	108	108	17042070871284				3161		2009	529	No		No	No		6		740	Estimated				E (East)	4	1	1	0	1	0	1		1	Attached	None	None	Heart of Lincoln Park. Proximity to all Lincoln Park has to offer. Walk to restaurants, shops, lake front & park. James House Full-Amenity bld w/doorman, exerc & pary room. Pool with sundeck, tennis courts, & more. FHA-Approved. Large one BR, east facing. Combined living/dining area. 17x5 balcony. Not a short sale. Priced to sell!!	Great space to work with. Parking on site $150 per month.  Window replacement cost pre-paid by seller. Not a short sale. Priced to sell!!		Central Air	Gas, Forced Air			NO	Oven/Range, Microwave, Dishwasher, Refrigerator		Bike Room/Bike Trails, Door Person, Coin Laundry, Elevator, Exercise Room, Storage, Sundeck, Pool-Outdoors, Receiving Room, Service Elevator, Curbs/Gutters, Sidewalks, Street Lights, Street Paved	Heat, Air Conditioning, Water, Common Insurance, Security, Doorman, TV/Cable, Exterior Maintenance, Lawn Care, Scavenger, Snow Removal	Draper & Kramer	jkcondo@rcn.com	(312) 654-1560									Carpet			Ceramic Tile	Carpet	None	Carpet				15X11	19X17	11X08		COMBO	No additional rooms		Combined w/ LivRm	Balcony	03/28/2011	07/13/2011	07/13/2011	09/02/2011	
AT	1560	N	SANDBURG	TER	4204	Chicago	Illinois	60610	8008	Cook	SANDBURG VILLAGE	299	299	520	Condo, High Rise (7+ Stories)		1970	06648517	CLSD		299900	299900	299900	299900	Conventional		100%	100%	8	8	17042070871159	No			2542.58	None	2005	552	Yes		No			42		850					E (East), City, Lake/Water, Park	5	1	1	0	1		1		1		None		Priceless views of the Lake, Lincoln Park & Downtown from 18 foot balcony. Steps from North Ave Beach, Old Town & Lincoln Park. 2 Pools, Exercise Room, Tennis Courts, Penthouse, Sundeck & Dog Walking Area. Whirlpool, Sauna & Steamroom in unit. Leased indoor parking available.	A definite must see. Easy to show call LO for instructions.		Central Air	Gas, Forced Air		Sauna/Steam Room, Hardwood Floors		Oven/Range, Dishwasher, Refrigerator		Bike Room/Bike Trails, Door Person, Coin Laundry, Elevator, Exercise Room, On Site Manager/Engineer, Park/Playground, Sundeck, Pool-Outdoors, Receiving Room, Security Door Locks, Service Elevator, Tennis Court/s, Valet/Cleaner, Curbs/Gutters, Street Lights, Street Paved	Heat, Air Conditioning, Water, Common Insurance, Security, Doorman, TV/Cable, Exterior Maintenance, Scavenger, Snow Removal												Parquet	TV-Cable		Parquet	Carpet	None	Parquet				16X11	23X15	12X9		COMBO	Other		Combined w/ LivRm	Balcony	08/22/2007	08/29/2007	08/29/2007	10/15/2007	
AT	1560	N	Sandburg	TER	3506	Chicago	Illinois	60610	8008	Cook		299	299	520	Condo		1981	07828670	CLSD		250000	237000	237000	250000	Cash	N/A	95%	95%	30	30	17042070871232				2920		2009	640	No		No	No		35		830	Estimated					4	1	1	0	1	0	1		1	Attached	None	None	Spacious and bright high floor 1 bedroom unit with panoramic views of Lake, Park and Skyline. This tastefully designed home has an updated kitchen, open floor plan, large balcony off living room, and generous sized master. Located in desirable Sandburg Village, walk to shopping, restaurants, lake, and transit. Building amenities include exercise room, 2 pools, & 24 hr doorman. Garage parking available. Easy to Show!			Central Air	Gas, Forced Air			NO				Heat, Air Conditioning, Water, Gas, Common Insurance, Doorman, TV/Cable, Exterior Maintenance, Lawn Care, Scavenger, Snow Removal																Carpet	Full					15X11	19X17	10X8		COMBO	No additional rooms				06/09/2011	07/08/2011	07/08/2011	08/25/2011	
AT	1560	N	SANDBURG		1706	Chicago	Illinois	60610	8008	Cook		299	299	520	Condo, High Rise (7+ Stories)		1971	06664974	CLSD		299000	257500	257500	299000	Conventional		86%	86%	14	14	17042070871214				3314	None	2005	487	No		No			17		744					E (East)	4	1	1	0	1		1		1	Attached	None	None	LARGE ONE BEDROOM AT JAMES HOUSE! THIS BRIGHT AND LOVELY HOME HAS A DISHWASHER, LARGE BALCONY, BEAUTIFUL VIEWS OF THE LAKE AND PARK AND NEUTRAL DECOR. THE BUILDING HAS A GREAT OUTDOOR POOL, EXERCISE ROOM, 24 HOUR DOORMAN, A FULL-SERVICE BUIDING IN AN INCREDIBLE LOCATION! FEE PARKING AVAILABLE IN BLDG.			Central Air	Forced Air, Hot Water/Steam				Oven/Range, Microwave, Dishwasher, Refrigerator		Bike Room/Bike Trails, Door Person, Coin Laundry, Elevator, Exercise Room, Storage, On Site Manager/Engineer, Pool-Outdoors, Receiving Room, Valet/Cleaner	Heat, Air Conditioning, Water, Common Insurance, Exterior Maintenance, Scavenger, Snow Removal												Carpet				Carpet	None	Carpet				15X11	18X19	11X08		COMBO			Combined w/ LivRm	Balcony	09/07/2007	09/20/2007	09/20/2007	10/01/2007	
AT	1560	N	SANDBURG	TER	1803	Chicago	Illinois	60610	8008	Cook	SANDBURG VILLAGE	299	299	30	Condo		1970	06682542	CLSD		239900	226500	226500	239900	Conventional		94%	94%	38	38	17042070871095				3016	None	2005	445	Yes		No			18		0	Not Reported					4	1	1	0	1		1		1	Attached	None	None	HIGH FLOOR WEST FACING CONDO IN FLAGSHIP SANDBURG VILLAGE BUILDING HAS IT GOING ON! WASHER/DRYER IN UNIT, GREAT CITY/LAKE VWS FROM OVERSIZED BALCONY, CENTRAL HEAT/AIR, REDONE KITCHEN, TILES & BATH. LARGEST FLR-PLAN W/SPACE FOR OFFICE/DINING RM & HUGE SUNNY BDRM W/ENDLESS VIEWS. TONS OF CLOSETS, PRIVATE STGE & NO WAIT PARKING AVAILABLE IN AWESOME FULL AMENITY BLDG...POOL,TENNIS,DOORMAN,FITNESS CTR & MORE. SHOWS GREAT!	WASHER/DRYER IN UNIT! LARGE BALCONY! CENTRAL HEAT/AIR! VISIT WWW.1560SANDBURGCONDO.COM		Central Air	Gas, Forced Air, Hot Water/Steam, Indv Controls				Oven/Range, Dishwasher, Refrigerator, Washer, Dryer		Bike Room/Bike Trails, Door Person, Elevator, Exercise Room, Storage, On Site Manager/Engineer, Party Room, Sundeck, Pool-Outdoors, Receiving Room, Service Elevator, Tennis Court/s	Heat, Air Conditioning, Water, Common Insurance, Security, Doorman, TV/Cable, Exercise Facilities, Pool, Exterior Maintenance, Lawn Care, Scavenger, Snow Removal												Carpet			Ceramic Tile	Carpet	None	Carpet				17X11	20X18	11X08		COMBO			Combined w/ LivRm		09/24/2007	10/31/2007	10/31/2007	12/06/2007	
AT	1560	N	SANDBURG	TER	3505	Chicago	Illinois	60610	8008	Cook		299	299	520	Condo, High Rise (7+ Stories), Studio	7	1970	07881257	CLSD		129900	126000	126000	129900	Cash	N/A	97%	97%	50	50	17042070871192				1843	Homeowner	2009	373	No		No	No		35		640	Estimated				W (West)	3	0	0	0	1	0	1		1	Attached	Partial	Partially Finished	West, panoramic view from this high floor spacious jr. 1bdrm unit in premier Sandburg Village Bldg.  Over 600 sq.ft. New Hunter Douglas duet, room darkening shades.  New Trac lighting in dining area. Built-in Murphy Bed, Amazing closet space & great floor plan.  Full amenity bldg w/ 24hr doorman, on site mgmt, outdoor pool,exercise rm, storage, garage parking avail. pet friendly, 1dog up to 40 lbs. Easy to show.	UNBELIEVABLE VIEW! UNBELIEVABLE SPACE ! UNBELIEVABLE DEAL. MUST SEE THIS UNIT IN PREMIER SANDBURG VILLAGE BLDG. EASY TO SHOW. PET FRIENDLY, 1 DOG UP TO 40LBS. OUTDOOR POOL AVAIL PARKING		Central Air	Gas, Other			No	Oven/Range, Microwave, Refrigerator		Bike Room/Bike Trails, Door Person, Coin Laundry, Elevator, Exercise Room, Storage, On Site Manager/Engineer, Party Room, Sundeck, Pool-Outdoors, Receiving Room, Service Elevator	Heat, Air Conditioning, Water, Gas, Common Insurance, Security, Doorman, TV/Cable, Exterior Maintenance, Lawn Care, Scavenger, Snow Removal		RICHARD VICENS	(312) 654-1560	80												Carpet	Full						21X14	10X07		COMBO	No additional rooms		Combined w/ LivRm		08/15/2011	10/03/2011	10/03/2011	10/24/2011	
AT	1560	N	Sandburg	TER	2708	Chicago	Illinois	60610	8008	Cook	JAMES HOUSE	299	299	520	Condo, High Rise (7+ Stories)	30	1971	07882637	CLSD		249000	232500	232500	249000	Conventional	N/A	93%	93%	115	115	17042070871304				2740.29	Homeowner	2009	561	Yes	52	No	No		27		0	Not Reported				E (East), Lake/Water, Park	4	1	1	0	1	0	1		1	Attached	None	None	Rarely available hi-flr east-facing unit at James House w/fabulous,unobstructed lake,park & skyline vu,balcony,open kit w/SS appls,hdwd flrs in bdrm,new marble bath w/maple cab,Toto toilet,rain shower head+hand held spray in shower w/Bizazza tile. Track lites & organized closets. Seller paid for new windows & they are installed. One pet allowed up to 40 lbs. Transportation,shopping & recreation outside your door!			Central Air	Gas, Forced Air		Hardwood Floors	No	Oven/Range, Microwave, Dishwasher, Refrigerator		Bike Room/Bike Trails, Door Person, Coin Laundry, Elevator, Exercise Room, Storage, On Site Manager/Engineer, Party Room, Pool-Outdoors, Receiving Room, Service Elevator, Tennis Court/s, Valet/Cleaner	Heat, Air Conditioning, Water, Common Insurance, Security, Doorman, TV/Cable, Exterior Maintenance, Lawn Care, Scavenger, Snow Removal	Draper & Kramer		(312) 654-1560									Carpet	TV-Cable		Ceramic Tile	Carpet	None	Hardwood				15X11	19X17	11X08		COMBO	No additional rooms		Combined w/ LivRm	Balcony, Storms/Screens	08/17/2011	12/09/2011	12/09/2011	02/29/2012	
AT	1560	N	Sandburg	TER	3509	Chicago	Illinois	60610	8008	Cook		299	299	520	Condo, Studio	43	1970	07879536	CLSD		149999	128000	128000	149999	Cash	N/A	85%	85%	214	214	17042070871352				1141	Homeowner	2009	363	No		No	No		35		650	Estimated				W (West), City	2	0	0	0	1	0	1		1	Attached	None	None	Perfect Jr. 1 BR with breathtaking views from 35th floor. Spacious 650 SF Convertible Studio w/ generous room sizes, large kitchen, huge walk in closet and tons of natural light.  Walk to Gold Coast and Old Town Neighborhoods. Full amenity building with 24hr doorman, Tennis courts, and 2 pools. Steps to Restaurants, nightlife, public transit. Garage parking avail.			Central Air	Forced Air, Baseboard			No	Oven-Double, Microwave, Dishwasher, Refrigerator		Bike Room/Bike Trails, Door Person, Coin Laundry, Elevator, Exercise Room, Storage, On Site Manager/Engineer, Sundeck, Pool-Outdoors, Receiving Room, Service Elevator, Tennis Court/s	Heat, Air Conditioning, Water, Common Insurance, Security, Doorman, TV/Cable, Exterior Maintenance, Lawn Care, Scavenger, Snow Removal				80	Yes								TV-Cable, Security System		Ceramic Tile	Carpet	None						21X14	07X10			No additional rooms				08/12/2011	03/12/2012	03/12/2012	04/04/2012	
AT	1560	N	Sandburg	TER	1103	Chicago	Illinois	60610	8008	Cook	Sandburg Village	299	299	520	Condo	40	UNK	07864710	CLSD		169900	145000	145000	169900	Cash	N/A	85%	85%	292	292	17042070871089				2338		2010	526	No		No	No		11		831	Landlord/Tenant/Seller					4	1	1	0	1	0	1		1	Attached	None	None	What a deal!  Large one bedroom with a balcony.  Priced to sell immediately.  This unit has been well taken care of.  Don't miss it.  Heat/basic cable included in assessments.  Parking available for fee.			Central Air	Gas, Hot Water/Steam			No			Bike Room/Bike Trails, Door Person, Coin Laundry, Elevator, Exercise Room, Storage, On Site Manager/Engineer, Party Room, Sundeck, Pool-Outdoors, Receiving Room, Security Door Locks, Service Elevator	Heat, Air Conditioning, Water, Common Insurance, Security, Doorman, TV/Cable, Exterior Maintenance, Lawn Care, Scavenger, Snow Removal	James/Kilmer Association	Diana	(312) 654-1560														None					11X16	18X19	11X8		COMBO	No additional rooms				07/25/2011	05/11/2012	05/11/2012	05/21/2012	
AT	1560	N	SANDBURG	TER	1207	Chicago	Illinois	60610	8008	Cook	JAMES HOUSE	299	299	520	Condo, Studio	43	1970	07804272	CLSD		139000	118500	118500	124900	Cash	N/A	95%	85%	859	147	17042070871250				1973.65	None	2009	330	No		No	No		12		641	Builder				W (West)	3	0	0	0	1	0	1	0	1	Attached	None	None	WEST FACING STUDIO WITH SPACIOUS & OPEN LAYOUT. NEW CARPET, PAINT & WINDOW TREATMENTS. THIS UNIT IS SPOTLESS! CONVENIENT TO EVERYTHING - LINCOLN PARK, LAKE, TRANSPORTATION, GROCERY, RESTAURANTS & SHOPPING. GARAGE PKG. FOR A FEE. AVAILABLE IMMEDIATELY.  WINDOWS ARE IN AND PAID FOR.	NOT A SHORT SALE OR FORECLOSURE.  PROPERTY IS OWNED BY AN ILLINOIS LICENSED REALTOR, NOT THE LISTING AGENT. ONLY 1 ANIMAL ALLOWED, UP TO 40 LBS.		Central Air	Gas, Hot Water/Steam			No	Oven/Range, Refrigerator		Bike Room/Bike Trails, Door Person, Elevator, Exercise Room, Storage, On Site Manager/Engineer, Party Room, Sundeck, Pool-Outdoors, Curbs/Gutters, Sidewalks, Street Lights, Street Paved	Heat, Air Conditioning, Water, Gas, Common Insurance, Doorman, TV/Cable, Exterior Maintenance, Lawn Care, Scavenger, Snow Removal					Yes							Carpet	TV-Cable		Ceramic Tile	Carpet	None						20X14	10X07		13X06	No additional rooms		Combined w/ LivRm	Storms/Screens	05/11/2011	10/04/2011	10/04/2011	10/18/2011	
AT	1560	N	Sandburg	TER	2709	Chicago	Illinois	60610	8008	Cook	JAMES HOUSE	299	299	520	Condo, Studio	1	1970	07947214	CLSD		135900	125000	125000	135900	Cash	N/A	92%	92%	4	4	17042070871344				1961.95	None	2010	357	No		Yes	No		27		636	Builder				W (West)	3	0	0	0	1	0	1	0	1	Attached	None	None	The perfect studio in Sandburg's most desired James House. Over 600 sq ft open space with updated kitchen and bath. Well maintained unit with neutral tones thru-out. Excellent storage space with very large walk in closet. Enjoy unobstructed west view with new windows! Excellent amenities. Spoil yourself in an outstanding location in the middle of Gold Coast and Old Town. Steps away from Lincoln Park, North Ave beach.	The James House will be completed in Summer 2012 with new windows & exterior facelift. Price points will most likely go up. Now is the time to get your clients into this bldg!		Central Air	Gas, Forced Air		Storage	No	Oven/Range, Microwave, Dishwasher, Refrigerator		Bike Room/Bike Trails, Door Person, Coin Laundry, Elevator, Exercise Room, Storage, On Site Manager/Engineer, Party Room, Pool-Outdoors, Receiving Room, Security Door Locks, Service Elevator, Tennis Court/s, Valet/Cleaner	Heat, Air Conditioning, Water, Gas, Common Insurance, Security, Security System, Doorman, TV/Cable, Exterior Maintenance, Lawn Care, Scavenger, Snow Removal	Draper Kramer	Nichelle Meadors	(312) 654-1560	80	Yes							Carpet			Ceramic Tile	Carpet	None						20X14	07X09		13X06	Walk In Closet		Combined w/ LivRm		11/18/2011	11/21/2011	11/21/2011	12/09/2011	
AT	1560	N	Sandburg	TER	1908	Chicago	Illinois	60610	8008	Cook		299	299	520	Condo	1	1970	07940956	CLSD		239000	212500	212500	239000	Conventional	N/A	89%	89%	113	113	17042070871296				897.18	Senior, F	2009	590	No		No	No		19		750	Estimated					4	1	1	0	1	0	1		1	Attached	None	None	GREAT HIGH FLOOR EAST FACING 1 BEDROOM WITH PANORAMIC VIEWS OF LINCOLN PARK, THE LAKE, AND THE CITY. THIS LARGE 1 BEDROOM FEATURES A PARTIALLY OPENED KITCHEN, GOOD SIZED LIVING AREA THAT FLOWS TO A LARGE BALCONY, PLENTY OF CLOSET AND STORAGE SPACE. SITUATED IN THE HEART OF OLD TOWN. THIS BUILDING FEATURES: DOOR STAFF, POOL, EXERCISE ROOM. CLOSE TO TRANSPORTATION, PARKS, BEACHES, THE DRIVE AND MORE. EASY TO SHOW!			Central Air	Gas, Forced Air			No				Air Conditioning, Water, Common Insurance, Security, Doorman, Exercise Facilities, Lawn Care, Scavenger, Snow Removal																	None					11X15	17X19	10X8		COMBO	No additional rooms				11/08/2011	02/28/2012	02/28/2012	03/20/2012	
AT	1560	N	Sandburg	TER	2309J	Chicago	Illinois	60610	8008	Cook	JAMES HOUSE	299	299	520	Studio	1	1964	07940989	CLSD		139600	118500	118500	139600	Cash	F	85%	85%	29	29	17042070871340				2089.97		2009	350	No		No	No		23		0	Not Reported					2	0	0	0	1	0	1				None	None	Location, Location, Location this is a must see gold coast studio with an updated bath, well maintained kitchen and a large living area. The property is walk to everything, low assessments and so much more.This is a Homepath property approved for Homepath and Homepath renovation financing. Purchase this property for as little as 3 % down,Owner occupant offers considered first 15 days prior to investor	pls submit all offers to Offers@smithreo.com, see www.homepath.com for more information, BUILDING IS FHA APPROVED,		Central Air	Electric			No				Heat, Air Conditioning, Water, Common Insurance, Doorman, TV/Cable, Exterior Maintenance, Lawn Care, Scavenger, Snow Removal	Carl Sandburg  Village homeowners.		(312) 440-3615		Yes												None						20X14	9X10			No additional rooms				11/08/2011	12/06/2011	12/06/2011	12/29/2011	
