AT	159	E	Walton		9A	Chicago	Illinois	60611	8008	Cook	PALMOLIVE BUILDING LANDMARK	299	299	100	Condo, High Rise (7+ Stories)		1929	07207097	CLSD		1650000	1400000	1400000	1500000	Cash	N/A	93%	85%	151	151	17032130201065	No			23244	None	2007	1520	Yes		No			9	VINTAGE	2482					N (North), E (East), W (West), City, Lake/Water	5	2	2	0	2	1	2.1	1	1	Attached	None		TRULY THE BEST OF SHOW AND BEST PRICE CONDO IN TOWN. Palmolive Building - Gracious, PreWar Bones, yet new interior construction w/advanced tech in Premier A Tier - Corner unit flooded w/light - 9'7" ceils in principle rms, huge windows, 4" white oak floors thruout, stunning mbath, fireplace, wolf/subzero appls. Pkg available for add'l $75k. Pvt health club, concierge, Beacon Club, N/E/W vws of lake. 2482sqf			Central Air, Zoned	Forced Air, Hot Water/Steam		Hardwood Floors, Laundry Hook-Up in Unit, Storage		Oven/Range, Microwave, Dishwasher, Refrigerator, Freezer, Washer, Dryer, Disposal		Bike Room/Bike Trails, Door Person, Elevator, Exercise Room, Storage, Health Club, On Site Manager/Engineer, Party Room, Receiving Room, Service Elevator, Steam Room, Whirlpool	Heat, Air Conditioning, Water, Gas, Common Insurance, Security, Doorman, TV/Cable, Exercise Facilities, Exterior Maintenance, Lawn Care, Scavenger, Snow Removal							Hardwood					Hardwood			Hardwood	Hardwood	Full	Hardwood	17X13			17X14	17X19	18X17		17X19	Gallery, Utility Room-1st Floor	Separate Shower, Double Sink	Separate	End Unit	05/05/2009	10/02/2009	10/02/2009	10/27/2009	
AT	159	E	WALTON	ST	20A	Chicago	Illinois	60611	8008	Cook		299	299	99	Condo, High Rise (7+ Stories)		1929	06837869	CLSD		5250000	3750000	3750000	4600000	Conventional		82%	71%	254	254	17032130201018	No			7442.47		2007	3664	No		No			20		4700					N (North), S (South), W (West), City, Lake/Water	10	4	4	0	3	1	3.1	1	2	Attached	None	None	SPECTACULAR 1ST RESALE UNIT AT THE PALMOLIVE BUILDING. INCREDIBLE LAKE VWS. 4700+ SQFT FEELS LIKE SFH. EXQUISITE ATTENTION TO DETAIL: OAK FLRS, CROWN MOLDINGS THRU-OUT, POCKET DOORS, ALL PUB ROOMS WIRED FOR SOUND. FORMAL LR & SEP DR IDEAL FOR ENTERTAINING. SPACIOUS FAMILY RM OFF KIT. GRAND KTICH FEAT ISLAND W/BRKFST BAR + EAT-IN AREA, TOP SS APPL. MASTER SUITE W/DRESS RM, WIC, LUX MABA W/JACUZZI TUB W/LAKE VW.			Central Air, Zoned	Forced Air, 2+ Sep Heating Systems		Vaulted/Cathedral Ceilings, Bar-Dry, Laundry Hook-Up in Unit		Oven-Double, Oven/Range, Microwave, Dishwasher, Refrigerator, Washer, Dryer, Disposal		Bike Room/Bike Trails, Door Person, Elevator, Exercise Room, Storage, Health Club, On Site Manager/Engineer, Party Room, Receiving Room, Sauna, Security Door Locks, Service Elevator, Whirlpool, Curbs/Gutters, Sidewalks, Street Lights, Street Paved	Water, Gas, Common Insurance, Doorman, TV/Cable, Clubhouse, Exercise Facilities, Scavenger, Snow Removal							Carpet	Carpet	Carpet			Hardwood	TV-Cable, Security System, Fire Sprinklers	Hardwood	Hardwood	Hardwood	Full	Carpet	14X12	11X13	09X12	17X17	20X16	21X16	20X16	20X13	Den, FAM, Gallery, Play Room	Whirlpool, Separate Shower, Double Sink	Separate	End Unit	03/24/2008	12/02/2008	12/02/2008	01/19/2009	
AT	159	E	Walton	ST	10-A	Chicago	Illinois	60611	8008	Cook	PALMOLIVE BUILDING LANDMARK	299	299	102	Condo, High Rise (7+ Stories)		1929	06779923	CLSD		1992000	1800000	1800000	1992000	Conventional		90%	90%	176	176	17032130010000	No			NEW		2006	1615	No		No			10		2482					N (North), S (South)	5	2	2	0	2	1	2.1	1	1	Attached	None		Located on the NW corner w/views of Michigan Avenue & the lake. Top finishes & barely lived in, this resale is on one of the four floors offering extraordinary ceiling height. 2482 SF, w/2 BRs, 2.1 BA. Unit features lrg wndws, 4" white oak flrs thruout, opulent mbath, fireplace, top appliances & advanced technology. The building has a beautiful party room & pvt health club, superb door service & building management.			Central Air, Zoned	Forced Air, 2+ Sep Heating Systems, Zoned		Hardwood Floors, Laundry Hook-Up in Unit		Oven/Range, Microwave, Dishwasher, Refrigerator, Freezer, Washer, Dryer, Disposal		Door Person, Elevator, Exercise Room, Storage, Health Club, On Site Manager/Engineer, Party Room, Receiving Room, Sauna, Security Door Locks, Service Elevator, Steam Room, Valet/Cleaner, Whirlpool, Curbs/Gutters, Sidewalks, Street Lights, Street Paved	Water, Gas, Common Insurance, Security System, Doorman, TV/Cable, Clubhouse, Exercise Facilities, Scavenger, Snow Removal							Hardwood						TV-Cable, Security System, Fire Sprinklers, CO Detectors		Hardwood	Hardwood	Full	Hardwood	16X13			17X14	33X19	17X18		COMBO	Foyer, Gallery	Whirlpool, Separate Shower, Double Sink	Combined w/ LivRm		01/22/2008	07/15/2008	07/15/2008	08/25/2008	
AT	159	E	WALTON	ST	13E	Chicago	Illinois	60611	8008	Cook	PALMOLIVE BUILDING LANDMARK	299	299	102	Condo, High Rise (7+ Stories), Vintage		1929	06840347	CLSD		700000	720000	720000	700000	Conventional	N/A	103%	103%	227	58	17032130010000	No			1200	None	2006	883	No		Unknown			13		1146					S (South)	3	1	1	0	1		1		1	Attached	None	None	THE PALMOLIVE- A DISTINCTIVE ADDRESS IN LANDMARK BUILDING. CHIC PIED-A-TERRE WITH DESIGNER TOUCHES. MARBLE COUNTERTOPS COMPLETE THE LARGE AND SUPERBLY APPOINTED KITCHEN. PERFECT FOR DINNER PARTIES. RICH TONES SET OFF THE LIVING AREA. STATE OF THE ART SYSTEMS AND TOP OF THE LINE APPLIANCES. 1 PRKG SPACE ADD'L $50K.  ASSM INCL PRKG/UNIT/INTERNET.			Central Air	Forced Air		Hardwood Floors, Laundry Hook-Up in Unit		Oven/Range, Microwave, Dishwasher, Refrigerator, Washer, Dryer, Disposal		Door Person, Elevator, Exercise Room, Storage, Health Club, On Site Manager/Engineer, Party Room, Receiving Room, Service Elevator, Valet/Cleaner, Whirlpool	Heat, Water, Gas, Common Insurance, Security, Doorman, Exercise Facilities, Exterior Maintenance, Scavenger, Snow Removal				0											Hardwood	Hardwood	Shared	Hardwood				16X12	14X14	14X9			Other	Whirlpool	Combined w/ LivRm		03/26/2008	05/22/2008	05/22/2008	05/23/2008	
AT	159	E	Walton	PL	29A	Chicago	Illinois	60611	8008	Cook		299	299	97	Condo, High Rise (7+ Stories)		1929	06705031	CLSD		5875000	5875000	5875000	5875000	Contract		100%	100%	465	95	17032130010000				NEW	None	2006	3876	No		Unknown			29		5400					N (North), S (South), E (East), W (West)	9	3	3	0	3	1	3.1	2	1	Attached	None		PALMOLIVE BUILDING,NEW INTERIOR CONSTR. IN MICHIGAN AVE LANDMARK-FINEST FINISHES IN CHICAGO-LGE WNDWS,HI CEILS,4"OAK FLRS THRUOUT,OPULENT MBATH FIREPLACES,TOP APPLIANCES-ADV TECHNOLOGY-LIBRARY, FAM.ROOM, 3 BDRM, 3.5BRM, HTD PKG, PVT HEALTH CLUB, PVT CLUB ROOM			Central Air, Zoned	Forced Air, 2+ Sep Heating Systems, Zoned						Door Person, Elevator, Exercise Room, Storage, Health Club, On Site Manager/Engineer, Party Room, Receiving Room, Sauna, Security Door Locks, Service Elevator, Steam Room, Valet/Cleaner, Whirlpool, Curbs/Gutters, Sidewalks, Street Lights, Street Paved	Water, Gas, Common Insurance, Security, Doorman, TV/Cable, Clubhouse, Exercise Facilities, Scavenger, Snow Removal				45									TV-Cable, Security System, Fire Sprinklers, CO Detectors				Y		12X14	11X14		20X15	15X23	14X17	16X17	15X17	Den, Other		Separate		10/16/2007	01/18/2008	01/18/2008	03/21/2008	
AT	159	E	Walton	PL	30A	Chicago	Illinois	60611	8008	Cook		299	299	97	Condo, High Rise (7+ Stories)		1929	06811247	CLSD		5900000	5875000	5875000	5900000	Conventional		100%	100%	225	225	17032130010000				NEW	None	2006	3876	Yes		Unknown			30		5400					N (North), S (South), E (East), W (West)	9	3	3	0	3	1	3.1	2	1	Attached	None		PALMOLIVE BUILDING,NEW INTERIOR CONSTR. IN MICHIGAN AVE LANDMARK-FINEST FINISHES IN CHICAGO-LGE WNDWS,HI CEILS,4"OAK FLRS THRUOUT,OPULENT MBATH FIREPLACES,TOP APPLIANCES-ADV TECHNOLOGY-LIBRARY, FAM.ROOM, 3 BDRM, 3.5BRM, HTD PKG, PVT HEALTH CLUB, PVT CLUB ROOM			Central Air, Zoned	Forced Air, 2+ Sep Heating Systems, Zoned						Door Person, Elevator, Exercise Room, Storage, Health Club, On Site Manager/Engineer, Party Room, Receiving Room, Sauna, Security Door Locks, Service Elevator, Steam Room, Valet/Cleaner, Whirlpool, Curbs/Gutters, Sidewalks, Street Lights, Street Paved	Water, Gas, Common Insurance, Security, Doorman, TV/Cable, Clubhouse, Exercise Facilities, Scavenger, Snow Removal				45									TV-Cable, Security System, Fire Sprinklers, CO Detectors				Y		12X14	11X14		20X15	15X23	14X17	16X17	15X17	Den, Other		Separate		05/01/2007	12/11/2007	12/11/2007	02/26/2008	
AT	159	E	Walton	ST	8-F	Chicago	Illinois	60611	8008	Cook		299	299	93	Condo		1929	06749223	CLSD		675000	678050	678050	675000	Conventional		100%	100%	58	58	17032130201077				3804.98	None	2006	855	No		No			8		1146					S (South)	4	1	1	0	1		1		1	Attached	None		Motivated seller has reduced below purchase price! Palmolive Building offers large windows, high ceils, opulent master bath, top appliances, advanced technology. This 1146 SQFT 1 BR, 1 BA was once the model apt. Parking space available for an addtl $50K. Private health club, elegant club room for residents. Tenant occupied through 4/30/08. 48 Hr notice for showings.			Central Air, Zoned	Forced Air, 2+ Sep Heating Systems, Zoned		Hardwood Floors, Laundry Hook-Up in Unit		Oven/Range, Microwave, Dishwasher, Refrigerator, Washer, Dryer, Disposal		Door Person, Elevator, Exercise Room, Storage, Health Club, On Site Manager/Engineer, Party Room, Receiving Room, Sauna, Security Door Locks, Service Elevator, Steam Room, Curbs/Gutters, Sidewalks, Street Lights, Street Paved	Heat, Water, Gas, Common Insurance, Security, Doorman, TV/Cable, Clubhouse, Exercise Facilities, Scavenger, Snow Removal													TV-Cable, Security System, Fire Sprinklers, CO Detectors				Full					16X12	14X14	14X08		14X09	Gallery	Whirlpool	Combined w/ LivRm		12/10/2007	02/05/2008	02/05/2008	02/22/2008	
AT	159	E	WALTON		32A	Chicago		60611	8008	Cook	PALMOLIVE BLDG. LANDMARK	299	299	102	Condo, High Rise (7+ Stories), Vintage		1929	04247082	CLSD		5129000	5615000	5615000	5615000	Conventional		100%	109%	624	624	1703213001	No			NEW	None	2006	3143			Unknown			32		5400					N (North), S (South), E (East), W (West)	10	3	3	0	3	1	3.1	2	2	Attached	None	None	PALMOLIVE BUILDING-OFFERING THE FINEST STANDARD FINISHES EVER SEEN IN CHICAGO-NEW INTERIOR CONSTRCTN IN MICHIGAN AVE LANDMARK-LRG WNDWS,HICEILS,4"WHITE OAK FLRS THRUOUT,OPULENT MBATH,FIREPLACES,TOP APPLIANCES,ADVANCED TECHNOLOGY-HTD PKG PVT HEATH CLUB-MAHOGANY PANELED ENTERTNMNT SPACE-CONCIERGE 32A HAS 5400SF, 9'7" CEILINGS, N-S-E-W VIEWS			Central Air, Zoned	Forced Air, 2+ Sep Heating Systems, Zoned		Hardwood Floors, Laundry Hook-Up in Unit		Oven/Range, Microwave, Dishwasher, Refrigerator, Washer, Dryer, Disposal		Door Person, Elevator, Exercise Room, Storage, Health Club, On Site Manager/Engineer, Party Room, Receiving Room, Sauna, Security Door Locks, Service Elevator, Steam Room, Valet/Cleaner, Whirlpool, Curbs/Gutters, Sidewalks, Street Lights, Street Paved	Water, Gas, Common Insurance, Doorman, TV/Cable, Clubhouse, Exercise Facilities, Scavenger, Snow Removal				0									TV-Cable, Security System, Fire Sprinklers, CO Detectors				Full		14X12	14X11	12X11	20X16	15X23	18X17	17X17	17X15	FAM, Gallery, Library, Other	Whirlpool, Separate Shower, Double Sink	Separate	Storms/Screens	10/15/2004	06/30/2006	06/30/2006	02/20/2008	
AT	159	E	Walton	ST	27A	Chicago	Illinois	60611	8008	Cook	PALMOLIVE BUILDING LANDMARK	299	299	97	Condo, High Rise (7+ Stories)		1929	06674919	CLSD		5500000	5150000	5150000	5500000	Conventional		94%	94%	101	101	17032130010000	No			NEW	None	2006	3162	Yes		No			27		5400					N (North), S (South), E (East), W (West)	10	4	4	0	4	1	4.1	2	1	Attached	None	None	PALMOLIVE BUILDING'S MAGNIFICENT MODEL APT! A WORLD-CLASS FULL FLOOR UNIT WITH PRIVATE ELEVATOR FOYER. FOUR EXPOSURES PROVIDING PHENOMENAL VIEWS. HIGHEST INTERIOR FINISHES PLUS 10' CEILINGS, 4" WHITE OAK FLOORS, TOP APPLIANCES, SMART-HOME TECHNOLOGY, PANELED LIBRARY W/FP, LUXURIOUS MASTER SUITE W/EXTRAORDINARY VIEWS. BLDNG FEATURES PVT. HEALTH CLUB, PVT. CLUB ROOM, CONCIERGE, 2 HEATED PKG. SPACES INCLUDED IN PRICE!!	IF YOU'D LIKE TO EMAIL FOR SHOWING REQUESTS, PLEASE SEND EMAIL TO JFIELD@KSGMAC.COM OR MWEBER@KSGMAC.COM		Central Air, Zoned	Forced Air, 2+ Sep Heating Systems, Zoned		Elevator, Hardwood Floors, Laundry Hook-Up in Unit, Storage		Oven-Double, Microwave, Dishwasher, Refrigerator, Refrigerator-Bar, Freezer, Washer, Dryer, Disposal, Compactor-Trash		Door Person, Elevator, Exercise Room, Storage, Health Club, On Site Manager/Engineer, Party Room, Receiving Room, Sauna, Security Door Locks, Service Elevator, Steam Room, Valet/Cleaner, Whirlpool, Curbs/Gutters, Sidewalks, Street Lights, Street Paved	Heat, Air Conditioning, Water, Gas, Common Insurance, Security, Doorman, TV/Cable, Clubhouse, Exercise Facilities, Scavenger, Snow Removal				45			Hardwood	Hardwood	Hardwood			Hardwood	TV-Cable, Security System, Fire Sprinklers, CO Detectors	Hardwood	Hardwood		Full	Hardwood	12X11	15X12	14X12	20X15	24X15	18X16	18X17	17X15	Den, Gallery, Library, Other	Whirlpool, Separate Shower	Separate		09/17/2007	12/26/2007	12/26/2007	02/15/2008	
AT	159	E	Walton	PL	10A	Chicago	Illinois	60611	8008	Cook		299	299	102	Condo, High Rise (7+ Stories), Vintage		1929	06705021	CLSD		1981000	1981000	1981000	1981000	Contract		100%	100%	59	9	17032130010000	No			NEW	None	2005	1615	No		Unknown			10		2482					N (North), S (South), E (East)	4	2	2	0	2	1	2.1	1	1	Attached	None	None	PALMOLIVE BUILDING OFFERING THE FINEST STANDARD FINISHES EVER SEEN IN CHICAGO NEW INTERIOR CONSTRCTN ON MICHIGAN AVE LANDMARK LRG WNDWS,HI CEILS,4"WHITE OAK FLRS THRUOUT,OPULENT MBATH,FIREPLACE,TOP APPLIANCES,ADVANCED TECHNOLOGY,HTD PKG PVT HEALTH CLUB-MAHOGANY PANELED ENTERTNMNT SPACE-CONCIERGE 2482SF WITH 12'-13'7" CEILINGS IN PRINCIPAL RMS, N/W/E EXP.	Please contact Katherine Chez at 312-440-7533 to set up appo		Central Air, Zoned	Forced Air, 2+ Sep Heating Systems, Zoned		Hardwood Floors, Laundry Hook-Up in Unit		Oven/Range, Microwave, Dishwasher, Refrigerator, Freezer, Washer, Dryer, Disposal		Door Person, Elevator, Exercise Room, Storage, Health Club, On Site Manager/Engineer, Park/Playground, Party Room, Receiving Room, Sauna, Security Door Locks, Service Elevator, Steam Room, Valet/Cleaner, Whirlpool, Curbs/Gutters, Sidewalks, Street Lights, Street Paved	Water, Gas, Common Insurance, Security, Doorman, TV/Cable, Clubhouse, Exercise Facilities, Scavenger, Snow Removal				0									TV-Cable, Security System, Fire Sprinklers, CO Detectors				Full		16X13			17X14	33X19	17X18			Foyer, Gallery	Whirlpool, Separate Shower, Double Sink	Combined w/ LivRm		10/16/2007	10/24/2007	10/24/2007	12/06/2007	
AT	159	E	Walton		9A	Chicago	Illinois	60611	8008	Cook	Palmolive	299	299	102	Condo, High Rise (7+ Stories)		1929	06286355	CLSD		1850000	1745000	1745000	1795000	Conventional		97%	94%	399	399	17032730010000				NEW	None	2005	1775	Yes		No			9		2482					N (North), E (East), W (West)	5	2	2	0	2	1	2.1	1	1	Attached	None		Palmolive Building - Top of the line finishes - New interior construction in landmark bldg - 9'7" ceils in principle rms, lrg windows, 4" white oak flrs thruout, 2nd bed open to liv rm, stunning mbath, fireplace, Wolf/Sub Zero appls, advanced technology. 1 valet pkg available. Pvt health club, concierge, entertainment space. N/E/W vws incl vws of lake. 2482 sqft.			Central Air	Forced Air, Hot Water/Steam		Elevator, Hardwood Floors, Laundry Hook-Up in Unit, Storage		Oven/Range, Microwave, Dishwasher, Refrigerator, Freezer, Washer, Dryer, Disposal		Door Person, Elevator, Exercise Room, Storage, Health Club, On Site Manager/Engineer, Party Room, Receiving Room, Service Elevator, Steam Room, Whirlpool	Heat, Air Conditioning, Water, Gas, Common Insurance, Doorman, TV/Cable, Exercise Facilities, Exterior Maintenance, Lawn Care, Scavenger, Snow Removal							Hardwood					Hardwood			Hardwood	Hardwood	Full	Hardwood	17X13			17X14	17X19	18X17		17X19	Foyer	Separate Shower, Double Sink	Separate		09/21/2006	10/24/2007	10/24/2007	11/21/2007	
AT	159	E	WALTON	PL	10E	Chicago	Illinois	60611	8008	Cook		299	299	102	Condo, High Rise (7+ Stories), Vintage		1929	06729686	CLSD		807000	807000	807000	807000	Contract		100%	100%	1	1	17032130010000	No			NEW	None	2006	748	Yes		Unknown			6		1825					S (South), E (East), W (West)	4	2	2	0	2	1	2.1	1	1	Attached	None	None	PALMOLIVE BUILDING-OFFERING THE FINEST STANDARD FINISHES EVER SEEN IN CHICAGO-NEW INTERIOR CONSTRCTN IN MICHIGAN AVE LANDMARK-LRG WNDWS,HI CEILS,4"WHITE OAK FLRS THRUOUT,OPULENT MBATH,FIREPLACES,TOP APPLIANCES,ADVANCED TECHNOLOGY-HTD PKG PVT HEALTH CLUB-MAHOGANY PANELED ENTERTNMNT SPACE-CONCIERGE 6E HAS 1848 SF, 9'7" CEILINGS, SOUTH,EAST,WEST VIEWS			Central Air, Zoned	Forced Air, 2+ Sep Heating Systems, Zoned		Hardwood Floors, Laundry Hook-Up in Unit		Oven/Range, Microwave, Dishwasher, Dishwasher-Portable, Refrigerator, Freezer, Washer, Dryer, Disposal		Door Person, Elevator, Exercise Room, Storage, Health Club, On Site Manager/Engineer, Party Room, Receiving Room, Sauna, Security Door Locks, Service Elevator, Steam Room, Valet/Cleaner, Whirlpool, Curbs/Gutters, Sidewalks, Street Lights, Street Paved	Water, Gas, Common Insurance, Security, Doorman, TV/Cable, Clubhouse, Exercise Facilities, Scavenger, Snow Removal				0									TV-Cable, Security System, Fire Sprinklers, CO Detectors				Full		14X10			19X15	25X16	15X9			Foyer, Gallery	Whirlpool, Separate Shower, Double Sink	Combined w/ LivRm	Storms/Screens	11/12/2007	11/12/2007	11/12/2007	11/12/2007	
AT	159	E	WALTON		34A	Chicago	Illinois	60611	8008	Cook		299	299	102	Condo, High Rise (7+ Stories), Vintage		1929	06119044	CLSD		5178000	5178000	5178000	5178000	Contract		100%	100%	62	62	17032730010000				NEW		2005	2883	No		No			34		0	Not Reported					9	3	3	0	3	1	3.1	1	2	Attached	None	None	PALMOLIVE BUILDING-FINEST STANDARD FINISHES IN CHICAGO-NEW INTERIOR CONSTR. IN MICHIGAN AVE LANDMARKBLDG, 4702 SF, 3 BDRMS, 3.5 BRM, LIBRARY WITH FIREPLACE, 10'3 CEILINGS IN PRINCIPAL ROOMS, LRG WINDOWS,TOP APPLIANCES, CHEF'S KITCHEN, ADV. TECH. NSEW VIEWS, PVT. ENTRTNMNT SPACE, HTD PKG, PVT HEALTH CLUB, CONCIERGE.			Central Air	Forced Air, 2+ Sep Heating Systems, Zoned							Water, Gas, Common Insurance, Security, Doorman, TV/Cable, Clubhouse, Exercise Facilities, Scavenger, Snow Removal																	Y		14X13	13X19		20X15	14X23	14X16		15X17	Other				04/27/2006	06/27/2006	06/27/2006	09/27/2007	
AT	159	E	Walton	ST	6E	Chicago	Illinois	60611	8008	Cook		299	299	93	Condo, High Rise (7+ Stories), Vintage		1929	06392089	CLSD		1189000	951016	951016	1095000	Conventional		87%	80%	216	216	17032130201090	No			NEW	None	2005	1219	No		No			6		1848					S (South), E (East), W (West)	5	2	2	0	2	1	2.1	1	1	Attached	None		Palmolive Building - Top of the line finishes - New interior construction in landmark bldg. Lrg windows. 4" white oak floors thruout, double exp in master bed & 2nd bed, stunning mbath, fireplace, advanced technology. Pvt health club, concierge, entertainment space. S/E/W views. 1848 sqft. Landmark tax freeze available.			Central Air, Zoned	Forced Air, 2+ Sep Heating Systems, Zoned		Elevator, Hardwood Floors, Laundry Hook-Up in Unit, Storage		Oven/Range, Microwave, Dishwasher, Refrigerator, Freezer, Washer, Dryer, Disposal		Door Person, Elevator, Exercise Room, Storage, Health Club, On Site Manager/Engineer, Party Room, Receiving Room, Service Elevator, Steam Room, Whirlpool	Heat, Water, Gas, Parking, Common Insurance, Security, Doorman, TV/Cable, Clubhouse, Exercise Facilities, Exterior Maintenance, Lawn Care, Scavenger, Snow Removal							Hardwood					Hardwood	TV-Cable, Fire Sprinklers, CO Detectors		Hardwood	Hardwood	Full	Hardwood	15X14			17X13	25X14	13X10		COMBO	Foyer, Gallery	Separate Shower, Double Sink	Combined w/ LivRm	End Unit	01/25/2007	08/28/2007	08/28/2007	09/05/2007	
AT	159	E	WALTON		11F	Chicago	Illinois	60611	8008	Cook		299	299	102	Condo, High Rise (7+ Stories)		1929	05277422	CLSD		1426000	1375000	1375000	1466000	Contract		94%	96%	610	610	17032130201058	No			NEW	None	2005	1090	No		Unknown			11		2347					S (South), E (East), W (West)	5	2	2	0	2	1	2.1	1	1	Attached	None	None	PALMOLIVE BUILDING-OFFERING THE FINEST STANDARD FINISHES EVER SEEN IN CHICAGO-NEW INTERIOR CONSTRCTN ON MICHIGAN AVE LANDMARK-LRG WNDWS,HI CEILS,4"WHITE OAK FLRS THRUOUT,OPULENT MBATH,FIREPLACES,TOP APPLIANCES,ADVANCED TECHNOLOGY-HTD PKG PVT HEALTH CLUB-MAHOGANY PANELED ENTERTNMNT SPACE-CONCIERGE PRICE INCL. $49K IN DEVELOPERS FINISHES & TECHNOLOGY UPGRADE			Central Air, Zoned	Forced Air, 2+ Sep Heating Systems, Zoned		Hardwood Floors, Laundry Hook-Up in Unit		Oven/Range, Microwave, Dishwasher, Refrigerator, Freezer, Washer, Dryer, Disposal		Door Person, Elevator, Exercise Room, Storage, Health Club, On Site Manager/Engineer, Party Room, Receiving Room, Sauna, Security Door Locks, Service Elevator, Steam Room, Valet/Cleaner, Whirlpool, Curbs/Gutters, Sidewalks, Street Lights, Street Paved	Water, Gas, Common Insurance, Security, Doorman, TV/Cable, Clubhouse, Exercise Facilities, Scavenger, Snow Removal				0									TV-Cable, Security System, Fire Sprinklers, CO Detectors				Full		16X12			14X12	15X14	15X14		16X11	Foyer, Gallery	Whirlpool, Separate Shower, Double Sink	Separate		10/31/2005	07/02/2007	07/02/2007	07/25/2007	
AT	159	E	WALTON	PL	18A	Chicago	Illinois	60611	8008	Cook		299	299	102	Condo, High Rise (7+ Stories)		1929	06416177	CLSD		6751000	6265000	6265000	6751000	Contract		93%	93%	79	79	17032130010000	No			NEW	None	2005	3371	No		Unknown			18		4984					N (North), S (South), E (East), City, Lake/Water	8	3	3	0	3	1	3.1		2	Attached	None		PALMOLIVE BUILDING-OFFERING THE FINEST STD FINISHES EVER SEEN IN CHICAGO-NEW INTERIOR CONST IN MICHIGAN AVE LANDMARK- LRG WNDWS,HI CEILS,4"WHITE OAK FLRS THRUOUT, GRACIOUS MASTER SUITE , 2 ADDIT. BDRMS, 3.5 BRMS, LIBRARY, LVG RM OPENS TO 1626 SF OF TERRACE WITH N/W/S EXPOSURES; BLDG INCL. PVT HEALTH CLUB, PVT CLUB ROOM, CONCIERGE,VALET/HTD PKG			Central Air, Zoned	Forced Air, 2+ Sep Heating Systems, Zoned						Door Person, Elevator, Exercise Room, Storage, Health Club, On Site Manager/Engineer, Party Room, Receiving Room, Sauna, Security Door Locks, Service Elevator, Steam Room, Valet/Cleaner, Whirlpool, Curbs/Gutters, Sidewalks, Street Lights, Street Paved	Water, Gas, Common Insurance, Doorman, TV/Cable, Clubhouse, Exercise Facilities, Scavenger, Snow Removal				0									TV-Cable, Security System, Fire Sprinklers, CO Detectors				Y		12X13	12X25		17X26	18X28	16X21		15X28	Library, Study				02/20/2007	05/09/2007	05/09/2007	06/14/2007	
AT	159	E	WALTON		18B	Chicago	Illinois	60611	8008	Cook		299	299	102	Condo, High Rise (7+ Stories)		1929	05201170	CLSD		4600000	4815000	4815000	4830000	Contract		100%	105%	255	255	1703213001	No			NEW	None	2005	2671	No		Unknown			18		3939					N (North), S (South), E (East), City, Lake/Water	7	3	3	0	3	1	3.1	1	2	Attached	None	None	PALMOLIVE BUILDING-OFFERING THE FINEST STD FINISHES EVER SEEN IN CHICAGO-NEW INTERIOR CONST IN MICHIGAN AVE LANDMARK- LRG WNDWS,HI CEILS,4"WHITE OAK FLRS THRUOUT, GRACIOUS MASTER SUITE W/LRG SITTING ROOM & 17X9 MASTER CLOSET. LVG RM OPENS TO 2,294SF OF TERRACE WITH N/E/S EXPOSURES, BLDG INCL. PVT HEALTH CLUB, PANELED ENTERTNMT ROOM, CONCIERGE,VALET/HTD PKG			Central Air, Zoned	Forced Air, 2+ Sep Heating Systems, Zoned		Hardwood Floors, Laundry Hook-Up in Unit		Oven/Range, Microwave, Dishwasher, Refrigerator, Washer, Dryer, Disposal		Door Person, Elevator, Exercise Room, Storage, Health Club, On Site Manager/Engineer, Party Room, Receiving Room, Sauna, Security Door Locks, Service Elevator, Steam Room, Valet/Cleaner, Whirlpool, Curbs/Gutters, Sidewalks, Street Lights, Street Paved	Water, Gas, Common Insurance, Doorman, TV/Cable, Clubhouse, Exercise Facilities, Scavenger, Snow Removal				0									TV-Cable, Security System, Fire Sprinklers, CO Detectors				Full		16X13	12X14		15X22	19X35	17X12		15X17	Foyer, Gallery, Library, Other, Sitting Room, Utility Room-1st Floor	Whirlpool, Separate Shower, Double Sink	Separate	Deck	08/10/2005	04/21/2006	04/21/2006	06/05/2007	
AT	159	E	WALTON	PL	24A	Chicago	Illinois	60611	8008	Cook		299	299	102	Condo, High Rise (7+ Stories), Vintage		1929	06408487	CLSD		4736000	4901000	4901000	4736000	Contract		103%	103%	1	1	17032130010000	No			NEW	None	2005	3112	No		Unknown			24		5400					N (North), S (South), E (East), W (West)	10	3	3	0	3	1	3.1	2	3	Attached	None	None	PALMOLIVE BUILDING-OFFERING THE FINEST STANDARD FINISHES EVER SEEN IN CHICAGO-NEW INTERIOR CONSTRCTN IN MICHIGAN AVE LANDMARK-LRG WNDWS,HICEILS,4"WHITE OAK FLRS THRUOUT,OPULENT MBATH,FIREPLACES,TOP APPLIANCES,ADVANCED TECHNOLOGY-HTD PKG PVT HEATH CLUB-MAHOGANY PANELED ENTERTNMNT SPACE-CONCIERGE 32A HAS 5400SF, 9'7" CEILINGS, N-S-E-W VIEWS			Central Air, Zoned	Forced Air, 2+ Sep Heating Systems, Zoned		Hardwood Floors, Laundry Hook-Up in Unit		Oven/Range, Microwave, Dishwasher, Refrigerator, Washer, Dryer, Disposal		Door Person, Elevator, Exercise Room, Storage, Health Club, On Site Manager/Engineer, Party Room, Receiving Room, Sauna, Security Door Locks, Service Elevator, Steam Room, Valet/Cleaner, Whirlpool, Curbs/Gutters, Sidewalks, Street Lights, Street Paved	Water, Gas, Common Insurance, Doorman, TV/Cable, Clubhouse, Exercise Facilities, Scavenger, Snow Removal				0									TV-Cable, Security System, Fire Sprinklers, CO Detectors				Full		15X12	15X11		20X16	16X23	18X17	18X17	16X17	FAM, Gallery, Library, Other, Sitting Room	Whirlpool, Separate Shower, Double Sink	Separate	Storms/Screens	02/12/2007	02/12/2007	02/12/2007	03/07/2007	
