AT	3430	N	Lake Shore	DR	10H	Chicago	Illinois	60657	8006	Cook		299	299	218	Condo, High Rise (7+ Stories)	19	1955	09195164	CLSD		359000	355000	355000	359000	Conventional	N/A	99%	99%	15	15	14213070471106				3584	None	2014	1112	No		No	No		10		1200	Estimated				E (East), Lake/Water, Park	5	2	2	0	2	0	2		1	Attached	None	None	Wow!!!! Views, finishes, layout, location..... This home has it all and is freshly rehabbed to perfection. Get ready to be impressed with Belmont Harbor views from every room.  An open kitchen with a huge island, marble kitchen and new cabinets features soft close drawers and doors.  The large living dining area is perfect for living and entertaining.  Both beds are generously sized the the baths are meticulously designed.  Buy with confidence in a well run building and enjoy living on Chicago's most famous street.  Move fast, priced to sell.			Central Air	Electric			No	Oven/Range, Microwave, Dishwasher, Refrigerator		Bike Room/Bike Trails, Door Person, Coin Laundry, Elevator, Exercise Room, Storage, On Site Manager/Engineer, Receiving Room, Security Door Locks, Service Elevator	Heat, Air Conditioning, Water, Electric, Gas, Common Insurance, Security, Doorman, TV/Cable, Exercise Facilities, Exterior Maintenance, Lawn Care, Scavenger, Snow Removal	Lieberman Management	Eadka Tidwell	(773) 348-2777	70	Yes		Hardwood					Hardwood			Ceramic Tile	Hardwood	Full	Hardwood	14X11			16X12	14X22	8X9		8X10	No additional rooms				04/14/2016	04/28/2016	04/28/2016	07/08/2016		@properties	85774	Ryan Gossett	170349	Emily Gossett	182321	(773) 472-0200	04/14/2016	(312) 237-6600	Coldwell Banker Residential	10115	Jennifer Ames	124168	(312) 440-7525	2.5% - $295 (on Net SP)	None
AT	3430	N	LAKE SHORE	DR	16J	Chicago	Illinois	60657	8006	Cook		299	299	220	Condo, Mid Rise (4-6 Stories)	12	1957	09263282	CLSD		139900	150000	150000	139900	Conventional	F	107%	107%	5	5	14213070471176				1756.19		2014	675	No		Unknown	No		16		800	Estimated				N (North), E (East), Lake/Water	4	1	1	0	1	0	1				None	None	Take in lake views from your private balcony!!  Bright 1 bed, 1 bath condo. Large and bright living room, spacious bedroom, good closet space! Fresh paint! Don't miss this opportunity! Rentals are allowed.  This is a Freddie Mac HomeSteps Property.	PLEASE SEE ADDITIONAL INFORMATION FOR REQUIRED OFFER COVER SHEET.  Buyer responsible for 6 months HOA fees per IL Public Act 94-1049.		None	Gas		Storage	No			Bike Room/Bike Trails, Door Person, Coin Laundry, Elevator, Exercise Room, Storage, On Site Manager/Engineer, Receiving Room	Common Insurance, Doorman, Exercise Facilities, Exterior Maintenance, Lawn Care, Scavenger, Snow Removal	3440 LAKE SHORE DRIVE CONDOMINIUM ASSOCIATION	3440 LAKE SHORE DRIVE CONDOMINI	(847) 459-0000														None					12X12	21X13	8X8		8X8	No additional rooms		Combined w/ LivRm	Balcony	06/20/2016	06/24/2016	06/24/2016	08/26/2016		Parkvue Realty Corporation	16339	Anthony Disano	106496	William Volpe	165879	(312) 788-4040	06/20/2016		Dream Town Realty	14090	John Campas	115218	(312) 638-9120	2.5% (on Net SP)	None
AT	3430	N	LAKE SHORE	DR	15P	Chicago	Illinois	60657	8006	Cook		299	299	220	Cluster	20	1959	09264602	CLSD		220000	216000	216000	220000	Cash	N/A	98%	98%	4	4	14213070471167				3249	None	2014	1000	Yes	1000	No	No		15	C,F	1200	Landlord/Tenant/Seller				E (East), W (West)	5	2	2	0	2	0	2				Full	Other	FIRST 6 MONTHS OF HOA DUES PRE-PAID BY SELLER! Also, $2,000 APPLIANCE CREDIT AND $3,000 DECORATING CREDIT OFFERED BY SELLER AT CLOSING!    Spectacular east-facing views of Lake Michigan & Belmont Harbor, and breathtaking west-facing views of sunset! 2BR/2BTHS. separate dining area, abundant closets. Tennis, golf, jogging/walking/biking trails, shopping, restaurants, transportation & lakefront are all steps away. Updated full-amenity bldg w/ 24hr door person. Outdoor pool/deck.  Heat/air included. Perfect unit for investors!			Central Air, 3+ (Window/Wall Unit), Zoned	Gas, Forced Air, Indv Controls, Zoned		Storage	No	Oven/Range, Microwave, Dishwasher, Refrigerator		Bike Room/Bike Trails, Door Person, Coin Laundry, Elevator, Exercise Room, Storage, On Site Manager/Engineer, Park/Playground, Sundeck, Pool-Outdoors, Receiving Room, Service Elevator, Curbs/Gutters, Gated Entry, Sidewalks, Street Lights, Street Paved	Heat, Air Conditioning, Water, Gas, Common Insurance, Security, Doorman, TV/Cable, Pool, Exterior Maintenance, Lawn Care, Scavenger, Snow Removal	Lieberman Management	Eadka Tidwell	(773) 348-2777		Yes		Carpet					Carpet	TV-Cable		Marble	Carpet	Full	Carpet	14X11			16X12	21X16	09X09		09X09	No additional rooms		Combined w/ LivRm	Storms/Screens, End Unit	06/21/2016	06/24/2016	06/24/2016	07/26/2016		Dream Town Realty	86265	Will Tveit	880870	 		(847) 961-4700	06/21/2016	(312) 498-8348	Coldwell Banker Residential	3930	Ryan Williams	43848	(847) 858-6544	2.5% - $395 (on Net SP)	None
AT	3430	N	LAKE SHORE	DR	12K	Chicago	Illinois	60657	8006	Cook		299	299	218	Condo, High Rise (7+ Stories)	19	1955	09291418	CLSD		225000	210000	210000	225000	Conventional	N/A	93%	93%	19	19	14213070471136				1668	Homeowner	2014	665	No		No	No		12		850	Taped				E (East), Lake/Water	5	1	1	0	1	0	1	0	2	Attached	None	None	Enjoy amazing views of Belmont Harbor from the comfort of your living room and east-facing balcony in this beautiful 1-bedroom condo in East Lakeview. This large layout features a large living room, dining space and a recently rehabbed kitchen with granite counters, maple cabinets and stainless steel appliances.  Huge master bedroom with great windows and views along with a spacious closet. Lots of interior unit storage. Great building with exercise room and rental parking for $140/mo. Walk to the lakefront path, Lakeview shops, restaurants and Wrigley Field. Express buses. Assessments include AC, heat, 24-hour doorman & fitness center. Sorry, no pets. Click on the virtual tour for a fully interactive floorplan and 3D furniture planner!	No rental cap. Great for owner occupants or investors. Sorry, no pets. Please provide feedback. Click on Virtual Tour for interactive floor plan and furniture planner. Please provide feedback.		Central Air	Forced Air, Zoned		Elevator, Storage	No	Oven/Range, Microwave, Dishwasher, Refrigerator		Door Person, Coin Laundry, Elevator, Exercise Room, Storage, On Site Manager/Engineer, Service Elevator	Heat, Air Conditioning, Water, Gas, Common Insurance, Security, Doorman, TV/Cable, Exercise Facilities, Exterior Maintenance, Lawn Care, Scavenger, Snow Removal	Lieberman Management Services	Eadka Tidwell	(773) 348-2777x1		Yes								TV-Cable				None					16X12	24X14	10X9		COMBO	Balcony, Breakfast Room		L-shaped	Balcony	07/19/2016	08/06/2016	08/06/2016	09/23/2016		Conlon: A Real Estate Company	84404	JimB. Buczynski	149059	Deborah Nick	841556	(312) 733-7201	07/19/2016	(773) 909-6815	Dream Town Realty	84729	Amy Helen Oetter	150362	(773) 316-6288	2.5%-$295 (on Net SP)	None
AT	3430	N	LAKE SHORE	DR	15P	Chicago	Illinois	60657	8006	Cook		299	299	218	Cluster	20	1955	09371817	CLSD		369000	349000	349000	349000	Conventional	N/A	100%	95%	80	80	14213070471167				3753.78	None	2015	1008	No		No	No		15	C,F	1200	Estimated				E (East), W (West)	5	2	2	0	2	0	2		2	Attached	None	None	BRAND NEW GUT RENOVATION with SPECTACULAR east-facing views of Lake Michigan & Belmont Harbor and BREATHTAKING west-facing views of sunset! The finishes and attention to detail are sure to impress in this 2BR/2BTH unit. They include, but are not limited to, marble counter tops, white shaker cabinets with soft close drawers, hardwood floors, top of the line appliances, open concept living, dry bar and custom tiled bathrooms.  Tennis, golf, jogging/walking/biking trails, shopping, restaurants, transportation & lakefront are all steps away. Building offers on site management, 24hr door person, gym, and valet parking. Heat/air/gas/basic cable all included in your monthly assessments. Move fast, priced to sell!	No pets, no rental restrictions (apart from a minimum of 1 year lease, no Air BnB or VRBO), no special assessments. OPEN HOUSE: 10/29 from 1-3 and 10/30 from 2-4		Central Air, 3+ (Window/Wall Unit), Zoned	Gas, Forced Air, Indv Controls, Zoned		Storage	No	Oven/Range, Microwave, Dishwasher, Refrigerator, Wine Cooler/Refrigerator		Bike Room/Bike Trails, Door Person, Coin Laundry, Elevator, Exercise Room, Storage, On Site Manager/Engineer, Park/Playground, Receiving Room, Service Elevator, Curbs/Gutters, Gated Entry, Sidewalks, Street Lights, Street Paved	Heat, Air Conditioning, Water, Gas, Common Insurance, Security, Doorman, TV/Cable, Exterior Maintenance, Lawn Care, Scavenger, Snow Removal	Lieberman Management	Eadka Tidwell	(773) 348-2777x1		Yes		Hardwood					Carpet	TV-Cable		Hardwood	Hardwood	Full	Hardwood	14X11			16X12	21X16	09X09		09X09	No additional rooms		Combined w/ LivRm	Storms/Screens, End Unit	10/20/2016	01/07/2017	01/07/2017	02/24/2017		Coldwell Banker Residential	3930	Ryan Williams	43848	 		(847) 446-4000	10/20/2016	(847) 858-6544	Jameson Sotheby's Intl Realty	10646	Daniel Lipton	108991	(773) 988-3299	2.5% -$295 (on Net SP)	None
AT	3430	N	Lake Shore	DR	15N	Chicago	Illinois	60657	8006	Cook		299	299	150	Condo, High Rise (7+ Stories)	33	1955	09127759	CLSD		220000	145000	145000	140000	Cash	N/A	104%	66%	162	162	14213070471166				1,956.69	None	2014	608	No		No	No		15		800	Estimated				W (West)	4	1	1	0	1	0	1				None	None	Sought after location along Lake Shore Dr , one of the best buildings.  This high floor, spacious  1 BR 1 bath condo facing west with balcony off the LR, HW floors , bright and sunny with large windows.  There are tons of closet space , carpeted MBR.  Priced to sell.  Association financially sound. Close to transportation .  24/7 doorman, fitness center. Place needs update. Sold as is . Motivated seller.  Well maintained building and healthy reserves. Walk to lake, train , bus and shopping.	Text Nenita at 773 354 1235 ( 24 hour notice )    Needs work, sold as is.		Central Air	Forced Air			No				Heat, Air Conditioning, Water, Gas, Common Insurance, Doorman, TV/Cable, Exercise Facilities, Exterior Maintenance, Lawn Care, Scavenger, Snow Removal	Lieberman	Ms Easktdwella	(773) 348-2777	70								Hardwood			Wood Laminate	Hardwood	None	Carpet				16X11	21X14	10X8		8X8	Balcony			Balcony	01/31/2016	07/10/2016	07/10/2016	08/29/2016		@properties	17665	Nenita Dejuras	123957	 		(312) 506-0200	01/31/2016	(773) 354-1235	Jameson Sotheby's Int'l Realty	86126	Jeremiah S Fisher	179757	(312) 543-8480	2.5% - $295 (on Net SP)	None
AT	3430	N	Lake Shore	DR	17L	Chicago	Illinois	60657	8006	Cook		299	299	218	Condo, High Rise (7+ Stories)	19	1955	09197022	CLSD		289900	273500	273500	289900	Conventional	N/A	94%	94%	77	77	14213070471192				2667	None	2014	975	No		No	No		12		1250	Other				E (East), W (West)	5	2	2	0	2	0	2		1	Attached	None	None	Million Dollar views of the Lake & Belmont Harbor from this fantastic high-floor 2BR, 2BTH unit.  Great layout with a large open living room, separate dining area and beautiful kitchen that features new all stainless steel appliances and gorgeous quartz counter tops.  Tons of closet space & a large master suite w/spacious bath and glass tile shower surround.  With unobstructed east and west views this home gets great light and is very bright.  All this in an updated full amenity bldg w/24HR doorman, on-site management office, fitness room and garage parking on site with no wait. Walker's paradise with tennis, golf, shopping, restaurants & the lakefront all just steps from your door. Easy transportation with quick access to Lake Shore Drive and Bus Stop right in front of building. (Bldg doesn't allow pets.)			3+ (Window/Wall Unit)	2+ Sep Heating Systems, Indv Controls		Elevator, Hardwood Floors	No	Oven/Range, Microwave, Dishwasher, Refrigerator, All Stainless Steel Kitchen Appliances		Bike Room/Bike Trails, Door Person, Coin Laundry, Elevator, Exercise Room, Storage, On Site Manager/Engineer, Receiving Room, Curbs/Gutters, Sidewalks, Street Lights, Street Paved	Water, Gas, Common Insurance, Doorman, TV/Cable, Exercise Facilities, Exterior Maintenance, Lawn Care, Scavenger, Snow Removal	Lieberman Management Services	Eadka Tidwell	(773) 348-2777		Yes		Carpet					Wood Laminate			Wood Laminate	Wood Laminate	Full	Carpet	11X14			12X16	14X22	8X9		8X10	Foyer			Storms/Screens, Cable Access	04/15/2016	06/30/2016	06/30/2016	08/12/2016		Baird & Warner	10274	Michael Hall	111699	 		(773) 697-5555	04/15/2016	(773) 710-3990	@properties	85774	Brian Ebbesen	145148	(773) 412-6889	2.5% LESS $300 (on Net SP)	None
AT	3430	N	LAKE SHORE	DR	17K	Chicago	Illinois	60657	8006	Cook		299	299	218	Condo, High Rise (7+ Stories)	19	1955	09078791	CLSD		249000	210000	210000	239000	Conventional	N/A	88%	84%	149	149	14213070471191				1726.71	Homeowner	2014	667	No		No	No		17		850	Other				E (East), Lake/Water	4	1	1	0	1	0	1	1	1	Attached	None	None	Million Dollar views of the Lake & Belmont Harbor from this recently remodeled home! Stunningly finished kitchen with impeccable attention to detail and all the bells and whistles!  Stylish, tasteful and enduring, this is the kitchen you’d normally find in a high-end single family home.  Watch the boats come into the harbor while cooking dinner in your new kitchen or sipping wine on your private balcony! It doesn’t get much better than this.  Large 1BR unit with spacious living room, kitchen with island and gorgeous backsplash, separate dining area which also makes a great office area and tons of closet space as well.  All this in an updated full amenity bldg w/24HR doorman, on-site management office, fitness room and garage parking on site with no wait. Walker's paradise with tennis, golf, shopping, restaurants & the lakefront all just steps from your door. Easy transportation with quick access to Lake Shore Drive and Bus Stop right in front of building. (Bldg doesn't allow pets.)			Central Air	Gas, Zoned			No	Oven/Range, Microwave, Dishwasher, Refrigerator		Door Person, Coin Laundry, Elevator, Exercise Room, Storage, On Site Manager/Engineer, Service Elevator	Heat, Air Conditioning, Water, Gas, Common Insurance, Security, Doorman, TV/Cable, Exercise Facilities, Exterior Maintenance, Lawn Care, Scavenger, Snow Removal	Lieberman Management Services	Eadka Tidwell	(773) 348-2777		Yes							Hardwood	TV-Cable		Hardwood	Carpet	None	Hardwood				13X12	22X14	09X08		10X09	Balcony		L-shaped	Balcony	11/03/2015	03/30/2016	03/30/2016	05/25/2016		Baird & Warner	10274	Michael Hall	111699	 		(773) 697-5555	11/03/2015	(773) 710-3990	@properties	17665	Christopher Secaur	857984	(513) 543-5702	2.5% LESS $300 (on Net SP)	None
AT	3430	N	Lake Shore	DR	11L	Chicago	Illinois	60657	8006	Cook		299	299	220	Condo, High Rise (7+ Stories)			06501580	CLSD		305000	305100	305100	305000	Conventional		100%	100%	26	26	14213070471023	No			2425.71	Homeowner	2005	703	No		No			11		0	Not Reported				E (East), W (West)	5	2	2	0	2		2	0	2	Attached	Full, Walkout		Spectacular views of lake & Belmont Harbor from this beautifully finished 2BR/2BA unit in move-in condition. Features a sep dining area, tons of closet space & new bths w/high-end finishes; Grohe, Kohler, marble showers, flrs & counters. Tennis, golf, shopping, restaurants & the lakefront are all just steps from your door in this updated full amenity bldg w/24HR doorman. 2-car gar. Pkg available on site-no wait list.			Central Air	Forced Air				Oven/Range, Dishwasher, Refrigerator		Bike Room/Bike Trails, Door Person, Coin Laundry, Elevator, Exercise Room, Storage	Heat, Air Conditioning, Water, Gas, Common Insurance, Security, Doorman, TV/Cable, Exercise Facilities, Exterior Maintenance, Lawn Care, Scavenger, Snow Removal																	Full		14X11			16X12	21X15	9X9		9X9	Foyer, Gallery		Combined w/ LivRm		05/03/2007	05/28/2007	05/28/2007	07/09/2007		Baird & Warner	10273	Michael Hall	111699	 		(773) 549-1855	05/03/2007	(773) 710-3990	Dream Town Realty	14090	Arielle Turover Cohen	148592	(312) 662-3022	2.5%-$150	None
AT	3430	N	LAKE SHORE	DR	16M	Chicago	Illinois	60657	8006	Cook		299	299	220	Condo, High Rise (7+ Stories)		1955	06543879	CLSD		219000	210000	210000	219000	Conventional		96%	96%	33	33	14213070471179				2314		2005	454	No		No			16		0	Not Reported				W (West), City	4	1	1	0	1		1	0	1	Attached	None		Best offering at 3430 on Lake Shore Drive.  This bright and spacious home has been recently renovated.  The kitchen features 42" cinnamon maple cabinetry, all stainless steel appliances, and 1.25" granite.  The updated bath has an ebony vanity with granite countertop.  Enjoy endless views and gorgeous sunsets from your 12x6 balcony adjacent to the large 21x13 living room with separate dining room.			Central Air	Gas, Forced Air				Oven/Range, Microwave, Dishwasher, Refrigerator, Freezer		Bike Room/Bike Trails, Door Person, Coin Laundry, Elevator, Exercise Room, Storage, On Site Manager/Engineer, Service Elevator, Curbs/Gutters, Sidewalks, Street Lights, Street Paved	Heat, Air Conditioning, Water, Common Insurance, Security, Doorman, TV/Cable, Exterior Maintenance, Lawn Care, Scavenger, Snow Removal												Carpet			Other	Carpet	None	Carpet				16X11	21X13	9X7		9X8	Balcony, Foyer		Combined w/ LivRm, L-shaped	Balcony	06/07/2007	07/09/2007	07/09/2007	09/04/2007		Baird & Warner	11000	Nicholas Colagiovanni	132801	 		(312) 640-7010	06/07/2007	(312) 981-2333	Zip Realty Inc	14809	Maria Zajczenko-Varela	102924	(773) 636-1951	2.5% - 150	None
AT	3430	N	LAKE SHORE	DR	14L	Chicago	Illinois	60657	8006	Cook		299	299	218	Condo, High Rise (7+ Stories)	19	1955	07986245	CLSD		181500	147000	147000	149900	Cash	F	98%	81%	65	65	14213070471150				3685		2010	847	No		Unknown	No		14		0	Not Reported					5	2	2	0	2	0	2		1	Attached	None	None	Lakeview living at its best on Lake Michigan! Two bedroom and two bath condo with spectacular lake and Belmont harbor views.   Hardwood floors & lots of closets.  Close to bike & jogging paths, restaurants, shops, nightlife. CTA buses at your door. Chicago Yacht Club nearby.  On-site parking for $150/mo. Sorry no pets. Property is under First Look Initiative until 2/16/12.	PROPERTY IS SOLD AS IS. NO DISCLOSURES OR SURVEY. PRO-RATIONS WILL BE MADE AT 100%. PRE-APPROVAL AND/OR PROOF OF FUNDS MUST ACCOMPANY ALL OFFERS. SPECIAL ADDENDUMS ARE REQUIRED. Send all offers to reooffers@ryanhillrealty.com		Central Air	Forced Air		Hardwood Floors	No			Bike Room/Bike Trails, Door Person, Coin Laundry, Elevator, Exercise Room, On Site Manager/Engineer, Service Elevator	Common Insurance, Doorman, Exterior Maintenance, Snow Removal	3440 Lakshore Condo Assoc	anyone	(773) 348-2777x1				Hardwood					Hardwood			Hardwood	Hardwood	Full	Hardwood	14X11			16X12	21X15	09X08		10X08	No additional rooms		Combined w/ LivRm	End Unit	02/01/2012	04/05/2012	04/05/2012	05/23/2012		Ryan Hill Realty, LLC	21324	Teresa Ryan, ABR,SFR	214545	Andy Pazzali	232216	(630) 718-0424	02/01/2012	(630) 276-7572	RE/MAX In The Village Realtors	90706	Jane McClelland	900182	(708) 386-1400x118	2.5 (on Net SP)	None
AT	3430	N	Lake Shore	DR	7P	Chicago	Illinois	60657	8006	Cook		299	299	219	Condo	19	1955	08000089	CLSD		169900	169900	169900	169900	Cash	S	100%	100%	499	15	14213070471070				2,766.81	None	2009	833	No		No	No		7		0	Not Reported				S (South), E (East), W (West)	5	2	2	0	2	0	2		2	Attached	Full	Sub-Basement	Bank Approved Short Sale- Close in 30 days! Spectacular views of Lake & Belmont Harbor from this 2BR, 2Bath unit w/master suite! Great floor plan, tons of closet space. All this in a great full amenity bldg w/24 door staff & 2-car heated gar prkg on site-no wait! Shopping, restaurants & lakefront are all just steps from your door. New kitchen w/granite & stainless.	CC: Pursuant to Short Sale. 		Central Air	Gas, Forced Air			No	Oven/Range, Microwave, Dishwasher, Refrigerator			Heat, Air Conditioning, Water, Gas, Parking, Common Insurance, Doorman, TV/Cable, Exercise Facilities, Exterior Maintenance, Lawn Care, Scavenger, Snow Removal																	Full		14X11			16X12	21X16	9X8		10X8	No additional rooms				02/20/2012	03/05/2012	03/05/2012	09/13/2012		Baird & Warner	10273	Michael Hall	111699	 		(773) 549-1855	02/20/2012	(773) 710-3990	Keller Williams Preferred Realty	85141	Dave Auffarth	106968	(312) 593-2424	2.5%-$275 (on Net SP)	Short Sale
AT	3430	N	Lake Shore	DR	7H	Chicago	Illinois	60657	8006	Cook		299	299	219	Condo, High Rise (7+ Stories)	17	1955	08079292	CLSD		249900	220000	220000	239900	Conventional	N/A	92%	88%	386	386	14213070471064				4355	Homeowner	2011	963	No		No	No		7		1200	Estimated				E (East), W (West)	5	2	2	0	2	0	2		2	Attached	None	None	Spectacular views of Lake & Belmont Harbor from every room in this rarely available H-tier unit!  Gorgeous Hardwood floors and open kitchen make this perfect for entertaining. This unit is ready to move in. Shopping, restaurants & lakefront area all just steps from your door in the updated full amenity building w/24 HR doorperson.	Mortgage Preapproval available through MFS Mortgage Service 847-985-0062. Customer receives a $500.00 closing cost credit if using MFS Mortgage Service		Central Air	Gas, Forced Air, Indv Controls		Hardwood Floors, Storage	No	Oven/Range, Microwave, Dishwasher, Refrigerator		Bike Room/Bike Trails, Door Person, Elevator, Exercise Room, Storage, On Site Manager/Engineer, Service Elevator	Heat, Air Conditioning, Water, Gas, Common Insurance, Doorman, TV/Cable, Exercise Facilities, Exterior Maintenance, Lawn Care, Scavenger, Snow Removal	3440 N Lakeshore Dr Association	Manager	(773) 348-2777x1				Carpet					Hardwood			Hardwood	Hardwood	Full	Carpet	14X11			16X12	22X15	9X8		10X8	No additional rooms		Separate		05/30/2012	06/19/2013	06/19/2013	08/16/2013		1st Cornerstone Realty Inc.	1815	M. Todd Hague	26246	 		(773) 561-0062	05/30/2012	(847) 858-7830	1st Cornerstone Realty Inc.	1815	Greg Wilson	26251	(630) 707-4734	2.5 - 250 (on Net SP)	None
AT	3430	N	LAKE SHORE	DR	16J	Chicago	Illinois	60657	8006	Cook		299	299	220	Condo, Mid Rise (4-6 Stories)		1957	06378460	CLSD		239000	234000	234000	239000	Conventional		98%	98%	207	19	14213070471176	No			1430	None	2005	516	No		No			16		800					N (North), E (East), Lake/Water	4	1	1	0	1		1	0	1	Attached	None		BEAUTIFUL LAKE, HARBOR, & PARK VIEWS FROM THIS UPDATED & IMMACULATE 1 BEDROOM UNIT. OVERSIZED 11X7 TERRACE, SLEEK WHITE KITCHEN W/BUILT IN DESK, UPDATED BATHROOM, CUSTOM WINDOW TREATMENTS, AND ORGANIZED CLOSETS MAKE THIS UNIT MOVE-IN READY! WELL MAINTAINED BLDG W/OVER $1 MILLION IN RESERVES AND UP TO DATE FITNESS ROOM. SHOPS, RESTAURANTS, & PEDESTRIAN TUNNEL TO LAKE ONLY STEPS AWAY. SORRY-NO PETS!			Central Air	Gas		Storage		Oven/Range, Microwave, Dishwasher, Refrigerator		Bike Room/Bike Trails, Door Person, Coin Laundry, Elevator, Exercise Room, Storage, On Site Manager/Engineer, Receiving Room	Heat, Air Conditioning, Water, Gas, Doorman, TV/Cable, Exercise Facilities, Exterior Maintenance												Carpet	TV-Cable		Ceramic Tile	Carpet	None	Carpet				12X12	21X13	8X8		8X8	Other		Combined w/ LivRm	Balcony	01/11/2007	01/29/2007	01/29/2007	04/04/2007		@properties	15694	Sharon O'Hara, GRI	132291	 		(773) 862-0200	01/11/2007	(773) 895-3360	Baird & Warner	11000	Scott Ward	117006	(312) 981-2830	2.5%-$150	Variable
AT	3430	N	Lake Shore Dr.		8M	Chicago	Illinois	60657	8006	Cook		299	299	202	Condo, High Rise (7+ Stories)		1959	06252096	CLSD		216000	191500	191500	199900	Conventional		96%	89%	148	148	14213070471082				2204.42	Homeowner	2005	412	No		No			8		800					W (West), City	4	1	1	0	1		1		2	Attached	None	None	Spacious 1Br w/Balcony, hardwood flrs, completely rehabbed kitchen & bath, sep. dining area & loads of closet space. Watch the sunset from your living rm in this great unit w/panoramic west views. Shopping, restaurants & lakefront are all just stops from your door in this full amenity bldg. w/24Hr doorman. 2-car gar. parking on site- no wait list.			Central Air	Gas, Forced Air				Oven/Range, Microwave, Dishwasher, Refrigerator		Bike Room/Bike Trails, Door Person, Coin Laundry, Exercise Room, On Site Manager/Engineer, Service Elevator	Heat, Air Conditioning, Common Insurance, Doorman, TV/Cable, Exercise Facilities, Exterior Maintenance, Lawn Care, Scavenger, Snow Removal												Hardwood			Hardwood	Hardwood	None	Carpet				14X11	21X13	09X08		09X08			Combined w/ LivRm		08/21/2006	01/15/2007	01/15/2007	02/23/2007		Baird & Warner	10273	Michael Hall	111699	 		(773) 549-1855	08/21/2006	(773) 710-3990	Baird & Warner	10273	Eileen Kravitz	111003	(773) 326-6526	2.5%-$100	None
AT	3430	N	LAKE SHORE DRIVE		5K	Chicago	Illinois	60657	8006	Cook		299	299	220	Condo		1955	06285820	CLSD		179900	169000	169000	179900	Conventional		94%	94%	56	56	14213070471038				2098.85		2005	448	No		No			5		800					E (East), Lake/Water	4	1	1	0	1		1		1	Attached	None		SPACIOUS 1 BEDRM OVERLOOKING BELMONT HARBOR & LINCOLN PARK. LARGE LIVING RM W/SEPARATE DINING AREA. NEW CARPET & FRESH PAINT. LOTS OF STORAGE INCLUDING TWO CLOSETS IN THE BEDRM. FULL AMENITY BLDG WITH 24 HR DRMAN, EXERCISE RM & ON-SITE PKG AVAILABLE. CONVENIENTLY LOCATED JUST STEPS TO THE LAKE, PARK & PUBLIC TRANSPORTATION. AGENT IS RELATED TO SELLER.			2 (Window/Wall Unit)	Gas				Oven/Range, Microwave, Dishwasher, Refrigerator		Bike Room/Bike Trails, Door Person, Coin Laundry, Elevator, Exercise Room, Storage, On Site Manager/Engineer, Service Elevator	Heat, Air Conditioning, Water, Doorman, TV/Cable, Exercise Facilities, Scavenger, Snow Removal												Carpet			Ceramic Tile	Carpet	None	Carpet				14X12	22X14	09X08		09X08			Separate		09/20/2006	11/14/2006	11/14/2006	02/06/2007		Berkshire Hathaway HomeServices KoenigRubloff	10900	Michael Sato	126029	Christine Sato	145003	(312) 642-1400	09/20/2006	(312) 335-3210	Baird & Warner	10273	Matthew Cebulak	139189	(773) 883-2178	2.5%-$150	None
