AT	3430	N	Lake Shore	DR	10P	Chicago	Illinois	60657	8006	Cook		299	299	219	Condo, High Rise (7+ Stories)	19	1955	08742616	CLSD		279000	266000	266000	279000	Conventional	N/A	95%	95%	4	4	14213070471112				3092.98	None	2013	942	No		No	No		10		0	Not Reported				E (East), W (West), Lake/Water	5	2	2	0	2	0	2		1	Attached	None	None	Sophisticated and sleek renovation with sparkling lake views in this expansive 2 bdrm/2 bath home.  Open kitchen features custom cabinetry, granite & stainless steel appliances.  Hardwood floors throughout, spacious bedrooms, modern immaculate bathrooms, and east/west exposures make this the ideal place.  Exclusive Lake Shore Drive address and meticulously kept unit.  Garage parking available.			Central Air	Baseboard		Elevator	No	Oven/Range, Microwave, Dishwasher, Refrigerator, All Stainless Steel Kitchen Appliances		Bike Room/Bike Trails, Door Person, Coin Laundry, Elevator, Exercise Room, On Site Manager/Engineer, Service Elevator	Heat, Air Conditioning, Water, Gas, Common Insurance, Security, Doorman, TV/Cable, Exercise Facilities, Exterior Maintenance, Lawn Care, Scavenger, Snow Removal	Lieberman	Eadka Tidwell	(773) 348-2777x1		Yes												Full		14X11			17X13	21X16	9X9		9X8	No additional rooms		Separate		10/01/2014	10/04/2014	10/04/2014	11/06/2014		Berkshire Hathaway HomeServices KoenigRubloff	84215	Brad Lippitz	126952	Brittany Shapiro	868144	(773) 404-1144	10/01/2014		Berkshire Hathaway HomeServices KoenigRubloff	3750	Jonathon Nagatani	34531	(847) 999-2399	2.5% - $325 (on Net SP)	None
AT	3430	N	Lake Shore	DR	5M	Chicago	Illinois	60657	8006	Cook		299	299	218	Condo	19	1955	08786210	CLSD		147500	135000	135000	135000	Conventional	N/A	100%	92%	317	95	14213070471040				1,772.91	None	2012	554	No		No	No		5		800	Other				W (West)	4	1	1	0	1	0	1		0	Attached	None	None	Imagine your lifestyle across from Belmont harbor with its glistening water, expansive grassy lawn, and pathway full of bikers and walkers!  Excellent location, grt price!  Grocery, shopping, restaurants to the west!  Bus stop in front of bldg!  Assess incl basic cable, HEAT, WATER, 24 fr hr door person!  Building improvements include newer windows!  Excellent reserves, no rental cap.  Parking avail for $165/mo!	Please contact Marie McCall for any and all questions.  mariemccall@atproperties.com; 630-567-3797		Central Air	Forced Air			No	Oven/Range, Dishwasher, Refrigerator		Bike Room/Bike Trails, Door Person, Coin Laundry, Elevator, Exercise Room, Storage, On Site Manager/Engineer, Security Door Locks	Heat, Air Conditioning, Water, Common Insurance, Security, Doorman, Exercise Facilities	Lieberman Management	Eadka Tidwell	(773) 348-2777		Yes							Carpet				Carpet	None	Carpet				14X11	21X13	9X8		9X8	No additional rooms		L-shaped		11/14/2014	02/16/2015	02/16/2015	03/24/2015		@properties	25792	Thomas Makinney	245447	Marie McCall, ABR,CNC	245238	(630) 530-0900	11/14/2014	(630) 567-5902	@properties	84025	Elizabeth Lothamer	102587	(773) 655-5344	2.5% - $250 (on Net SP)	None
AT	3430	N	Lake Shore	DR	11M	Chicago	Illinois	60657	8006	Cook		299	299	220	Condo	19	1959	08915992	CLSD		182000	181000	181000	182000	Cash	N/A	99%	99%	30	30	14213070471124				1399.47	Homeowner	2013	579	No		No	No		11		800	Estimated					4	1	1	0	1	0	1		0	Attached	None	None	A castle in the sky! Amazing, recently  rehabbed unit in ideal location! Royally gorgeous oak flrs in Living Rm & Bedrm.A Kitchen fit for a queen features newer cabs,rich granite countertops & stunning marble floors.Regally remodeled bath boasts custom tile work, elegant vessel sink atop a super sleek vanity along w/top flush toilet.Abundance of closet space, great location, full amenities & the beach just steps away	New A/C Water Heater Windows and Piping throughout building. Easy showing. Bring your clients today!		Central Air	Forced Air			No				Common Insurance, Doorman, Exercise Facilities, Exterior Maintenance	Lieberman Management	Eadka Tidwell	(773) 348-2777x1		Yes							Hardwood			Marble	Hardwood	None	Hardwood				14X11	21X13	9X8		9X8	No additional rooms		Separate		05/08/2015	06/06/2015	06/06/2015	07/29/2015		Baird & Warner	8002	Patty Lucas, GRI	80572	 		(847) 392-1855	05/08/2015	(847) 818-6039	Baird & Warner	10273	Michael Hall	111699	(773) 710-3990	2.5% - $295 (on Net SP)	None
AT	3430	N	Lake Shore	DR	3H	Chicago	Illinois	60657	8006	Cook		299	299	220	Condo	19	1955	08912221	CLSD		219900	147500	147500	169900	Cash	N/A	87%	67%	218	127	14213070471008				2931.39	Homeowner	2014	1029	No		No	No		3		1200	Estimated					5	2	2	0	2	0	2		1	Attached	None	None	HUGE PRICE DROP!! ESTATE SALE. SOLD AS IS! Hard to find H unit with beautiful view of Lake Shore Drive. Needs updating, but is priced to sell! Master BR has Master Bedroom Bath, Walk In Closet and second closet. 24 Hour Doorman, On site Management, Workout facility, Bike Room. Laundry room in the building, not in the unit. Parking is $170 per month, Valet only. Will look at all offers! No rental cap. Must have a 12 month lease with all rentals.	No Rental Cap, 12 Month Lease only if renting. Priced to sell! Very Motivated Seller! Earnest money must be made payable to: CHICAGO TITLE COMPANY. Please use 6.0 contract and include ALL disclosures signed by all parties.		3+ (Window/Wall Unit)	2+ Sep Heating Systems, Indv Controls			No	Oven/Range, Dishwasher, Refrigerator			Heat, Water, Gas, Common Insurance, Doorman, TV/Cable, Exercise Facilities, Exterior Maintenance, Lawn Care, Scavenger, Snow Removal	Lieberman Management Services	Eadka Tidwell	(773) 348-2777x1		Yes		Carpet					Carpet			Vinyl	Carpet	Full	Carpet	14X11			16X13	22X15	9X8		9X9	No additional rooms		L-shaped		05/05/2015	09/08/2015	09/08/2015	09/24/2015		Select a Fee RE System	61075	Therese Stepien	215398	 		(312) 421-1000	05/05/2015	(773) 793-6783	Berkshire Hathaway HomeServices KoenigRubloff	10900	Linda Breedlove	130125		2.5% - $300 (on Net SP)	None
AT	3430	N	LAKE SHORE	DR	9P	Chicago	Illinois	60657	8006	Cook		299	299	220	Condo, High Rise (7+ Stories)	20	1957	08986299	CLSD		320000	300000	300000	320000	Cash	N/A	94%	94%	28	28	14213070471098				2561		2014	945	No		Unknown	No		20		0	Not Reported				N (North), E (East), Lake/Water	5	2	2	0	2	0	2				None	None	Take in lake views from your entire living and kitchen area! Stunning look of the harbor. Bright 2 bed, 2 bath condo. Large and open living room, spacious bedrooms, good closet space! Fresh paint! Remodeled kitchen, hardwood floors, new furniture. Avail furnished as well. Don't miss this opportunity! Rentals are allowed. Come see this gorgeous place in the heart of lakeview!	24 hrs notice to show!		None	Gas		Storage	No			Bike Room/Bike Trails, Door Person, Coin Laundry, Elevator, Exercise Room, Storage, On Site Manager/Engineer, Receiving Room	Heat, Water, Gas, Common Insurance, Doorman, TV/Cable, Exterior Maintenance, Lawn Care, Scavenger, Snow Removal	Lieberman Management	Bob	(847) 459-0000														Full		11X14			12X15	16X21	8X8		8X8	No additional rooms		Combined w/ LivRm		07/17/2015	08/13/2015	08/13/2015	10/26/2015		Gold Coast Realty Chicago	14524	Katherine Hoffman	185536	 		(312) 280-9600	07/17/2015	(407) 417-5575	Berkshire Hathaway HomeServices KoenigRubloff	10900	Jayne Alofs	107564	(312) 475-4593	2.5% ON NP - $325 (on Net SP)	None
AT	3430	N	Lake Shore	DR	8H	Chicago	Illinois	60657	8006	Cook		299	299	220	Condo	19	1955	09074767	CLSD		329000	310000	310000	329000	Cash	N/A	94%	94%	38	38	14213070471078				3537.3	None	2014	1068	No		No	No		8		0	Not Reported				E (East), Lake/Water	5	2	2	0	2	0	2		2	Attached	None	None	GORGEOUS, UPGRADED CONDO WITH STUNNING VIEWS! This spacious 2bed / 2bath unit is move-in ready and boasts spectacular views of Belmont Harbor and the lake from every room. Terrific floorplan with separate dining area and ample closet space. Completely remodeled kitchen with french doors, granite counters and built-in appliances. Upgraded bathrooms. Large master bedroom suite with corner window and custom walk-in closet. Second bedroom with custom closet. Very well maintained  building with 24-hour doorman, on-site management, garage, exercise facility, laundry room, storage and bike room. Newer windows, HVAC and copper plumbing. Close to transportation, restaurants, shopping and the lakefront. Assessments include heat, air, gas and cable.	Easy to show on short notice.		Central Air	Forced Air, Indv Controls			No			Bike Room/Bike Trails, Door Person, Coin Laundry, Elevator, Exercise Room, Storage, On Site Manager/Engineer	Common Insurance, Doorman, TV/Cable, Exercise Facilities, Exterior Maintenance, Snow Removal	Lieberman Management Services	Eadka Tidwell	(773) 348-2777	72								Carpet				Carpet	Full	Carpet	11X14			12X16	15X22	8X9		8X10	No additional rooms				10/29/2015	12/05/2015	12/05/2015	02/26/2016		Baird & Warner	10274	Judie Maginn	879285	 		(773) 697-5555	10/29/2015	(415) 608-0554	Baird & Warner	11000	Eric Carlson	142864	(773) 758-2883	2.5% - $300. (on Net SP)	None
AT	3430	N	Lake Shore	DR	12L	Chicago	Illinois	60657	8006	Cook		299	299	218	Condo, High Rise (7+ Stories)	19	1955	09033724	CLSD		269900	215000	215000	239900	Conventional	N/A	90%	80%	168	168	14213070471137				3061.22		2014	949	No		No	No		12		0	Not Reported				E (East), W (West)	5	2	2	0	2	0	2		1	Attached	None	None	JUST REDUCED! Motivated seller! Great city living in beautifully maintained spacious 12th floor condo with stunning lake, harbor and city views.  Enjoy sunrise and sunset.  Move-in ready condition with modern baths, good closet space, fully repainted rooms, refinished wood floors in living and dining areas, kitchen and hallway, brand new carpeting in bedrooms and other new updates.  Building includes 24-hour doorman, laundry room, private storage, bike space, available valet parking for $150/month and new plumbing.    Vibrant neighborhood within steps to transportation, restaurants, shopping, bike path and lakefront.  A must see!	OPEN HOUSE SUNDAY 11/1 from 12pm-2pm. Minimal 12 month lease, if renting. Seller has already moved out, ready to move in, easy to show. No pets allowed.		3+ (Window/Wall Unit)	2+ Sep Heating Systems, Indv Controls		Elevator, Hardwood Floors	No	Oven/Range, Microwave, Dishwasher, Refrigerator		Bike Room/Bike Trails, Door Person, Coin Laundry, Elevator, Exercise Room, Storage, On Site Manager/Engineer, Receiving Room	Water, Gas, Common Insurance, Doorman, TV/Cable, Exercise Facilities, Exterior Maintenance, Lawn Care, Scavenger, Snow Removal	Lieberman Management	Eadka Tidwell	(773) 348-2777x1		Yes		Carpet					Hardwood			Hardwood	Hardwood	Full	Carpet	11X14			12X16	14X22	8X9		8X10	Foyer				09/08/2015	02/22/2016	02/22/2016	03/29/2016		Goldtree Realty	10687	Julian Taylor	133158	 		(847) 674-4445	09/09/2015		Chicago Apartment Finders-CBRB	86258	Victoria Jader	840078	(312) 498-6785	2.5%-$200 (on Net SP)	None
AT	3430	N	LAKE SHORE	DR	18L	Chicago	Illinois	60657	8006	Cook		299	299	218	Condo, High Rise (7+ Stories)	19	1955	09032744	CLSD		385000	368000	368000	385000	Conventional	N/A	96%	96%	35	35	14213070471204				3895.13	Homeowner	2014	1320	No		No	No		18		0	Not Reported				E (East), W (West)	6	3	3	0	3	0	3	0	1	Attached	None	None	Large 3 bedroom/3 full bathroom penthouse with lake views, fresh paint and new floors. Lots of natural sunlight, enjoy your mornings on the balcony overlooking the drive and harbor. Bright kitchen with SS appliances and roomy eating area for a kitchen table. Master bedroom with full, guest suite with full bathroom, California closets. Doorman and valet parking for $160/mo. Building is professionally managed.	See property disclosures under additional information, HOA reserves in excess of $700K, no specials. This condo is also available for rent. Immediate availability.		Central Air	Gas			No	Oven/Range, Microwave, Dishwasher, Refrigerator		Bike Room/Bike Trails, Door Person, Coin Laundry, Elevator, Exercise Room, Storage, On Site Manager/Engineer, Receiving Room, Service Elevator, Curbs/Gutters, Sidewalks, Street Lights	Common Insurance, Doorman, TV/Cable, Exercise Facilities, Exterior Maintenance, Lawn Care, Scavenger	LIBERMAN MANAGEMENT	EADKA	(773) 348-2777				Carpet	Carpet				Hardwood			Hardwood	Hardwood	Full	Carpet	15X12	15X12		18X15	21X16	11X07		12X10	No additional rooms			Balcony	09/08/2015	10/12/2015	10/12/2015	11/20/2015		Coldwell Banker Residential	10115	Rakesh Parikh	172449	 		(312) 266-7000	09/08/2015		Chicago Real Estate Artists LLC	85102	Brady Miller	189535	(773) 977-8553	2.5%-$325 (on Net SP)	None
AT	3430	N	Lake Shore	DR	5L	Chicago	Illinois	60657	8006	Cook		299	299	218	Condo, High Rise (7+ Stories)	19	1955	09043794	CLSD		249000	185000	185000	199500	Cash	N/A	93%	74%	38	38	14213070471039			.49	2443.6	Homeowner	2014	872	No		No	No		5		0	Not Reported				E (East), W (West)	5	2	2	0	2	0	2		1	Attached	None	None	LAKEFRONT/HARBOR VIEWS AND ALL EAST LAKEVIEW HAS TO OFFER AT YOUR DOOR STEP. 2 BEDROOM 2 BATH HOME WITH AN ABUNDANCE OF CLOSET SPACE.  NICE LIGHT COMING IN FROM THE EAST AND WEST.  VERY CLEAN AND EXTREMELY WELL MAINTAINED BUILDING WITH ON-SITE MANAGEMENT, ENGINEER, DOOR STAFF, STORAGE, EXERCISE ROOM, BIKE ROOM AND HUGE WELL APPOINTED LAUNDRY FACILITY. QUIET, SOLID AND UPDATED HOME WITH A GRANITE EAT IN KITCHEN AND A LARGE LIVING SPACE ENOUGH FOR A DINING TABLE.  NEWER WINDOWS, HVAC, UPDATED COPPER PLUMBING, HALLWAYS, ELEVATORS AND EXTERIOR.  LOW TAXES AND WELL PRICED VALET PARKING ON-SITE.	VALET RENTAL PARKING IN THE BUILDING AVAILABLE IMMEDIATELY.  SOLID BUILDING/ASSOCIATION.  SEE THE VIRTUAL TOUR FOR INTERACTIVE FLOOR PLAN.		3+ (Window/Wall Unit)	Hot Water/Steam, 2+ Sep Heating Systems, Indv Controls		Elevator, Hardwood Floors, Storage	No	Oven/Range, Microwave, Dishwasher, Refrigerator		Bike Room/Bike Trails, Door Person, Coin Laundry, Elevator, Exercise Room, Storage, On Site Manager/Engineer, Receiving Room, Curbs/Gutters, Sidewalks, Street Lights, Street Paved	Heat, Air Conditioning, Water, Gas, Common Insurance, Doorman, TV/Cable, Exercise Facilities, Exterior Maintenance, Lawn Care, Scavenger, Snow Removal	LIEBERMAN	EDAKA TIDWELL	(773) 348-2777	72	Yes		Carpet					Hardwood			Hardwood	Carpet	Full	Carpet	14X11			15X13	22X15	09X08		09X09	Foyer				09/21/2015	10/28/2015	10/28/2015	11/19/2015		Berkshire Hathaway HomeServices KoenigRubloff	10900	Mario Greco	113690	Kevin Fitzgerald	138130	(312) 642-1400	09/21/2015	(773) 687-4696	Kale Realty	18426	Natalia Ivanova	878144	(312) 804-5558	2.5% -$325 (on Net SP)	None
AT	3430	N	Lake Shore	DR	10H	Chicago	Illinois	60657	8006	Cook		299	299	218	Condo, High Rise (7+ Stories)	19	1955	09046346	CLSD		234900	210000	210000	219000	Cash	N/A	96%	89%	90	90	14213070471106				3584	None	2014	1082	No		No	No		10		0	Not Reported				N (North), S (South), E (East)	5	2	2	0	2	0	2		2	Attached	None	None	Stunning, panoramic views of Lake Michigan and Belmont Harbor from every room in this rarely available H-tier unit. Open layout. Large master en suite BR w/ walk-in closet. Impeccably maintained building w/24 hour doorman, on-site management and engineers. Bike room. Storage locker. Exercise room. Parking available. Assmts include heat, air, cooking gas, cable. No pets.	tenant occupied until Oct 1... 24 hour notice please		Central Air	Hot Water/Steam			No	Oven/Range, Microwave, Dishwasher, Refrigerator		Bike Room/Bike Trails, Door Person, Coin Laundry, Elevator, Exercise Room, Storage, On Site Manager/Engineer, Receiving Room, Security Door Locks, Service Elevator	Heat, Air Conditioning, Water, Gas, Common Insurance, Security, Doorman, TV/Cable, Exercise Facilities, Exterior Maintenance, Lawn Care, Scavenger, Snow Removal	Lieberman Services Inc.	Eadka Tidwell	(773) 348-2777				Carpet					Carpet			Ceramic Tile	Carpet	Full	Carpet	14X11			16X12	14X22	8X9		8X10	No additional rooms				09/23/2015	12/21/2015	12/21/2015	12/29/2015		@properties	16379	Hank Hoban, GRI	175395	 		(312) 254-0200	09/23/2015	(312) 254-0200x626	@properties	85774	Ryan Gossett	170349	(312) 237-6600	2.5% -$295 (on Net SP)	None
AT	3430	N	Lake Shore	DR	3N	Chicago	Illinois	60657	8006	Cook		299	299	220	Condo	22	UNK	09214990	A/I	A/I	150000	135000		135000					349	349	14213070471013				1333.01	Homeowner	2014	562	No		No	No		4		0	Not Reported				W (West)	4	1	1	0	1	0	1	0	1	Attached	None	None	Light filled 1 bed 1 bath, western exposure. Kitchen includes granite countertops and plenty of storage space. Large living room that could hold a dining table. Master bedroom includes a large window with an organized closet space. This is a full amenity building including a bike room, gym, laundry room, storage locker, and 24-hour doorman. Lake and bike path right out your front door. Walking distance to restaurants, shops, bars and entertainment.	CC: Pursuant to Short Sale. Must give 24 hour notice, the unit is occupied and owner will be present for all showings. YOU MUST BRING YOUR BUSINESS CARD AND ID TO SHOW THE UNIT.		2 (Window/Wall Unit)	2+ Sep Heating Systems		Wood Laminate Floors, Storage	No	Oven/Range, Microwave, Dishwasher, Refrigerator, Disposal		Bike Room/Bike Trails, Door Person, Elevator, Exercise Room, Storage, On Site Manager/Engineer	Heat, Water, Gas, Common Insurance, Doorman, TV/Cable, Exercise Facilities, Exterior Maintenance, Lawn Care, Scavenger, Snow Removal	Lieberman Management Services	Eadka Tidewell	(773) 348-2777x1									Wood Laminate			Wood Laminate	Wood Laminate	None	Wood Laminate				14X11	21X13	9X8		9X8	No additional rooms			Storms/Screens	05/04/2016	09/01/2016				@properties	16379	George Morgan	105855	 		(312) 254-0200	05/04/2016	(773) 309-1586						2.5%-$250 (on Net SP)	None
AT	3430	N	Lake Shore	DR	8N	Chicago	Illinois	60657	8006	Cook		299	299	218	Condo	16	1955	09517203	A/I	A/I	179500	179500		179500					48	48	14213070471083				2165.23	Homeowner	2015	602	No		No	No		8		800	Estimated	0		0		4	1	1	0	1	0	1		2	Attached	None	None	There is nothing to be done to this amazing condo on Lake Shore Drive.  Private balcony to grill on.  This unit is close to  everything.  The lake, beaches, Wrigley, Belmont harbor and golf course and driving range.  24 hr doorman.  Almost all of your bills are included in your HOA.	Great, easy to show condo in a well kept, well managed building.  Conventional or Cash buyers please.		Central Air	Gas			No				Heat, Air Conditioning, Water, Gas, Common Insurance, Doorman, TV/Cable, Exercise Facilities, Exterior Maintenance, Lawn Care, Scavenger, Snow Removal	Lieberman management	mngr	(773) 348-2777														None					15X12	13X21	9X8		9X8	No additional rooms				03/01/2017	03/22/2017				d'aprile properties	86404	Baker Byrd	874916	 		(312) 492-7900	03/01/2017	(773) 793-6074						2.5%-$295 (on Net SP)	None
AT	3430	N	Lake Shore	DR	10N	Chicago	Illinois	60657	8006	Cook		299	299	218	Condo	19	UNK	09560283	A/I	A/I	199000	199000		199000					41	41	14213070471111				1718	Homeowner	2015	611	No		No	No		10		800	Estimated	0		0	W (West)	4	1	1	0	1	0	1		1	Attached	None	None	Fabulous East Lake View, 1 Bedroom, 1 Bath condo that has had many upgrades. Brazilian Cherry floors throughout, all walls freshly painted, Bathroom remodeled with white marble tiles. The Kitchen has off white painted oak cabinets, new glass mosaic back splash, S.S appliances include French door refrigerator, 5 burner range with convection oven, microwave and dishwasher. Wonderful large windows with unobstructed views. Enjoy watching beautiful sunsets on 5 ftx10ft Balcony with room for a grill. Plenty of storage with 3 hall closets, and double hung in the large Master Bedrm. This maticulously maintained building has a 24 hr doorman and heated valet parking garage ($165 a mo). There is a storage unit, large laundry facilicy, exercise room and bike rm in the lower level. This wonderful location has bus stop in front of the building, walking distance to Belmont Harbor, lake front walking/bike paths, grocery stores, shopping and many restaurants. Public golf course and tennis courts nearby	Agent must sign in at front desk in building. Please remove shoes or wear booties. Please turn off lights when done and return key to front desk.		Central Air	Forced Air, Zoned			No			Bike Room/Bike Trails, Door Person, Coin Laundry, Elevator, Exercise Room, Storage, Security Door Locks, Service Elevator, Curbs/Gutters, Sidewalks, Street Lights, Street Paved	Heat, Air Conditioning, Water, Gas, Common Insurance, Security, Doorman, TV/Cable, Exercise Facilities, Exterior Maintenance, Lawn Care, Scavenger, Snow Removal	Lieberman Management Services	Eadka Tidwell	(773) 348-2777		Yes							Hardwood			Hardwood	Hardwood	None	Hardwood				11X14	14X21	8X10		8X8	Foyer		Combined w/ LivRm		03/08/2017	03/20/2017				Coldwell Banker Residential	3630	Patty Kozer	40725	 		(847) 835-6000	03/09/2017							2.5%-$295 (on Net SP)	None
AT	3430	N	LAKE SHORE	DR	7J	Chicago	Illinois	60657	8006	Cook		299	299	218	Condo, Mid Rise (4-6 Stories)	33	1955	09197380	CLSD		205000	205000	205000	205000	Conventional	N/A	100%	100%	5	5	14213070471065				1292.43	Homeowner, Senior	2014	655	No		No	No		7		0	Not Reported				E (East), Lake/Water	4	1	1	0	1	0	1		1	Attached	None	None	Come view this Remodeled and Spacious 1 Bedroom with large private balcony overlooking Lake Michigan and Belmont Harbor. Beautiful Kitchen with stainless steel appliances, granite counters and maple cabinets.  Separate dining room and large living room. Building has newer windows, elevators, heating and cooling units, plumbing and roof. Solid building and solid reserves. Fantastic location just steps from the lake, tennis courts and golf course.  Perfect area for shopping, restaurants and entertainment. Easy access to Lake Shore Dr. and public transportation. This building features exercise room, bike room, large laundry room in building and valet parking is available. (Building doesn't allow pets)			Central Air	Gas			No	Oven/Range, Microwave, Dishwasher, Refrigerator, All Stainless Steel Kitchen Appliances		Door Person, Coin Laundry, Elevator	Heat, Gas, Common Insurance, Security, Doorman, TV/Cable, Exercise Facilities, Exterior Maintenance, Lawn Care, Scavenger, Snow Removal	Lieberman Management Services	Eadka Tidwell	(773) 348-2777		Yes							Wood Laminate				Wood Laminate	None	Wood Laminate				13X12	22X13	8X8		8X8	Balcony		L-shaped	Balcony	04/16/2016	04/20/2016	04/20/2016	05/25/2016		@properties	17665	Mark Keppy	161056	 		(312) 506-0200	04/16/2016	(773) 301-6332	Baird & Warner	10274	Mark Kowalik	879281	(312) 985-6154	2.5% - $295 (on Net SP)	None
AT	3430	N	Lake Shore	DR	14P	Chicago	Illinois	60657	8006	Cook		299	299	219	Condo, High Rise (7+ Stories)	19	1955	09183596	CLSD		320000	310000	310000	320000	Cash	N/A	97%	97%	14	14	14213070471153				3,225.77	None	2014	1001	No		No	No		14		0	Not Reported				E (East), W (West)	5	2	2	0	2	0	2		1	Attached	None	None	Upscale remodeled 2BR/2BA designed and installed to perfectionist standards to frame this undisturbed harbor and lake views.  Completely gutted in 2011 - New: floors, windows (2009), plumbing, lighting, closets, bathrooms, kitchen.  When you enter, you’ll immediately notice the rich, dark hardwood floors that open to the expansive Living room overlooking peaceful lake views and complimented by a chic custom wall unit.  Modern clean lined kitchen with newer LG appliances, espresso cabinets, tile backsplash and slick countertops.  Simple elegant Kohler bathrooms with mocha vanities, tasteful tilework and fresh lighting.  Both bedrooms are large with bright unobstructed west facing views for lots of light along with Wrigley's night game lights.  Not even “move in” ready but “entertain & show off” ready! Rental Parking available in the building along with garage bike storage for a fee.			Central Air	Forced Air, Hot Water/Steam, 2+ Sep Heating Systems, Indv Controls		Storage	No	Oven/Range, Microwave, Dishwasher, Refrigerator		Bike Room/Bike Trails, Door Person, Coin Laundry, Elevator, Exercise Room, Storage, Receiving Room, Security Door Locks	Common Insurance, Doorman, TV/Cable, Exercise Facilities, Exterior Maintenance, Lawn Care, Scavenger, Snow Removal	Lieberman Management	Eadka Tidwell	(773) 348-2777x1				Hardwood					Hardwood	TV-Dish		Marble	Hardwood	Full	Hardwood	14X11			16X12	21X16	9X8		10X8	No additional rooms			Storms/Screens	04/04/2016	04/17/2016	04/17/2016	06/22/2016		@properties	16379	Lisa Resek-Peck, ABR	103183	 		(312) 254-0200	04/04/2016	(312) 254-0331	@properties	4564	Jonathon Nagatani	34531	(847) 999-2399	2.5% - $295 (on Net SP)	None
