AT	401	N	Wabash	AVE	52D	Chicago	Illinois	60611	8008	Cook	TRUMP TOWER CHICAGO	299	299	486	Condo, High Rise (7+ Stories)	92	2007	08523451	CLSD		1650000	1300000	1300000	1590000	Cash	N/A	82%	79%	137	137	17101350381901				NEW	None	2012	1248	No		No	No		52	D	2022	Survey				N (North), S (South), W (West)	5	2	2	0	2	1	2.1	2	1	Attached	None	None	Outstanding 2 bedroom 2 bath home in Trump Tower.  This two bedroom two and a half bath residences feature a luxurious master suite with his and hers walk-in closets, a fireplace and a spa like master bath.  The Panoramic skyline views of the city and north Lake shore feature more than 30 feet of floor to ceiling windows.  Open  gourmet kitchen with Wolf appliances, Sub Zero Referigerator. Full amenity building.	This is the Last D Tier Two bedroom and this unit is a furnished model being "Sold As Is"		Central Air	Electric		Elevator, Hardwood Floors, Laundry Hook-Up in Unit, Storage	No	Oven/Range, Microwave, Dishwasher, Refrigerator, Washer, Dryer, Disposal		Door Person, Elevator, Exercise Room, Health Club, On Site Manager/Engineer, Pool-Indoors, Restaurant, Sauna, Security Door Locks, Service Elevator, Valet/Cleaner, Curbs/Gutters, Sidewalks, Street Lights, Street Paved	Air Conditioning, Water, Gas, Common Insurance, Security, Doorman, TV/Cable, Exercise Facilities, Pool, Exterior Maintenance, Scavenger, Snow Removal	Trump Management	Christine Blevins	(312) 588-8301		Yes		Hardwood			60000		Hardwood			Hardwood	Hardwood	Full	Hardwood	14X15			19X16	17X21	8X16		8X14	No additional rooms	Separate Shower	Separate	Storms/Screens	01/24/2014	06/09/2014	06/09/2014	06/09/2014	
AT	401	N	Wabash	AVE	2646	Chicago	Illinois	60611	8008	Cook	TRUMP TOWER CHICAGO	299	299	486	Condo, High Rise (7+ Stories)	89	2008	08530666	CLSD		1950000	1687500	1687500	1950000	Cash	N/A	87%	87%	505	505	17101350391304				10729.31		2013	5654	No		No	No		26		2032	Builder				N (North), S (South), E (East), Lake/Water	5	2	2	0	3	0	3	1			None	None	The Largest 2 bedroom hotel room available at Trump. Among the Highest income producing consistently for three years, 6.5% Cap Aprox  nets inc $123,000 per anum. East facing, breathtaking lake views. Fully equipped kitchen w/ Miele & Sub-Zero SS appls, granite & Snaidero cabinets. Superb furnishings, world class amenities, indoor pool, Sixteen lounge, health club & spa. Financing possible with qualified credentials.	Please note this is a hotel unit - not a residential unit. 48 Hour notice needed.		Central Air	Electric, Forced Air		Hardwood Floors	No	Oven/Range, Microwave, Dishwasher, Refrigerator		Bike Room/Bike Trails, Door Person, Elevator, Exercise Room, Storage, Health Club, On Site Manager/Engineer, Party Room, Pool-Indoors, Receiving Room, Restaurant, Sauna, Service Elevator, Steam Room, Valet/Cleaner	Water, Gas, Common Insurance, Security, Doorman, TV/Cable, Exercise Facilities, Pool, Exterior Maintenance, Lawn Care, Scavenger, Snow Removal	Trump	Christine Blevins	(312) 588-8301				Hardwood					Hardwood			Hardwood	Hardwood	Full	Hardwood	14X21			15X19	25X18	8X10		COMBO	No additional rooms	Separate Shower, Double Sink			02/05/2014	06/24/2015	06/24/2015	07/16/2015	
AT	401	N	Wabash	AVE	79A	Chicago	Illinois	60611	8008	Cook	TRUMP TOWER CHICAGO	299	299	486	Condo, High Rise (7+ Stories)	1	2007	08531186	CLSD		3199000	2925000	2925000	3199000	Cash	N/A	91%	91%	95	95	17101350381815				37,896	None	2012	2788	No		No	No		79	A	3080	Builder				N (North), S (South), E (East), W (West), City, Lake/Water	7	3	3	0	3	1	3.1	3	2	Attached	None	None	Trump International Tower. Ultra Luxury living in this 79th flroor 3 bedroom plus den + 3.5 baths. Prime A Tier with panoramic views of Chicago skyline, Chicago river and lake. 3 Fireplaces, Hardwood floors, Kitchen w/ granite, Snaidero cabs, Sub-Zero and Miele appliances, Luxurious Mstr Spa Bath, In unit Laundry room. 2 Deeded Parking spaces 65,000 each.	Restricted showings from 4 to 5pm only!!! Parking pin numbers 17-10-135-038-1676 and 1677  Taxes $946 each, Pictures taken prior to tenants move in.  Condo painted beautiful colors by tenants. Lighting fixtures belong to tenants		Central Air	Electric		Hardwood Floors, Laundry Hook-Up in Unit, Storage	Yes	Oven/Range, Microwave, Dishwasher, Refrigerator, Freezer, Washer, Dryer, Disposal		Door Person, Elevator, Exercise Room, Health Club, On Site Manager/Engineer, Pool-Indoors, Restaurant, Sauna, Security Door Locks, Service Elevator, Valet/Cleaner, Curbs/Gutters, Sidewalks, Street Lights, Street Paved	Air Conditioning, Water, Gas, Common Insurance, Security, Doorman, TV/Cable, Exercise Facilities, Pool, Exterior Maintenance, Scavenger, Snow Removal	Trump	Christine Blevins	(312) 588-8300		Yes		Hardwood	Hardwood		130000		Hardwood	Fire Sprinklers	Hardwood	Hardwood	Hardwood	Full	Hardwood	17X15	19X12		19X16	38X21	16X16	14X13	COMBO	No additional rooms	Whirlpool, Separate Shower, Double Sink	Combined w/ LivRm		02/06/2014	05/11/2014	05/11/2014	06/30/2014	
AT	401	N	Wabash	AVE	84G	Chicago	Illinois	60611	8008	Cook	TRUMP TOWER CHICAGO	299	299	486	Condo, Studio	92	2007	08538607	CLSD		899000	780000	780000	899000	Cash	N/A	87%	87%	29	29	17101350382039				NEW	None	2012	1094	No		No	No		84	G	1314	Survey				S (South), W (West)	4	1	1	0	1	1	1.1	0	1	Attached	None	None	Spacious 1 bedroom Den  with 1.5 bathroom luxury residence in Trump Chicago.  This 1314 sqft home has 10'ceilings, open gourmet kitchen with custom appliances, Large Master Suite with double walk in closets ,spa like master bath with separate shower.  Enjoy panoramic skyline views of the loop and western sunsets from the floor to ceiling windows.  The finest amenities available to you.  Parking sold separately.	Unit photos are of furnished Model on the 77th floor		Central Air	Electric		Hardwood Floors, Laundry Hook-Up in Unit, Storage	No	Oven/Range, Microwave, Dishwasher, High End Refrigerator, Washer, Dryer, Disposal, All Stainless Steel Kitchen Appliances		Door Person, Elevator, Exercise Room, Health Club, On Site Manager/Engineer, Pool-Indoors, Restaurant, Sauna, Security Door Locks, Service Elevator, Valet/Cleaner, Curbs/Gutters, Sidewalks, Street Lights, Street Paved	Air Conditioning, Water, Gas, Common Insurance, Security, Doorman, TV/Cable, Exercise Facilities, Pool, Exterior Maintenance, Scavenger, Snow Removal	Trump Management	Christine Blevins	(312) 588-8300		Yes					55000		Hardwood	TV-Cable		Hardwood	Hardwood	Full	Hardwood				14X16	15X21	12X7			Den	Whirlpool, Separate Shower, Double Sink	Combined w/ LivRm	Storms/Screens, Cable Access	02/17/2014	03/17/2014	03/17/2014	04/02/2014	
AT	401	N	WABASH	AVE	31F	Chicago	Illinois	60611	8008	Cook	TRUMP TOWER CHICAGO	299	299	486	High Rise (7+ Stories), Studio	92	2007	08534381	CLSD		499000	455000	455000	475000	Cash	N/A	96%	91%	113	113	17101350381108				989.27		2012	551	No		No	No		31		713	Builder				N (North), W (West)	2	0	0	0	1	0	1				None	None	Rare large & never lived in studio at iconic Trump, great NW corner affords amazing sunsets & city views, expansive 10 floor to ceiling windows, Snaidero cabs, Sub Zero, Miele, & Wolf, fully furnished w/professionally installed Murphy wall bed & sheer/blackout drapes included, 5 star health club & spa, all the world class amenities that only living in Trump can offer,all this steps to all River North can offer.			Central Air	Electric, Zoned		Hardwood Floors	No	Oven/Range, Microwave, Dishwasher, Refrigerator, Washer, Dryer, Disposal		Door Person, Elevator, Exercise Room, Storage, Health Club, On Site Manager/Engineer, Pool-Indoors, Receiving Room, Restaurant, Sauna, Security Door Locks, Service Elevator, Steam Room, Valet/Cleaner, Curbs/Gutters, Sidewalks, Street Lights, Street Paved	Air Conditioning, Water, Common Insurance, Security, Doorman, TV/Cable, Exercise Facilities, Exterior Maintenance, Scavenger, Snow Removal	na	na	(000) 000-0000												Hardwood	Hardwood	Full						27X14	10X05			No additional rooms		Combined w/ LivRm		02/11/2014	06/03/2014	06/03/2014	06/30/2014	
AT	401	N	WABASH	AVE	39I	Chicago	Illinois	60611	8008	Cook	TRUMP TOWER CHICAGO	299	299	486	Condo, High Rise (7+ Stories)	89	2008	08537053	CLSD		824000	745000	745000	779000	Conventional	N/A	96%	90%	172	172	17101350382060				1042.23	None	2012	581	No		No	No		39	I TIER	0	Not Reported				S (South), E (East), Lake/Water	3	1	1	0	1	1	1.1	0	1	Attached	None	None	Great River & Lake views. Immaculately designed, graciously appointed 1-Bedroom condo. 5 star finishes, floor-to-ceiling windows, huge master bedroom, master bath includes a deep soaking tub. All within walking distance to the best Chicago offers, from the exclusive shops on Michigan Ave to Chicago's historic sites along the Riverwalk. Deeded parking available and sold separately	Email phil@philskowron.com or call 312-612-0303		Central Air	Electric, Zoned		Hardwood Floors, Laundry Hook-Up in Unit	No	Oven/Range, Microwave, Dishwasher, High End Refrigerator, Washer, Dryer, Disposal, All Stainless Steel Kitchen Appliances		Bike Room/Bike Trails, Door Person, Elevator, Exercise Room, Storage, Health Club, On Site Manager/Engineer, Pool-Indoors, Sauna, Service Elevator, Steam Room, Valet/Cleaner, Curbs/Gutters, Sidewalks, Street Lights, Street Paved	Air Conditioning, Water, Gas, Common Insurance, Security, Doorman, TV/Cable, Exercise Facilities, Pool, Exterior Maintenance, Lawn Care, Scavenger, Snow Removal	Trump Management	Christine Blevins	(312) 588-8300		Yes					65000					Hardwood	Hardwood	Full	Hardwood				14X12	17X14	10X9			No additional rooms	Whirlpool, Separate Shower		Dog Run &/or Invisible Fence	02/14/2014	08/04/2014	08/04/2014	09/29/2014	
AT	401	N	WABASH	AVE	41H	Chicago	Illinois	60611	8008	Cook	Trump Tower Chicago	299	299	486	Condo, High Rise (7+ Stories)	89	2008	08536991	CLSD		1699000	1610000	1610000	1699000	Cash	N/A	95%	95%	18	18	17101350382041				$18,449	None	2012	1287	No		No	No		41		2000	Estimated				S (South), E (East)	5	2	2	0	2	1	2.1	1	0	Attached	None	None	Trump Tower with 5 star services and amenities. Best views in the building. Immaculately designed ~2000 sq/ft home with stunning views over the city & lake. 10' floor to ceiling windows, large master bedroom, oversized master bath with deep soaking tub & dual vanity. World class health club & spa... All within walking distance to the best Chicago offers.	Email phil@philskowron.com or call 312-612-0303		Central Air, Zoned	Electric, Zoned		Hardwood Floors, Laundry Hook-Up in Unit, Storage	No	Oven/Range, Microwave, Dishwasher, Refrigerator, Washer, Dryer, Disposal		Bike Room/Bike Trails, Elevator, Exercise Room, Storage, Health Club, Park/Playground, Pool-Indoors, Receiving Room, Restaurant, Service Elevator, Steam Room, Valet/Cleaner	Water, Gas, Common Insurance, Doorman, TV/Cable, Exercise Facilities, Pool, Scavenger, Snow Removal	Trump Management	Christine Blevins	(312) 588-8300		Yes		Hardwood					Hardwood	TV-Cable, Fire Sprinklers		Hardwood	Hardwood	Full	Hardwood	17X13			17X17	29X16	15X11		COMBO	No additional rooms	Whirlpool, Separate Shower, Double Sink	Combined w/ LivRm		02/14/2014	03/03/2014	03/03/2014	03/17/2014	
AT	401	N	WABASH	AVE	39J	Chicago	Illinois	60611	8008	Cook	TRUMP TOWER CHICAGO	299	299	486	Condo, High Rise (7+ Stories)	92	2007	08550589	CLSD		2200000	1713000	1713000	1870000	Cash	N/A	92%	78%	155	155	17101350381178				19153.44	None	2013	1456	No		No	No		39		2076	Builder				S (South), E (East), Lake/Water, Park	5	2	2	0	2	1	2.1	1	2	Attached	None	None	STUNNING TRUMP TOWER! HIGHLY DESIRED "J" TIER.  SPECTACULAR UNOBSTRUCTED SE VIEW OF LAKE, RIVER & MILLENIUM PK. CUSTOM DESIGNED UNIT W/HDWD FLRS, FIREPLACE, OPEN GOURMET SNAIDERO KITCHEN, CUSTOM BLT-IN BAR AREA. HI-END APPL. FULL BTH IN EACH BDRM & GUEST BTH. MSTR BTH W/DBL SINK, KOHLER WHIRLPL TUB/WALK-IN SHWR. HIS/HER CLOSETS, PANTRY, LNDRY, WNDW TRTMNTS. FITNESS CNTR SAME FL. STORAGE, 2 DEED. PKG SP. SOLD SEPARATE	APPLIANCES INCLUDE SUB-ZERO REFRG., MIELE RANGE, WOLF MICROWAVE.    FULL ACCESS TO TRUMP HOTEL AMENITIES (POOL & SPA).  CHECK OUT THE WEBSITE AT WWW.401NWABASHAVEUNIT39J.COM		Central Air	Electric, Zoned		Hardwood Floors, Laundry Hook-Up in Unit, Storage	Yes	Oven/Range, Microwave, Dishwasher, High End Refrigerator, Washer, Dryer, All Stainless Steel Kitchen Appliances		Bike Room/Bike Trails, Door Person, Elevator, Exercise Room, Storage, Health Club, On Site Manager/Engineer, Pool-Indoors, Restaurant, Sauna, Security Door Locks, Service Elevator, Steam Room, Valet/Cleaner, Curbs/Gutters, Sidewalks, Street Lights, Street Paved	Air Conditioning, Water, Gas, Common Insurance, Security, Doorman, TV/Cable, Exercise Facilities, Pool, Exterior Maintenance, Lawn Care, Scavenger, Snow Removal	TRUMP MANAGEMENT SALES OFFICE	CHRISTINE BLEVINS	(312) 588-8300		Yes		Hardwood			120000		Hardwood			Hardwood	Hardwood	Full	Hardwood	16X12			17X17	26X20	14X10		COMBO	No additional rooms	Whirlpool, Separate Shower, Double Sink	Combined w/ LivRm		03/05/2014	08/06/2014	08/06/2014	08/22/2014	
AT	401	N	Wabash	AVE	79E	Chicago	Illinois	60611	8008	Cook	TRUMP TOWER CHICAGO	299	299	486	Condo, High Rise (7+ Stories)	89	2007	08541218	CLSD		1035000	955000	955000	990000	Conventional	N/A	96%	92%	105	105	17101350381964				1526.34	None	2012	799	No		No	No		79	E	0	Not Reported				S (South), E (East), Lake/Water	4	1	1	0	1	1	1.1	0	1	Attached	None	None	Incredible luxury condo at the Trump Tower. Stunning views overlooking lake Michigan, Chicago River, Navy Pier, museums & stadiums, Millennium Park & Grant Park, Buckingham Fountain, Cloud Gate "bean" and so much more! This rarely available condo includes Snidero cabinetry, hardwood floors, 10' floor to ceiling windows, stainless steal appliances by Wolf, Subzero, and Miele, and all Trump Hotel services & amenities	Email phil@philskowron.com or call 312-612-0303		Central Air	Electric		Hardwood Floors, Laundry Hook-Up in Unit, Storage	Yes	Oven/Range, Microwave, Dishwasher, Refrigerator, High End Refrigerator, Washer, Dryer, Disposal, All Stainless Steel Kitchen Appliances		Bike Room/Bike Trails, Door Person, Elevator, Exercise Room, Storage, Health Club, On Site Manager/Engineer, Pool-Indoors, Receiving Room, Restaurant, Sauna, Security Door Locks, Service Elevator, Steam Room, Valet/Cleaner, Curbs/Gutters, Sidewalks, Street Lights, Street Paved	Air Conditioning, Water, Gas, Common Insurance, Security, Doorman, TV/Cable, Exercise Facilities, Pool, Exterior Maintenance, Lawn Care, Scavenger, Snow Removal	Trump Management	Christine Blevins	(312) 588-8301		Yes					65000		Hardwood			Hardwood	Hardwood	Full	Hardwood				14X14	18X15	9X8		COMBO	No additional rooms	Whirlpool, Separate Shower, Double Sink	Combined w/ LivRm	Storms/Screens	02/20/2014	06/04/2014	06/04/2014	07/25/2014	
AT	401	N	Wabash	AVE	77D	Chicago	Illinois	60611	8008	Cook	TRUMP TOWER CHICAGO	299	299	486	Condo, High Rise (7+ Stories)	89	2007	08555457	CLSD		2950000	2837500	2837500	2950000	Conventional	N/A	96%	96%	24	24	17101350381926				36769	None	2012	2711	No		No	No		77	D	3102	Builder				S (South), E (East)	7	3	3	0	4	0	4	2	2	Attached	None	None	Unbelievable sweeping views of the city, lake and skyline from this 3-bed 4-bath home at the Trump Tower. Expansive master suite with extra large bath and double walk-in closets. Large kitchen with attached den. Spacious living room/dining room following the dramatic curve of the building. Subzero, Viking, Wolf, and Miele appliances with Snaidero cabinets. Enjoy the best in luxury living with all hotel amenities.			Central Air	Electric		Hardwood Floors, Laundry Hook-Up in Unit, Storage	Yes	Oven/Range, Microwave, Dishwasher, Refrigerator, Freezer, Washer, Dryer, Disposal		Door Person, Elevator, Exercise Room, Health Club, On Site Manager/Engineer, Pool-Indoors, Restaurant, Sauna, Security Door Locks, Service Elevator, Valet/Cleaner, Curbs/Gutters, Sidewalks, Street Lights, Street Paved	Air Conditioning, Water, Gas, Common Insurance, Security, Doorman, TV/Cable, Exercise Facilities, Pool, Exterior Maintenance, Scavenger, Snow Removal	Trump Management	Christine Blevins	(312) 588-8300		Yes		Hardwood	Hardwood		65000		Hardwood	Fire Sprinklers	Hardwood	Hardwood	Hardwood	Full	Hardwood	15X16	12X16		19X16	24X30	13X15	18X15	COMBO	No additional rooms	Whirlpool, Separate Shower, Double Sink	Combined w/ LivRm	Storms/Screens, End Unit	03/11/2014	04/03/2014	04/03/2014	05/22/2014	
AT	401	N	Wabash	AVE	85G	Chicago	Illinois	60611	8008	Cook	TRUMP TOWER CHICAGO	299	299	486	Condo, Studio	92	2007	08555166	CLSD		950000	850000	850000	950000	Cash	N/A	89%	89%	15	15	17101350382040				NEW	None	2012	1127	No		No	No		84	G	1314	Survey				S (South), W (West), City	4	1	1	0	1	1	1.1	0	1	Attached	None	None	Spacious 1 bedroom Den  with 1.5 bathroom luxury residence in Trump Chicago.  This 1314 sqft home has 11'ceilings, open gourmet kitchen with custom appliances, Large Master Suite with double walk in closets ,spa like master bath with separate shower.  Enjoy panoramic skyline views of the loop and western sunsets from the floor to ceiling windows.  The finest amenities available to you.  Parking sold separately.	Great One Bedroom with Den area, this unit has 11' ceilings		Central Air	Electric		Hardwood Floors, Laundry Hook-Up in Unit, Storage	No	Oven/Range, Microwave, Dishwasher, High End Refrigerator, Washer, Dryer, Disposal, All Stainless Steel Kitchen Appliances		Door Person, Elevator, Exercise Room, Health Club, On Site Manager/Engineer, Pool-Indoors, Restaurant, Sauna, Security Door Locks, Service Elevator, Valet/Cleaner, Curbs/Gutters, Sidewalks, Street Lights, Street Paved	Air Conditioning, Water, Gas, Common Insurance, Security, Doorman, TV/Cable, Exercise Facilities, Pool, Exterior Maintenance, Scavenger, Snow Removal	Trump Management	Chrsitine Blevins	(312) 588-8300		Yes					65000		Hardwood	TV-Cable		Hardwood	Hardwood	Full	Hardwood				14X16	15X21	12X7			Den	Whirlpool, Separate Shower, Double Sink	Combined w/ LivRm	Storms/Screens, Cable Access	03/11/2014	03/25/2014	03/25/2014	05/12/2014	
DP	401	N	Wabash	AVE	P435	Chicago	Illinois	60611	8008	Cook				650			2008	08561399	CLSD		150000	100000	100000	125000	Cash	N/A	80%	67%	459	459	17101350381611				1116.36		2012	85			No	No		3											0									Ultra premium parking spot P435 located on the first floor for owners parking, close to elevator. Level three.		1																																								03/18/2014	06/19/2015	06/19/2015	07/10/2015	
AT	401	N	Wabash	AVE	33B	Chicago	Illinois	60611	8008	Cook		299	299	486	Condo, Studio	89	2007	08558136	CLSD		399000	380000	380000	399000	Cash	N/A	95%	95%	27	6	17101350381026				NEW		2012	541	No		No	No		33		580	Landlord/Tenant/Seller					2	0	0	0	1	0	1				None	None	Gorgeous Studio in desirable Trump Tower.  Almost $20K in upgrades from developer delivery.  Beautiful NW City views.  Unit features 10' ceilings, gourmet kitchen with Wolfe/Sub-Z/Miele appliances, and spa bath.  Enjoy 5-star Trump Tower and Hotel amenities.  The perfect in-town, or great investment.			Central Air	Gas		Hardwood Floors, Laundry Hook-Up in Unit	No				Air Conditioning, Water, Gas, Common Insurance, Security, Doorman, TV/Cable, Exercise Facilities, Pool, Exterior Maintenance, Scavenger, Snow Removal	Trump Management	Christine Blevins	(312) 588-3300														None						17X17	10X5			No additional rooms				03/14/2014	03/19/2014	03/19/2014	04/29/2014	
AT	401	N	Wabash	AVE	77G	Chicago	Illinois	60611	8008	Cook	TRUMP TOWER CHICAGO	299	299	486	Condo, Studio	92	2007	08570804	CLSD		925000	855000	855000	925000	Conventional	N/A	92%	92%	6	6	17101350382032				NEW	None	2012	1041	No		No	No		77	G	1314	Survey				S (South), W (West), City	4	1	1	0	1	1	1.1	0	1	Attached	None	None	Spacious 1 bedroom Den with 1.5 bathroom luxury residence in Trump Chicago.  This 1314 sqft home has 10'ceilings, open gourmet kitchen with custom appliances, Large Master Suite with double walk in closets ,spa like master bath with separate shower.  Enjoy panoramic skyline views of the loop and western sunsets from the floor to ceiling windows.  The finest amenities available to you.  Parking sold separately.	This unit is being sold as a furnished Model all furniture and accessories included.   "As Is"		Central Air	Electric		Hardwood Floors, Laundry Hook-Up in Unit, Storage	No	Oven/Range, Microwave, Dishwasher, High End Refrigerator, Washer, Dryer, Disposal, All Stainless Steel Kitchen Appliances		Door Person, Elevator, Exercise Room, Health Club, On Site Manager/Engineer, Pool-Indoors, Restaurant, Sauna, Security Door Locks, Service Elevator, Valet/Cleaner, Curbs/Gutters, Sidewalks, Street Lights, Street Paved	Air Conditioning, Water, Gas, Common Insurance, Security, Doorman, TV/Cable, Exercise Facilities, Pool, Exterior Maintenance, Scavenger, Snow Removal	Trump Management	Christine Blevins	(312) 588-8300		Yes					65000		Hardwood	TV-Cable		Hardwood	Hardwood	Full	Hardwood				14X16	15X21	12X7			Den	Whirlpool, Separate Shower, Double Sink	Combined w/ LivRm	Storms/Screens, Cable Access	03/30/2014	04/04/2014	04/04/2014	05/30/2014	
AT	401	N	WABASH	AVE	43B	Chicago	Illinois	60611	8008	Cook		299	299	486	Condo, High Rise (7+ Stories)	89	2008	08579392	CLSD		690000	688500	688500	690000	Conventional	N/A	100%	100%	9	9	17101350381036				9466		2012	680	No		No	No		43		1071	Other					4	1	1	0	1	1	1.1		1	Attached	None	None	Trump Rarely Available North/West/City/Lake Views Spacious 1 Bedroom/ 1.5 Bath,1071 sq ft,10Ft Ceiling Heights,Snaidero Kitchen,SS Wolf/Miele/SubZero Appls. Dark Brazilian Hardwood Floors Thru-Out.Large Master Bath with Glass Shower,Double Sink/Vanity.Custom Window Treatments. Plenty of Closet Space.World Class/Exclusive Health Club,Indoor Pool,Spa.5 Star Amenities Galore.24 hour Door Staff,On Sight Mgmt,Pet Friendly	Please exclude bedroom draperies and window treatments.		Central Air	Electric			Yes	Oven-Double, Microwave, Dishwasher, Refrigerator, Washer, Dryer, Disposal		Door Person, Elevator, Exercise Room, Storage, Health Club, On Site Manager/Engineer, Sundeck, Pool-Indoors, Receiving Room, Restaurant	Air Conditioning, Water, Common Insurance, Doorman, TV/Cable, Exercise Facilities, Pool, Exterior Maintenance, Scavenger, Snow Removal	.	.	(000) 000-0000									Hardwood	TV-Cable, Fire Sprinklers, CO Detectors		Hardwood	Hardwood	Full	Hardwood				14X12	14X17	10X11		COMBO	No additional rooms	Separate Shower	Combined w/ LivRm		04/08/2014	04/16/2014	04/16/2014	06/03/2014	
AT	401	N	Wabash	AVE	31G	Chicago	Illinois	60611	8008	Cook	TRUMP TOWER CHICAGO	299	299	486	Condo, Studio	89	2007	08574703	CLSD		725000	715000	715000	725000	Conventional	N/A	99%	99%	557	161	17101350381128				10009	None	2012	680	No		No	No		31	G	1314	Builder				N (North), W (West)	3	1	1	0	1	1	1.1	0	1	Attached	None	None	Large 1314 sqft luxury condo at the Trump. Immaculately designed, graciously appointed 1-bedroom with 5 star finishes, city and lake views, floor-to-ceiling windows, large master bedroom, and an over-sized master bath including a deep soaking tub. All within walking distance to the best Chicago offers, from the exclusive shops on Michigan Avenue to Chicago's historic sites along the Riverwalk. Leased till June '14	Call Marshall 312-618-0812 or email mmmagaro@atproperties.com		Central Air	Electric		Elevator, Hardwood Floors, Laundry Hook-Up in Unit, Storage	Yes	Oven/Range, Microwave, Dishwasher, Refrigerator, Washer, Dryer, Disposal		Door Person, Elevator, Exercise Room, Health Club, On Site Manager/Engineer, Pool-Indoors, Restaurant, Sauna, Security Door Locks, Service Elevator, Valet/Cleaner, Curbs/Gutters, Sidewalks, Street Lights, Street Paved	Air Conditioning, Water, Common Insurance, Security, Doorman, TV/Cable, Exercise Facilities, Pool, Exterior Maintenance, Scavenger, Snow Removal	Trump Management	Christine Blevins	(312) 588-8301									Hardwood			Hardwood	Hardwood	Full	Hardwood				15X16	15X21	12X7			No additional rooms	Whirlpool, Separate Shower	Combined w/ LivRm	Storms/Screens	04/03/2014	09/10/2014	09/10/2014	11/10/2014	
AT	401	N	Wabash	AVE	58D	Chicago	Illinois	60611	8008	Cook	TRUMP TOWER CHICAGO	299	299	486	Condo, High Rise (7+ Stories)	89	2008	08570072	CLSD		1550000	1300000	1300000	1425000	Conventional	N/A	91%	84%	114	114	17101350381907				2,358.91	Homeowner	2012	1337	No		No	No		58	D	2022	Builder				N (North), W (West)	5	2	2	0	2	1	2.1	2	0	Attached	None	None	Trump Tower residence: Enormous 2 bedroom, 2.5 bathroom featuring 2 fireplaces,  floor to ceiling windows framing panoramic skyline views of the lake and city.  Open Gourmet kitchen with Wolf and Sub Zero.  The luxurious master suite includes 300 square foot his and hers walk-in closets, spa like master bathroom.  Enjoy 5 star amenities and services.	Storage unit: S4308.  Photos are of model unit with similar layout.		Central Air	Electric, Forced Air, Zoned		Elevator, Hardwood Floors, Laundry Hook-Up in Unit, Storage	No	Oven/Range, Microwave, Dishwasher, Refrigerator, Freezer, Washer, Dryer, Disposal		Bike Room/Bike Trails, Door Person, Elevator, Exercise Room, Storage, Health Club, On Site Manager/Engineer, Party Room, Pool-Indoors, Receiving Room, Restaurant, Sauna, Service Elevator, Steam Room, Valet/Cleaner, Curbs/Gutters, Sidewalks, Street Lights, Street Paved	Water, Gas, Common Insurance, Security, Doorman, TV/Cable, Exercise Facilities, Pool, Exterior Maintenance, Lawn Care, Scavenger, Snow Removal	Trump	Christine Blevins	(312) 588-8301				Hardwood					Hardwood			Hardwood	Hardwood	Full	Hardwood	14X15			20X16	17X22	8X16		8X14	No additional rooms	Separate Shower, Double Sink	Separate	Storms/Screens	03/28/2014	07/19/2014	07/19/2014	08/20/2014	
