AT	401	N	WABASH	AVE	49I	Chicago	Illinois	60611	8008	Cook		299	299	486	Condo, High Rise (7+ Stories)	92	2008	09359223	ACTV		2100000	2100000		2100000					174	174	17101350381167				30565.43	None	2015	2036	No		No	No		49		2146	Builder				S (South), E (East), City, Lake/Water	5	2	2	0	2	1	2.1		1	Attached	None	None	One of only 9 condos in the building's preferred southeast tier. this 2,146 sqft Trump Tower condo offers breathtaking views of the city skyline, Chicago River and Lake Michigan. It is located on the building's transition floor with 11 foot ceilings, significantly taller than standard! The over-sized combo living/dining room includes floor-to-ceiling windows, hardwood floors, a fireplace and new recessed art lighting. The roomy eat-in kitchen is outfitted with Snaidero cabinetry and Wolf and Miele appliances. The master suite has two walk-in closets and a stunning en suite bath. In addition to a 2nd bedroom and full bath, there is a powder room for guests. The price includes a deeded garage space; a second 2-car tandem space is available for $60k. Renowned for great service, building amenities include an attentive staff, a health club, spa, lap pool, and concierge as well as the services offered by the hotel. This building is central to downtown, Millennium Park and the river walk!	One deeded single garage space is included in the price. The monthly assessments are $1,956 for the condo and $80 for the garage space. The 2015 property taxes were $29,452 for the condo and $1,113 for the garage space. The sellers own another (tandem) parking garage space, and will sell it for an additional $60k. Rentals are allowed with a minimum one year lease. Up to two cats and/or dogs are allowed per unit.		Central Air, Zoned	Electric, Zoned		Hardwood Floors, Laundry Hook-Up in Unit	Yes	Oven/Range, Microwave, Dishwasher, High End Refrigerator, Washer, Dryer, Disposal, All Stainless Steel Kitchen Appliances		Bike Room/Bike Trails, Door Person, Elevator, Exercise Room, Storage, Health Club, On Site Manager/Engineer, Party Room, Sundeck, Pool-Indoors, Receiving Room, Restaurant, Sauna, Service Elevator, Steam Room, Valet/Cleaner, Whirlpool, Business Center	Water, Parking, Common Insurance, Security, Doorman, TV/Cable, Exercise Facilities, Pool, Exterior Maintenance, Lawn Care, Scavenger, Snow Removal, Internet Access	Trump Management	Christine Blevins	(312) 588-8300	73			Hardwood					Hardwood	TV-Cable, Fire Sprinklers		Hardwood	Hardwood	Full	Hardwood	15X13			15X17	20X16	14X10		20X10	Foyer, Walk In Closet	Whirlpool, Separate Shower, Double Sink, Full Body Spray Shower	Combined w/ LivRm		10/04/2016				
AT	401	N	Wabash	AVE	2120	Chicago	Illinois	60611	8008	Cook		299	299	758	Condo, High Rise (7+ Stories), Studio	89	2008	09337390	ACTV		295000	295000		295000					200	200	17101350391178				5140.43		2015	2339	No		No	No		21		604	Builder				N (North), W (West), City	2	0	0	0	1	0	1				None	None	Own a piece of the Trump International Tower! This Hotel/Condominium comes complete with luxurious finishes and all furnishings including a fully equipped kitchen with Miele and Sub-Z appliances. The floor to ceiling windows showcase amazing open city views. Use as your getaway apartment or utilize the hotel rental program to generate income. Enjoy 5 Star amenities, world class servicesThe Best of The Best!	THIS IS A HOTEL CONDOMINIUM. 48 HOUR NOTICE REQUIRED. SHOWINGS CAN BE SCHEDULED ONLY MONDAY THRU FRIDAY BETWEEN 2:00- 2:30 SUBJECT TO THE ROOM's OCCUPANCY. **Financial statements can be found under additional information.**		Central Air	Electric				Microwave, Dishwasher, Refrigerator		Door Person, Elevator, Exercise Room, Health Club, On Site Manager/Engineer, Sundeck, Pool-Indoors, Restaurant, Sauna, Security Door Locks, Valet/Cleaner	Heat, Air Conditioning, Water, Common Insurance, Security, Doorman, TV/Cable, Exercise Facilities, Pool, Exterior Maintenance, Scavenger, Snow Removal, Internet Access	Trump Management	Claudia Ciceo	(312) 588-8081													Carpet	Half						23X15	0X0			No additional rooms	European Shower			09/08/2016				
AT	401	N	WABASH	AVE	42A	Chicago	Illinois	60611	8008	Cook		299	299	486	High Rise (7+ Stories)	89	2008	09346748	CLSD		4300000	4050000	4050000	4300000	Cash	N/A	94%	94%	92	92	17101350381014				42951	Homeowner, Senior	2015	3172	No		No	No		44	3 BEDROOM+	3948	Builder				N (North), S (South), E (East), City, Lake/Water	8	3	3	0	4	1	4.1	2	2	Attached	None	None	Incredible A tier home: 4,000 square feet of opulent living with 3 bedrooms, separate media room and family room. The spacious foyer opens into a sundrenched, river-facing living room with sweeping, unmatched views of Chicago from the floor to ceiling windows.  Stylishly customized with new hardwood floors, custom lighting, built-ins, and surround sound. The exquisite kitchen finishes include marble counters, Miele cooktop and dishwasher, Wolf wall oven and microwave, and separate full size Sub-Zero refrigerator and full size Sub-Zero freezer. Enjoy one of three fireplaces,  each featuring a custom stone mantel.  The sizable master suite includes two enormous walk-in closets and lavish his and hers master bathrooms finished in beautiful natural stone walls and floors, an oversized bathtub, and separate showers.	Monthly assessment listed includes a monthly charge for the supplemental reserve fund in the amount of $407.41 ($386.79 for the unit and $20.62 for parking). This charge will conclude in December 2020.		Central Air	Electric, Zoned			Yes	Oven/Range, Dishwasher, Refrigerator, Freezer, Washer, Dryer, Disposal		Door Person, Elevator, Exercise Room, Storage, Health Club, On Site Manager/Engineer, Party Room, Pool-Indoors, Receiving Room, Restaurant, Sauna, Security Door Locks, Service Elevator, Steam Room	Air Conditioning, Water, Common Insurance, Doorman, TV/Cable, Pool, Exterior Maintenance, Scavenger, Snow Removal	Trump	Melissa Wulf	(312) 588-8300				Hardwood	Hardwood				Hardwood		Hardwood	Hardwood	Hardwood	Full	Hardwood	15X16	21X12		19X16	36X26	17X17	18X16	COMBO	Media Room	Whirlpool, Separate Shower	Combined w/ LivRm		09/20/2016	12/20/2016	12/20/2016	01/31/2017	
AT	401	N	Wabash	AVE	2436	Chicago	Illinois	60611	8008	Cook	TRUMP TOWER CHICAGO	299	299	485	Condo	89	2008	09348080	ACTV		785000	785000		785000					187	187	17101350391269				7445.67	None	2015	3393	No		No	No		24		1220	Builder				S (South), E (East)	4	1	1	0	2	0	2	0	0	Attached	None	None	Rare opportunity to own a large 1 bedroom w/ 2 full baths in Chicago's premier luxury building. Stunning water and city views, Impeccably furnished with luxury finishes. Spacious LR/ DR Area with separate kitchen and huge bedroom + Spa Bath. Trump Hotel 5 Star Amenities inc white gloves services , fitness center and Trump Spa. Program option available to owner. Ideal in-town or Corporate Suite.	Please note this is a hotel unit - not a residential unit. 48 Hour notice needed. Showings can only take place at 2 pm Monday -Friday depending on the unit availability.		Central Air	Electric			No	Microwave, Refrigerator		Door Person, Elevator, Exercise Room, Health Club, On Site Manager/Engineer, Pool-Indoors, Restaurant, Sauna, Security Door Locks, Service Elevator, Valet/Cleaner, Curbs/Gutters, Sidewalks, Street Lights, Street Paved	Heat, Air Conditioning, Water, Electric, Gas, Tax, Security, Doorman, TV/Cable, Clubhouse, Exercise Facilities, Pool, Exterior Maintenance, Lawn Care, Snow Removal	Trump	Luis Martinez	(312) 588-8082x0000														Full					20X14	25X16	10X09		COMBO	No additional rooms				09/21/2016				
RN	401	N	Wabash	AVE	29D	Chicago	Illinois	60611	8008	Cook	TRUMP TOWER CHICAGO	299	299	758	Condo, High Rise (7+ Stories)	89	2008	09410933	ACTV										84	84														29		1046	Estimated					3	1	1	0	1	1	1.1	0	0	Attached	None	None	Visit the 3D Virtual Reality Tour with Matterport Technology, CLICK on the VIRTUAL REALITY BUTTON, & Walk Around! Lowest condo floor in the building! Trump Tower Chicago! Great North Views of Chicago Skyline and beautiful sunsets! Master suite with full bath - Air-jet Tub & Separate Shower. Half bath with laundry closet. Lovely Chef's Kitchen with views overlooking the Living/Dining area. In-town residence or corporate rental w/hotel service! Indoor Pool included! Although this unit is located on a terrace floor, this unit has no outside access!			Central Air	Electric, Zoned			No	Oven/Range, Microwave, Dishwasher, Refrigerator, Washer, Dryer, Disposal		Door Person, Elevator, Health Club, On Site Manager/Engineer, Pool-Indoors, Receiving Room, Restaurant, Sauna, Service Elevator, Valet/Cleaner, Curbs/Gutters, Sidewalks, Street Lights																Hardwood	Hardwood	Full	Hardwood				12X18	15X17	11X10			Foyer	Whirlpool			01/02/2017				
AT	401	N	Wabash	AVE	63D	Chicago	Illinois	60611	8008	Cook		299	299	486	Condo, High Rise (7+ Stories)	89	2008	09472005	ACTV		1595000	1595000		1595000					125	80	17101350381912	No			23716.08		2015	1491	No		Yes	No		63		2022	Builder	0		0	S (South), W (West), City	5	2	2	0	2	1	2.1	2	1	Attached	None	None	Breathtaking views from this 2,022 sq ft 2 bedroom, 2.5 bathroom complete with 2 fireplaces, floor to ceiling 10ft glass wall of windows, hardwood floors, and in unit washer/dryer. Chefs kitchen fully equipped with Miele, Snaidero, and Sub-zero appliances. Enjoy the 5 star amenities of Trump Hotel: Room service, maid service, world class health club, Trump spa and much more. Parking available.	Monthly assessment listed does not include a monthly charge for the supplemental reserve fund in the amount of $220.85 for the unit and $10.31 for the parking. This charge will conclude in December 2020. Parking space #97, tax is $1,113.42. Storage #4409.		Central Air	Electric, Zoned		Hardwood Floors, Laundry Hook-Up in Unit	No			Elevator, Health Club, On Site Manager/Engineer, Pool-Indoors, Receiving Room, Restaurant, Sauna, Valet/Cleaner	Air Conditioning, Water, Gas, Common Insurance, Doorman, TV/Cable, Exercise Facilities, Pool, Exterior Maintenance, Lawn Care, Scavenger	Trump Management	Christine Blevins	(312) 588-8301		Yes												Full		15X15			20X17	19X19	14X11		09X08	No additional rooms	Separate Shower, Double Sink, Soaking Tub			01/06/2017				
RN	401	N	WABASH	AVE	53C	Chicago	Illinois	60611	8008	Cook		299	299	486	Condo, High Rise (7+ Stories)	92	2008	09477847	ACTV										71	71														53		934	Estimated	0		0	N (North), W (West), City, Lake/Water	4	1	1	0	1	1	1.1		1	Attached	None	None	HIGH FLOOR FURNISHED 1 BR/1.5 BA, AVAILABLE APRIL 1ST IN TRUMP TOWER! PANORAMIC VIEWS, AS FAR AS YOU CAN SEE. SURPRISING GREAT LAKE VIEWS UP THE LAKEFRONT!  EXTRA HIGH CEILINGS, HARDWOOD FLOORS, CHERRY KITCHEN W/GRANITE BAR, SUBZERO, STAINLESS MIELE & WOLF APPLCS, MARBLE BTHS W/SEP SHR & WHIRLPOOL TUB. WORLD CLASS HEALTH CLUB + 5 STAR AMENITIES INCL. PARKING AVAILABLE FROM GARAGE.	LEASE PROCESSING FEE TO BE PAID BY RENTER.  OWNER PAYING MOVE IN AND OUT FEES.		Central Air, Zoned	Electric, Zoned		Hardwood Floors, Laundry Hook-Up in Unit	No	Oven/Range, Microwave, Dishwasher, Refrigerator, Freezer, Washer, Dryer		Bike Room/Bike Trails, Door Person, Exercise Room, Storage, Health Club, Pool-Indoors, Receiving Room, Restaurant, Sauna, Steam Room														TV-Cable, Fire Sprinklers		Hardwood	Hardwood	Full	Hardwood				14X13	17X14	14X9		COMBO	No additional rooms	Whirlpool, Separate Shower	Combined w/ LivRm		01/15/2017				
RN	401	N	Wabash	AVE	79C	Chicago	Illinois	60611	8008	Cook	Trump Tower Chicago	299	299	486	Studio	89	2008	09478985	ACTV										341	69														79		713	Builder	0		0	W (West)	2	0	0	0	1	0	1	0	1	Attached	None	None	Immaculately designed and highly upgraded, this very large studio on the 79th floor of the Trump Tower has got it all! Stunning views of the lake and skyline with 10" floor-to-ceiling windows. Professionally designed - perfect for an in town or weekend getaway home. Hardwood floors throughout. Enjoy all the fabulous Trump hotel amenities, gym, spa. This is a fully furnished unit. Additional $300 for 1 parking space.	Tenant pays processing fee $1200 (non-refundable). Co-op commission to be prorated accordingly for shorter term leases.		Central Air	Electric, Forced Air, Zoned		Hardwood Floors, Laundry Hook-Up in Unit, Storage	No	Oven/Range, Microwave, Dishwasher, Refrigerator, Freezer, Washer, Dryer, Disposal		Bike Room/Bike Trails, Door Person, Elevator, Exercise Room, Storage, Health Club, On Site Manager/Engineer, Party Room, Pool-Indoors, Receiving Room, Restaurant, Sauna, Service Elevator, Steam Room, Valet/Cleaner																Hardwood	Hardwood	Full						29X14	10X5			No additional rooms	Separate Shower			01/17/2017				
AT	401	N	Wabash	AVE	30G	Chicago	Illinois	60611	8008	Cook	Trump Tower Chicago	299	299	486	Condo, High Rise (7+ Stories)	89	2008	09487303	PCHG		725000	695000		695000					59	59	17101350381127				11200.49	Homeowner	2015	775	No		No	No		30		1314	Builder	0		0	S (South), W (West)	4	1	1	0	1	1	1.1	0			None	None	Stunning oversized 1 bedroom unit at Trump Tower with over 1,300 sqft. Floor to ceiling windows provide the most beautiful sunset views. Large master suite with private sitting area and amazing closet space. The Master bath is complete with whirlpool tub, walk in shower, and double vanity. Open gourmet kitchen with Miele, Wolf, and SubZero stainless steel appliances, granite counters, and Snaidero Italian cabinets. 5 Star hotel amenities include Concierge service, health club and spa, pool, and more			Central Air	Electric, Forced Air, Zoned		Hardwood Floors, Laundry Hook-Up in Unit, Storage		Oven/Range, Microwave, Dishwasher, Refrigerator, Freezer, Washer, Dryer, Disposal		Bike Room/Bike Trails, Door Person, Elevator, Exercise Room, Storage, Health Club, On Site Manager/Engineer, Party Room, Pool-Indoors, Receiving Room, Restaurant, Sauna, Service Elevator, Steam Room, Valet/Cleaner	Water, Gas, Common Insurance, Security, Doorman, TV/Cable, Exercise Facilities, Pool, Exterior Maintenance, Lawn Care, Scavenger, Snow Removal	Trump	Christine Blevins	(312) 588-8300		Yes							Hardwood			Hardwood	Hardwood	Full	Hardwood				16X14	21X15	12X8		COMBO	No additional rooms	Separate Shower, Double Sink	Combined w/ LivRm		01/27/2017				
RN	401	N	WABASH	AVE	59A	Chicago	Illinois	60611	8008	Cook	Trump Tower Chicago	299	299	486	Condo, High Rise (7+ Stories)	89	2008	09409472	ACTV										89	89														59		3080	Builder				N (North), E (East), W (West)	7	3	3	0	3	1	3.1	3	2	Attached	None	None	Trump Tower residence:  3100 sqft, Prestigious A tier 3 BR, 3.5 Bath + a family room with sweeping views of the lake & river,  Enjoy world class east/lake views from huge floor-to-ceiling windows, 10 ft ceilings & superior quality finishes. Hardwood floors & 3 fireplaces. Amazing master suite with fireplace, spa bath & 2 huge walk-in closets. Trump offers 5 star services: spa/health club, indoor pool, restaurant & more! 2 prime parking spaces available.	Parking spaces P236 and P237 additional. Photos are from another unit in the same tier.		Central Air	Electric, Forced Air, Zoned		Hardwood Floors, Laundry Hook-Up in Unit	No	Oven/Range, Microwave, Dishwasher, Refrigerator, Freezer, Washer, Dryer		Bike Room/Bike Trails, Door Person, Elevator, Exercise Room, Health Club, On Site Manager/Engineer, Party Room, Pool-Indoors, Receiving Room, Restaurant, Sauna, Service Elevator, Steam Room, Valet/Cleaner		Trump Management	Christine Blevins	(312) 588-8300				Hardwood	Hardwood							Hardwood	Hardwood	Full	Hardwood	14X16	19X12		16X18	34X22	16X15		COMBO	Den	Separate Shower, Double Sink			12/28/2016				
AT	401	N	Wabash	AVE	79C	Chicago	Illinois	60611	8008	Cook	Trump Tower Chicago	299	299	486	Condo, High Rise (7+ Stories), Studio	89	2008	09475039	ACTV		600000	589000		589000					584	75	17101350381892				9725.59	None	2015	593	No		Yes	No		79		713	Estimated	0		0	W (West)	2	0	0	0	1	0	1	0			None	None	Large condominium studio, located on the 79th floor at Trump International Hotel & Tower. Immaculately designed & highly upgraded, ~713 sq ft condo with stunning views of the lake & skyline, framed by 10 floor to ceiling windows. Unit is perfect as an in-town or weekend getaway home. Double size Murphy bed built in to shelving in living area. Enjoy all the city has to offer as well as the world class, 5-star hotel amenities; 75 indoor heated pool, 23,000 sq ft, state of the art health club & spa, valet, dry cleaners, concierge service as well as easy access to the Riverwalk & restaurants located in the building. Owner is willing to sell the unit fully furnished.	Buyer to pay all building processing fees. Assessment does not include the monthly charge for the supplemental reserve fund  that will conclude in December 2020.		Central Air	Electric, Forced Air, Zoned		Hardwood Floors, Laundry Hook-Up in Unit, Storage		Oven/Range, Microwave, Dishwasher, Refrigerator, Freezer, Washer, Dryer, Disposal		Bike Room/Bike Trails, Door Person, Elevator, Exercise Room, Storage, Health Club, On Site Manager/Engineer, Party Room, Pool-Indoors, Receiving Room, Restaurant, Sauna, Service Elevator, Steam Room, Valet/Cleaner	Water, Gas, Common Insurance, Security, Doorman, TV/Cable, Exercise Facilities, Pool, Exterior Maintenance, Lawn Care, Scavenger, Snow Removal	Trump Management	Christine Blevins	(312) 588-8301		Yes										Hardwood	Hardwood	Full						29X14	10X5			No additional rooms	Separate Shower			01/11/2017				
RN	401	N	Wabash	AVE	37J	Chicago	Illinois	60611	8008	Cook	Trump Tower Chicago	299	299	486	Condo, High Rise (7+ Stories), Studio	89	2009	09472180	ACTV										80	80														37		2076	Builder	0		0	S (South), E (East), City, Lake/Water, Park	5	2	2	0	2	1	2.1	1	0	Attached	None	None	Stunning views of lake, river, Millennium Park.  Extra large 2 bedroom/2.5 bathroom. Chicago's finest luxury building, Trump Tower Chicago. South East facing, 10' Ft ceilings, panoramic skyline views from the floor to ceiling windows. Open gourmet kit with custom appliances, spa like master bath. Enjoy all of the 5 star amenities of resort style living.	Note: Photos are of another unit with an identical floor plan.		Central Air	Electric			No			Bike Room/Bike Trails, Door Person, Elevator, Exercise Room, On Site Manager/Engineer, Pool-Indoors, Receiving Room		Trump	Melissa Wulf	(312) 588-8300				Hardwood					Hardwood			Hardwood	Hardwood	Full	Hardwood	13X17			17X17	17X16	10X13		COMBO	No additional rooms				01/06/2017				
AT	401	N	WABASH	AVE	73G	Chicago	Illinois	60611	8008	Cook		299	299	486	Condo, High Rise (7+ Stories)	89	2008	09481765	ACTV		940000	897000		897000					66	66	17101350382028				18243.00		2015	1061	No		No	No		73		1314	Builder	0		0	S (South), W (West)	4	1	1	0	1	1	1.1		3	Attached	None	None	Deluxe 1 Bed + den, 1.1 baths with 1314 sqft. Stunning City + River views from 10' floor to ceiling windows. Versatile den/office area. Enormous Master Suite with huge WIC. Luxury Master Spa with air bath - separate shower and double vanity. Separate laundry + storage. Brazilian Cherry floors throughout. Open Kitchen with Miele, Wolf, Sub-Zero. Center island with granite counters + breakfast bar. 3 Deeded parking spaces on the 8th floor @ additional $$- #P400-#P401 & tandem #P491. Trump 5 Star amenities! Freshly painted ready for move in! Luxury Living at it's finest!	3  PREMIUM 8th floor  PARKING SPACES AVAILABLE  FOR PURCHASE. P400- 70K, P401 -70K AND TANDEM P491 -110K.     Asmt Reserve: UNIT $157.19-Parking-  P400$10.31, P401 $10.31 AND P491D $20.42.  Vacant unit EASY to show!		Central Air, Zoned	Electric, Zoned		Hardwood Floors	No	Oven/Range, Microwave, Dishwasher, High End Refrigerator, Washer, Dryer, Disposal, All Stainless Steel Kitchen Appliances		Bike Room/Bike Trails, Door Person, Elevator, Exercise Room, Storage, Health Club, On Site Manager/Engineer, Pool-Indoors, Receiving Room, Service Elevator	Air Conditioning, Water, Gas, Security, Doorman, TV/Cable, Exercise Facilities, Pool, Exterior Maintenance, Lawn Care, Scavenger, Snow Removal	Tower Management	Christine Blevins	(312) 581-8301							70000		Hardwood			Hardwood	Hardwood	Full	Hardwood				16X14	21X15	12X7		COMBO	No additional rooms	Whirlpool, Separate Shower, Double Sink	Combined w/ LivRm		01/20/2017				
AT	401	N	Wabash	AVE	1936	Chicago	Illinois	60611	8008	Cook	TRUMP TOWER CHICAGO	299	299	485	Condo	89	2008	09478351	ACTV		785000	785000		785000					70	70	17101350391264				7094	None	2015	3393	No		No	No		19		1220	Builder	0		0	S (South), E (East)	4	1	1	0	2	0	2	0	0	Attached	None	None	Rare opportunity to own a large 1 bedroom w/ 2 full baths in Chicago's premier luxury building. Stunning water and city views, Impeccably furnished with luxury finishes. Spacious LR/ DR Area with separate kitchen and huge bedroom + Spa Bath. Trump Hotel 5 Star Amenities inc white gloves services , fitness center and Trump Spa. Program option available to owner. Ideal in-town or Corporate Suite.	Please note this is a hotel unit - not a residential unit. 48 Hour notice needed. Showings can only take place at 2 pm Monday - Friday depending on the unit availability.		Central Air	Electric			No	Microwave, Refrigerator		Door Person, Elevator, Exercise Room, Health Club, On Site Manager/Engineer, Pool-Indoors, Restaurant, Sauna, Security Door Locks, Service Elevator, Valet/Cleaner, Curbs/Gutters, Sidewalks, Street Lights, Street Paved	Heat, Air Conditioning, Water, Electric, Gas, Tax, Security, Doorman, TV/Cable, Clubhouse, Exercise Facilities, Pool, Exterior Maintenance, Lawn Care, Snow Removal	Trump	Luis Martinez	(312) 588-8082x0000														Full					20X14	25X16	10X09		COMBO	No additional rooms				01/16/2017				
AT	401	N	WABASH	AVE	65B	Chicago	Illinois	60611	8008	Cook	Trump Tower Chicago	299	299	483	Condo, High Rise (7+ Stories)	89	2008	09485294	ACTV		775000	775000		775000					61	61	17101350381840	No			11353.40	Homeowner	2015	941	No		No	No		65		923	Other	0		0	N (North), W (West), City, Lake/Water, Park	4	1	1	0	1	1	1.1	0	1	Attached	None	None	A Unique floor- Extraordinary 12' Windows & Ceilings-Dazzling Views of Lake Michigan, Shoreline to Wisconsin, Iconic Architecture, Twinkling Lights, Starry Nights & City Lights - Riff Cut Oak Kitchen Cabinets with Top Appliances - Master Suite w/Spa Bath, Shower & Customized Walk-In Closet - Lutron Remote Window System - Luxurious Lifestyle, Services, 5 Star Spa, Club & Hotel - Ovrszd Prkg at Elevator Available.	Parking space close to elevator and no adjacent spaces. Parking Space P-236 additional $75,000 PIN: 17-10-135-038-1446 (2015 taxes $1,113.42).		Central Air	Electric, Indv Controls		Elevator, Hardwood Floors, Laundry Hook-Up in Unit, Storage	No	Oven/Range, Microwave, Dishwasher, Refrigerator, Washer, Dryer, Disposal		Door Person, Elevator, Exercise Room, Storage, Health Club, On Site Manager/Engineer, Park/Playground, Pool-Indoors, Receiving Room, Curbs/Gutters, Sidewalks, Street Lights, Street Paved, Other	Air Conditioning, Water, Gas, Common Insurance, Security, Doorman, TV/Cable, Exercise Facilities, Pool, Exterior Maintenance, Lawn Care, Scavenger, Snow Removal	Trump	Christine Blevins	(312) 588-8300							75000		Hardwood	TV-Cable, Fire Sprinklers, CO Detectors		Hardwood	Hardwood	Full	Hardwood				15X14	17X15	09X09		COMBO	Foyer	Whirlpool, Separate Shower	Combined w/ LivRm	Storms/Screens	01/25/2017				
RN	401	N	WABASH	AVE	75C	Chicago	Illinois	60611	8008	Cook		299	299	486	Condo, Studio	89	2009	09474264	ACTV										261	76														75		750	Landlord/Tenant/Seller	0		0	N (North), W (West)	3	0	0	0	1	0	1		100	Attached	None	None	*** ATTN RENTERS : SPECIAL LIMITED TIME OFFER : 1 MO FREE For A Lease Accepted By March 01, 2017 *** Chicago's Most Romantic + Mesmerizing "Room With A View! " Ultimate Trump Tower Chicago SUPERPAD Features Sweeping Lake and City Views ! Sparkling Captivating Views At Night!   Luxurious Finishes Beautiful Within As Out ( Snaidero, Brazilian Cherry Hardwood Floors, Miele ... ). Over Sized Floorplan Lends Itself Well To Separate Living / Sleeping ....Full Service Full Amenity Including Room Service, Spa, Fitness Center, Concierge, Doorperson, Sixteen Restaurant, Rebar, Terrace At Trump, Hotel Services, etc... Michigan Avenue At Your Door ! Rent Includes Fitness/Spa Membership Value $ 350/mo. The  Ultimate Gold Coast Exclusive Lifestyle Can Be Yours. (Also Available Furnished If Desired At Alternate Pricing )	Bonus = total of 1Mo Coop For Lease w/in 30 days    See tenant incentive in comments.		Central Air	Forced Air			No	Oven/Range, Microwave, Dishwasher, High End Refrigerator, Freezer, Washer, Dryer, Disposal, All Stainless Steel Kitchen Appliances, Cooktop, Oven/Built-in, Range Hood		Door Person, Coin Laundry, Exercise Room, Storage, On Site Manager/Engineer, Pool-Indoors, Receiving Room, Service Elevator, Steam Room, Curbs/Gutters, Sidewalks, Street Lights, Street Paved																Hardwood	Hardwood	None						27X13	10X5		COMBO	No additional rooms				01/10/2017				
